question,answer,contexts,ground_truth,answer_correctness
Wer ist Modulverantwortliche/r im Modul Funktionalanalysis?,Prof. Dr. Delio Mugnolo,"['Die Studierenden kennen grundlegende Methoden der Funktionalanalysis und koennen  sie anwenden. Die Funktionalanalysis hat sich zur Grundlagenwissenschaft von großen Bereichen der  Mathematik entwickelt und findet Anwendung in vielen Gebieten innerhalb und  außerhalb der Mathematik. Ziel dieser Lehrveranstaltung ist, eine Einfuehrung in das  große Gebiet der Funktionalanalysis zu geben. Folgende Stichworte, die gleichzeitig  Titel der Lektionen sind, umreißen den Inhalt der Lehrveranstaltung: -Metrische Raeume -Normierte Raeume -Lineare Operatoren -Funktionale und schwache Konvergenz -Lebesgue -und Sobolevraeume -Hilbertraeume -Spektraltheorie Lektionstext in englischer Sprache! Frueherer Titel: Funktionalanalysis IModul 61211 ""Analysis""in jedem Wintersemester B.Sc. Mathematik'
 'Titel der Lektionen sind, umreißen den Inhalt der Lehrveranstaltung: -Metrische Raeume -Normierte Raeume -Lineare Operatoren -Funktionale und schwache Konvergenz -Lebesgue -und Sobolevraeume -Hilbertraeume -Spektraltheorie Lektionstext in englischer Sprache! Frueherer Titel: Funktionalanalysis IModul 61211 ""Analysis""in jedem Wintersemester B.Sc. Mathematik B.Sc. Mathematisch-technische Softwareentwicklung M.Sc. Data Science M.Sc. Mathematik Stellenwert  der Note1/12keine benotete muendliche Pruefung (ca. 25  Minuten)PruefungVoraussetzung Art der Pruefungsleistung Pruefungsformen Modulhandbuch M.Sc. Data Science'
 'Funktionalanalysis ein Semester 10 300 StundenLehrende/r Modulverantwortliche/r Workload ECTS Dauer des Moduls Haeufigkeit Lehr- und  BetreuungsformenLehrveranstaltung(en) Detaillierter Zeitaufwand Qualifikationsziele Inhalte AnmerkungInhaltliche Voraussetzung Verwendung des ModulsFormale Voraussetzung keine61213 Prof. Dr. Delio Mugnolo Prof. Dr. Delio Mugnolo Lehrveranstaltungsmaterial Einsendeaufgaben mit Korrektur und/oder Musterloesung internetgestuetztes Diskussionsforum Studientag/eFunktionalanalysis Bearbeiten der Lektionen (7 mal 20 Stunden): 140 Stunden Einueben des Stoffes (insbesondere durch Einsendeaufgaben (7 mal 15 Stunden): 105  Stunden Wiederholung und Pruefungsvorbereitung (Studientag und Selbststudium): 55 Stunden'
 'Wahlpflichtmodule: Bachelormodule im Masterstudiengang Modulhandbuch M.Sc. Data Science'
 'Wahlpflichtmodule: Mastermodule Modulhandbuch M.Sc. Data Science']",Prof. Dr. Delio Mugnolo.,0.6193083010159193
Was sind die inhaltlichen Voraussetzungen fuer das Modul Lineare Optimierung?,"Die inhaltlichen Voraussetzungen fuer das Modul ""Lineare Optimierung"" sind die Module 61111 ""Mathematische Grundlagen"", 61211 ""Analysis"" und insbesondere sehr gute Kenntnisse des Moduls 61112 ""Linearen Algebra"".","['Weiter diskutieren wir die Ellipsoidmethode und ihre Bedeutung fuer die  kombinatorische Optimierung sowie das Karmarkar -Verfahren und Innere -Punkt - Methoden. -Das Modul setzt die Module 61111 ""Mathematische Grundlagen"", 61211 ""Analysis""  und insbesondere sehr gute Kenntnisse des Moduls 61112 ""Linearen Algebra"" voraus.in jedem Sommersemester B. Gaertner, J. Matousek: Understanding and Using Linear Programming, Springer - Verlag, 2006 G. M. Ziegler: Polyhedral Theory, A. Schrijver: Theory of Linear and Integer  Programming, WILEY, 1998 C. Roos, T. Terlaky, J. -P. Vial: Interior Point Methods for Linear Optimization, Springer - Verlag, 2005Ergaenzende Literatur: B.Sc. Informatik B.Sc. Mathematik B.Sc. Mathematisch-technische Softwareentwicklung Modulhandbuch M.Sc. Data Science'
 'Lineare Optimierung ein Semester 10 300 StundenLehrende/r Modulverantwortliche/r Workload ECTS Dauer des Moduls Haeufigkeit Lehr- und  BetreuungsformenLehrveranstaltung(en) Detaillierter Zeitaufwand Qualifikationsziele Inhalte AnmerkungInhaltliche Voraussetzung Verwendung des ModulsFormale Voraussetzung keine61412 Prof. Dr. Winfried  HochstaettlerProf. Dr. Winfried  Hochstaettler Lehrveranstaltungsmaterial Studientag/e internetgestuetztes Diskussionsforum Zusatzmaterial Betreuung und Beratung durch Lehrende Einsendeaufgaben mit Korrektur und/oder MusterloesungLineare Optimierung Bearbeiten der Lektionen (7 mal 18 Stunden): 126 Stunden Einueben des Stoffes (insbesondere durch Einsendeaufgaben (7 mal 15 Stunden):  105 Stunden'
 'Verfahren. Zunaechst stellen wir die Aufgabenstellung vor, modellieren verschiedene Probleme als  Lineares Programm und loesen diese mit Standardsoftware. Dann stellen wir die  Dualitaetstheorie mitsamt der zugehoerigen Linearen Algebra vor. Im Folgenden  analysieren wir die Seitenflaechenstruktur von Polyedern und diskutieren das  Simplexverfahren, seine Varianten und zugehoerige Komplexitaetsuntersuchungen.  Weiter diskutieren wir die Ellipsoidmethode und ihre Bedeutung fuer die  kombinatorische Optimierung sowie das Karmarkar -Verfahren und Innere -Punkt - Methoden. -Das Modul setzt die Module 61111 ""Mathematische Grundlagen"", 61211 ""Analysis""  und insbesondere sehr gute Kenntnisse des Moduls 61112 ""Linearen Algebra"" voraus.in jedem Sommersemester'
 'Pruefungsvorbereitung: 75 Stunden In beiden Lehrveranstaltungen erlangen die Studierenden fundierte Kenntnisse sowohl  der theoretischen, mathematischen Grundlagen als auch der vorgestellten, an - wendungsorientierten Konzepte und Methoden. Die Studierenden besitzen ein solides  Wissen ueber digitale Signalverarbeitungsmethoden, z.B. die Fouriertransformation und  die derzeit wichtigsten Verfahren der Bildverarbeitung. Darueber hinaus kennen die  Studierenden weiterfuehrende Datenverarbeitungsmethoden wie z.B.  Clusteringverfahren oder die Verwendung probabilistischer Modelle. Desweiteren  besitzen die Studierenden Kenntnisse ueber Methoden der dreidimensionalen  Bildrekonstruktion sowie Verfahren der linearen und nicht -linearen Optimierung.'
 'Die Studierenden koennen lineare Optimierungsaufgaben modellieren, in Normalformen  bringen und dualisieren. Sie kennen Polyedertheorie als Geometrie der linearen  Optimierung. Sie kennen die Algebra und die Geometrie des Simplexverfahrens und  zugehoerige komplexitaetstheoretische Ueberlegungen zur Linearen Optimierung. Sie  kennen Bedeutung und Vorgehensweise der Ellipsoidmethode und von Innere -Punkt - Verfahren. Zunaechst stellen wir die Aufgabenstellung vor, modellieren verschiedene Probleme als  Lineares Programm und loesen diese mit Standardsoftware. Dann stellen wir die  Dualitaetstheorie mitsamt der zugehoerigen Linearen Algebra vor. Im Folgenden  analysieren wir die Seitenflaechenstruktur von Polyedern und diskutieren das']","Das Modul setzt die Module 61111 Mathematische Grundlagen, 61211 Analysis und insbesondere sehr gute Kenntnisse des Moduls 61112 Linearen Algebra voraus.",0.612803222836252
Gibt es Anmerkungen fuer das Modul Architektur und Implementierung von Datenbanksystemen?,"Ja, es gibt eine Anmerkung im Modulhandbuch: Das Modul 63122 ""Architektur und Implementierung von Datenbanksystemen"" ist nicht zusammen mit dem frueheren Modul 63111 ""Vertiefende Konzepte von Datenbanksystemen"" (vor dem Wintersemester 2020/21) verwendbar.","['Lehrveranstaltungsmaterial Betreuung und Beratung durch Lehrende Einsendeaufgaben mit Korrektur und/oder Musterloesung internetgestuetztes Diskussionsforum Video-Meetings LehrvideosArchitektur und Implementierung von Datenbanksystemen Bearbeiten der Lektionen: 160 Stunden Bearbeitung der Einsendeaufgaben inkl. Verarbeitung des Korrektur -Feedbacks:  80 Stunden Wiederholung und Pruefungsvorbereitung, Pruefung: 60 Stunden Studierende erwerben in diesem Modul einen guten Ueberblick wie auch  Detailkenntnisse der Architektur und Implementierung von Datenbanksystemen. Sie  koennen die Schichtenarchitektur und die Aufgaben der jeweiligen Komponenten der  Implementierung erlaeutern. Sie koennen verschiedene Indexstrukturen im Detail'
 'Architektur und Implementierung von Datenbanksystemen ein Semester 10 300 StundenLehrende/r Modulverantwortliche/r Workload ECTS Dauer des Moduls Haeufigkeit Lehr- und  BetreuungsformenLehrveranstaltung(en) Detaillierter Zeitaufwand Qualifikationsziele Inhalte AnmerkungInhaltliche Voraussetzung Verwendung des ModulsFormale Voraussetzung keine63122 Prof. Dr. Uta Stoerl Prof. Dr. Uta Stoerl Lehrveranstaltungsmaterial Betreuung und Beratung durch Lehrende Einsendeaufgaben mit Korrektur und/oder Musterloesung internetgestuetztes Diskussionsforum Video-Meetings LehrvideosArchitektur und Implementierung von Datenbanksystemen Bearbeiten der Lektionen: 160 Stunden Bearbeitung der Einsendeaufgaben inkl. Verarbeitung des Korrektur -Feedbacks:  80 Stunden'
 '80 Stunden Wiederholung und Pruefungsvorbereitung, Pruefung: 60 Stunden Studierende erwerben in diesem Modul einen guten Ueberblick wie auch  Detailkenntnisse der Architektur und Implementierung von Datenbanksystemen. Sie  koennen die Schichtenarchitektur und die Aufgaben der jeweiligen Komponenten der  Implementierung erlaeutern. Sie koennen verschiedene Indexstrukturen im Detail  erklaeren. Die Schritte der Verarbeitung einer SQL -Anfrage in der Optimierung und  Planerzeugung koennen von ihnen beschrieben werden. Sie koennen erklaeren, wann  verzahnte Ablaeufe von Transaktionen als korrekt anzusehen sind und wie der  Transaktionsmanager des Datenbanksystems sicherstellt, dass nur solche Ablaeufe  zugelassen werden. Sie koennen erklaeren, wie nach Systemabstuerzen der korrekte'
 '-Externspeicher -und Systempufferverwaltung -Indexstrukturen   -Anfrageverarbeitung und Optimierung, insbesondere die Ermittlung eines    kostenguenstigen Plans fuer einen gegebene SQL -Anfrage -Transaktionsmanagement im Mehrbenutzerbetrieb  -Ausfallsicherheit und Wiederherstellung nach Fehlern von Soft -und Hardware   (Recovery) -Verteilte Datenbankarchitekturen Das Modul 63122 ""Architektur und Implementierung von Datenbanksystemen"" ist  nicht zusammen mit dem frueheren Modul 63111 ""Vertiefende Konzepte von  Datenbanksystemen"" (vor dem Wintersemester 2020/21) verwendbar.Kenntnisse der Konzepte von Standard -Datenbanksystemen, z.B. aus dem Modul  63012 ""Softwaresysteme"", 63017 ""Datenbanken und Sicherheit im Internet"" oder  63118 ""Datenbanken"" in jedem Sommersemester'
 'nicht zusammen mit dem frueheren Modul 63111 ""Vertiefende Konzepte von  Datenbanksystemen"" (vor dem Wintersemester 2020/21) verwendbar.Kenntnisse der Konzepte von Standard -Datenbanksystemen, z.B. aus dem Modul  63012 ""Softwaresysteme"", 63017 ""Datenbanken und Sicherheit im Internet"" oder  63118 ""Datenbanken"" in jedem Sommersemester Modulhandbuch M.Sc. Data Science']",Ja! Das Modul 63122 Architektur und Implementierung von Datenbanksystemen ist nicht zusammen mit dem frueheren Modul 63111 Vertiefende Konzepte von Datenbanksystemen (vor dem Wintersemester 2020/21) verwendbar.,0.7431531254525999
Welche Art der Pruefungsleistung gibt es im Modul Kommunikations- und Rechnernetze?,Eine benotete muendliche Pruefung (ca. 25 Minuten) gibt es im Modul Kommunikations- und Rechnernetze.,"['Kommunikations- und Rechnernetze ein Semester 10 300 StundenLehrende/r Modulverantwortliche/r Workload ECTS Dauer des Moduls Haeufigkeit Lehr- und  BetreuungsformenLehrveranstaltung(en) Detaillierter Zeitaufwand Qualifikationsziele Inhalte AnmerkungInhaltliche Voraussetzung Verwendung des ModulsFormale Voraussetzung keine64311 Prof. Dr. Herwig Unger Marcel SchaibleProf. Dr. Herwig Unger Lehrveranstaltungsmaterial Einsendeaufgaben mit Korrektur und/oder Musterloesung Betreuung und Beratung durch Lehrende internetgestuetztes Diskussionsforum Studientag/e LehrvideosKommunikations- und Rechnernetze Bearbeiten der Lektionen (7 mal 20 Stunden): 140 Stunden Einueben des Stoffes (insbesondere durch Einsendeaufgaben (7 mal 15 Stunden):  105 Stunden'
 'Verwendung des Moduls M.Sc. Data Science Stellenwert  der Note1/12benotete muendliche Pruefung (ca. 25  Minuten)PruefungVoraussetzung Art der Pruefungsleistung Pruefungsformen Modulhandbuch M.Sc. Data Science'
 'Stellenwert  der Note1/12benotete Seminarteilnahme  (Ausarbeitung und Vortrag)PruefungVoraussetzung Art der Pruefungsleistung Pruefungsformen Modulhandbuch M.Sc. Data Science'
 'Stellenwert  der Note1/12Keine benotete Praktikumsteilnahme  (Ausarbeitung und Vortrag)PruefungVoraussetzung Art der Pruefungsleistung Pruefungsformen Modulhandbuch M.Sc. Data Science'
 'Verwendung des Moduls B.Sc. Mathematik B.Sc. Mathematisch-technische Softwareentwicklung M.Sc. Data Science M.Sc. Informatik M.Sc. Mathematik M.Sc. Praktische Informatik Stellenwert  der Note1/12keine benotete muendliche Pruefung (ca. 25  Minuten)PruefungVoraussetzung Art der Pruefungsleistung Pruefungsformen Modulhandbuch M.Sc. Data Science']",Benotete zweistuendige Pruefungsklausur.,0.5903499504972587
Wie haeufig wird das Masterseminar Verteilte Systeme und kooperative Systeme angeboten?,"Das Masterseminar ""Verteilte Systeme und kooperative Systeme"" wird einmal pro Semester angeboten.","['Masterseminar Verteilte Systeme und kooperative Systeme ein Semester 10 300 StundenLehrende/r Modulverantwortliche/r Workload ECTS Dauer des Moduls Haeufigkeit Lehr- und  BetreuungsformenLehrveranstaltung(en) Detaillierter Zeitaufwand Qualifikationsziele Inhalte AnmerkungInhaltliche Voraussetzung63276 Prof. Dr. Joerg M. Haake Prof. Dr. Christian Icking Dr. Lihong MaProf. Dr. Joerg M. Haake internetgestuetztes Diskussionsforum Zusatzmaterial Betreuung und Beratung durch Lehrende Video-MeetingsMasterseminar Verteilte Systeme und kooperative Systeme Erstellung des Seminarbeitrags 240 Stunden Erstellung Praesentation 50 Stunden Teilnahme an Praesentationen und Diskussion 10 Stunden Die Studierenden kennen vertieft ein Thema aus der Informatik auf dem Niveau ihres'
 'internetgestuetztes Diskussionsforum Zusatzmaterial Betreuung und Beratung durch Lehrende Video-MeetingsMasterseminar Verteilte Systeme und kooperative Systeme Erstellung des Seminarbeitrags 240 Stunden Erstellung Praesentation 50 Stunden Teilnahme an Praesentationen und Diskussion 10 Stunden Die Studierenden kennen vertieft ein Thema aus der Informatik auf dem Niveau ihres  jeweiligen Studiengangs. Sie koennen dazu relevante Literatur recherchieren, eine  schriftliche Ausarbeitung strukturieren und nach wissenschaftlichen Kriterien verfassen.  Das Ergebnis koennen Sie auf Praesentationsfolien darstellen und muendlich praesentieren.  Sie kennen relevante Literaturquellen sowie die Grundlagen wissenschaftlichen  Arbeitens und der Praesentation von Arbeitsergebnissen.'
 'In diesem Seminar wollen wir aktuelle Themen aus den Bereichen der verteilten  Systeme, des kooperativen Arbeitens (CSCW) oder kooperativen Lernens (CSCL)  bearbeiten, die ueber den Inhalt der Module 63211 ""Verteilte Systeme"", 63214  ""Computerunterstuetztes kooperatives Arbeiten und Lernen"" und 63215 ""Gestaltung  Kooperativer Systeme"" hinausgehen. Themenvorschlaege der Teilnehmenden koennen ggfs. auch beruecksichtigt werden. Je  nach Thema und technischen Moeglichkeiten sollen auch Systeme vorgefuehrt werden. Fuer die Teilnahme an einem Seminar ist ein gesondertes Anmeldeverfahren im  Vorsemester ueber folgenden Link erforderlich: https://webregis.fernuni -hagen.de .  Eigene Recherche zum Thema ist wesentlich, Materialauswahl nach Absprache mit den  Betreuenden.'
 'jeweiligen Studiengangs. Sie koennen dazu relevante Literatur recherchieren, eine  schriftliche Ausarbeitung strukturieren und nach wissenschaftlichen Kriterien verfassen.  Das Ergebnis koennen Sie auf Praesentationsfolien darstellen und muendlich praesentieren.  Sie kennen relevante Literaturquellen sowie die Grundlagen wissenschaftlichen  Arbeitens und der Praesentation von Arbeitsergebnissen. In diesem Seminar wollen wir aktuelle Themen aus den Bereichen der verteilten  Systeme, des kooperativen Arbeitens (CSCW) oder kooperativen Lernens (CSCL)  bearbeiten, die ueber den Inhalt der Module 63211 ""Verteilte Systeme"", 63214  ""Computerunterstuetztes kooperatives Arbeiten und Lernen"" und 63215 ""Gestaltung  Kooperativer Systeme"" hinausgehen.'
 'nach Thema und technischen Moeglichkeiten sollen auch Systeme vorgefuehrt werden. Fuer die Teilnahme an einem Seminar ist ein gesondertes Anmeldeverfahren im  Vorsemester ueber folgenden Link erforderlich: https://webregis.fernuni -hagen.de .  Eigene Recherche zum Thema ist wesentlich, Materialauswahl nach Absprache mit den  Betreuenden. Bitte geben Sie bei der Anmeldung an, ob Sie die inhaltlichen und formalen  Voraussetzungen erfuellen, Sie sich mehr fuer den Themenbereich Verteilte Systeme,  CSCW oder CSCL interessieren und begruenden Sie Ihr spezielles Interesse an  bestimmten Themen. Sie koennen dort auch eine Wunschpartnerin bzw. einen  Wunschpartner fuer die Gruppenarbeit nennen. Bitte beachten Sie die allgemeinen  Hinweise zur Seminaranmeldung. Es werden 14 Plaetze vergeben.']",In jedem Sommersemester.,0.7052422688325521
Wie lauten die Pflichtmodule im Masterstudiengang Data Science?,Die Pflichtmodule im Masterstudiengang Data Science sind:  1. Mathematische Grundlagen von Data Science (4) 2. Data Engineering fuer Data Science (6) 3. Einfuehrung in Maschinelles Lernen (8) 4. Einfuehrung in Data Science (10),"['Wahlpflichtmodule: Bachelormodule im Masterstudiengang Modulhandbuch M.Sc. Data Science'
 'Wahlpflichtmodule: Mastermodule Modulhandbuch M.Sc. Data Science'
 'Pflichtmodule Modulhandbuch M.Sc. Data Science'
 'Inhaltsverzeichnis Pflichtmodule 3 Wahlpflichtmodule: Bachelormodule im Masterstudiengang 12 Wahlpflichtmodule: Mastermodule 44 Projektpraktika 87 Masterseminare 94 Abschlussmodul 115 Detailliertes Inhaltsverzeichnis 117 Modulhandbuch M.Sc. Data Science'
 'Inhaltsverzeichnis Pflichtmodule 3 Mathematische Grundlagen von Data Science 4 Data Engineering fuer Data Science 6 Einfuehrung in Maschinelles Lernen 8 Einfuehrung in Data Science 10 Wahlpflichtmodule: Bachelormodule im Masterstudiengang 12 Algebra 13 Funktionalanalysis 15 Partielle Differentialgleichungen 16 Parametrische Statistik 17 Lineare Optimierung 18 Diskrete Mathematik 20 Nichtlineare Optimierung 22 Wahrscheinlichkeitstheorie 24 Data Mining 26 Architektur und Implementierung von Datenbanksystemen 28 Verteilte Systeme 30 Einfuehrung in Mensch-Computer-Interaktion 32 Interaktive Systeme 34 Parallel Programming 36 Betriebliche Informationssysteme 38 Entscheidungsmethoden in unternehmensweiten Softwaresystemen 40 Wissensbasierte Systeme 42 Wahlpflichtmodule: Mastermodule 44']","Die Pflichtmodule lauten Mathematische Grundlagen von Data Science, Data Engineering fuer Data Science, Einfuehrung in Maschinelles Lernen und Einfuehrung in Data Science.",
Wie oft kann ich die Masterpruefung wiederholen?,Nach § 19 Absatz (1) kann jede Modulabschlusspruefung zweimal wiederholt werden.,"['Masterseminar Natural Computing 112 Masterseminar Kuenstliche Intelligenz 113 Masterseminar Data Science 114 Abschlussmodul 115 Modulhandbuch M.Sc. Data Science'
 'Kurs 01877  Einsendeaufgaben  zu Kurseinheit  3  - 5 -      Frage  7      https://www.freeformatter.com/xpath -tester.html'
 'Masterseminar Sprachtechnologie 98 Masterseminar Modellierung und Verifikation 100 Masterseminar Datenbanksysteme - Discovering Big Data 101 Masterseminar Smart Mobility 102 Masterseminar Algorithmische Geometrie 104 Masterseminar Verteilte Systeme und kooperative Systeme 106 Masterseminar Usability Engineering fuer Unternehmensanwendungen: Konzeption, Ums 108 Masterseminar Ausgewaehlte Themen aus dem Bereich der Mensch-Computer-Interaktio 109 Masterseminar Parallelverarbeitung und IT-Sicherheit 110 Masterseminar Rechnerarchitektur 111 Modulhandbuch M.Sc. Data Science'
 '</p>    <p class=""P"">      Eine erste <a class=""A"">Ausschreibung</a>      des Programms ist bereits erfolgt. Interessierte          Kursleiterin nen und -leiter k&ouml;nnen ihr Kursangebot       bis zum 5.11.1999 abgeben.      Bitte benutzen Sie dazu unser      <a class=""A"">Formular</a>. Die ersten Kurse sollen noch      im November 1999 stattfinden. Bei Bedarf erfolgt eine       zweite Ausschreibung, zu der neue Kursangebote abgegeben      werden k&ouml;nnen, Anfang Dezember 1999.      Die Ausschreibung des Programms, die Gestaltung des      Kursangebots sowie die Ank&uuml;ndigung der Kurse erfolgt          durch das Frauenb&uuml;ro      in Zusammenarbeit mit den  Studierendenvertretungen,      den Studiendekanen und den Frauenbeauftragten.'
 'sind.  § 19 Wiederholung der Masterpruefung   (1) Jede Modulabschlusspruefung kann bei  Nichtbestehen jew eils zweimal wiederholt wer- den.  (2) Eine bereits bestandene oder anerkannte  Modulabschlusspruefung kann nicht wiederholt  werden.   (3) Dieselben  an der FernUniversitaet in Hagen  absolvierten Modulabschlusspruefungen, die au- ßerhalb des Studiengangs erbracht wurden, werden einschließlich der Fehlversuche mit Note  uebernommen.   (4) Die Masterarbeit kann bei Nichtbes tehen  einmal wiederholt werden.   (5) Im Wiederho lungsfall ist eine Rueckgabe des  Themas der Masterarbeit in der in § 14 Absatz 5 genannten Frist nur zulaessig, wenn die/der  Studierende bei der Anfertigung der ersten  Masterarbeit von dieser Moeglichke it keinen Ge-']",Jede Modulabschlusspruefung kann bei Nichtbestehen jeweils zweimal wiederholt werden. Die Masterarbeit kann bei Nichtbestehen einmal wiederholt werden.,0.8336483941206472
Wie lang darf die Masterarbeit maximal sein?,Die Masterarbeit soll ohne Anlagen im Regelfall einen Umfang von 120 DIN-A4-Seiten nicht ueberschreiten.,"['(3) Die Masterarbeit soll ohne Anlagen im Re- gelfall einen Umfang von 120 DIN -A4-Seiten  nicht ueberschreiten.   (4) Die Bearbeitungszeit fuer die Masterarbeit  betraegt sechs Monate. Das Thema und die Auf- gabenstellung der Masterarbeit muessen so be-schaffen sein, dass die Bearbeitungszeit einge-halten werden kann. Ausnahmsweise kann auf begruendeten Antrag die Abgabefrist von dem  Pruefungsamt im Einvernehmen mit der Themen- stellerin/dem Themensteller um hoechstens sechs Wochen verlaengert werden.  (5) Das Thema kann nur einmal und nur inner- halb des ersten Monats der Bearbei tungszeit zu- rueckgegeben werden.   (6) Die Masterarbeit kann von jeder Prueferin/je- dem Pruefer gemaeß §  7 Absatz 1 ausgegeben  werden.  Der/Dem Studierenden ist Gelegenheit'
 'Wahlpflichtmodule: Mastermodule Modulhandbuch M.Sc. Data Science'
 'Wahlpflichtmodule: Bachelormodule im Masterstudiengang Modulhandbuch M.Sc. Data Science'
 'Masterseminar Natural Computing 112 Masterseminar Kuenstliche Intelligenz 113 Masterseminar Data Science 114 Abschlussmodul 115 Modulhandbuch M.Sc. Data Science'
 'The seminar is structured as follows: In the first face -to-face session at the beginning of  the semester (TBD), you will be given an overview of various ethical issues in the field of  language problems, language technology and AI in general. In the following phase, you  will deal intensively with the current state of research on a specific problem. This  includes independent research for relevant, current publications (predominantly in  English) and a written paper. At the attendance date towards the end of the semester  (date TBD), you will present your results to the other participants in a presentation and  give each other feedback. Fuer die Teilnahme an einem Seminar ist ein gesondertes Anmeldeverfahren im']",Die Masterarbeit soll ohne Anlagen im Regelfall einen Umfang von 120 DIN-A4-Seiten nicht ueberschreiten.,1.0000000000000004
Wie lautet der Mastergrad bei bestehen der Masterpruefung im Studiengang Data Science?,Der Mastergrad bei Bestehen der Masterpruefung im Studiengang Data Science ist M.Sc. (Master of Science).,"['Wahlpflichtmodule: Bachelormodule im Masterstudiengang Modulhandbuch M.Sc. Data Science'
 'Wahlpflichtmodule: Mastermodule Modulhandbuch M.Sc. Data Science'
 'Masterseminar Natural Computing 112 Masterseminar Kuenstliche Intelligenz 113 Masterseminar Data Science 114 Abschlussmodul 115 Modulhandbuch M.Sc. Data Science'
 'Inhaltsverzeichnis Pflichtmodule 3 Wahlpflichtmodule: Bachelormodule im Masterstudiengang 12 Wahlpflichtmodule: Mastermodule 44 Projektpraktika 87 Masterseminare 94 Abschlussmodul 115 Detailliertes Inhaltsverzeichnis 117 Modulhandbuch M.Sc. Data Science'
 'Stellenwert  der Note1/12benotete Seminarteilnahme  (Ausarbeitung und Vortrag)PruefungVoraussetzung Art der Pruefungsleistung Pruefungsformen Modulhandbuch M.Sc. Data Science']","Ist die Masterpruefung bestanden, verleiht die Fa-kultaet fuer Mathematik und Informatik den Grad „Master of Science“, abgekuerzt „M.Sc.“, in Data Science.",
