question,answer,contexts,ground_truth,answer_relevancy,faithfulness,context_recall,context_precision,answer_correctness
Wie kann ich ein Frontend mit Python programmieren?,"Hallo!  Ich sehe, dass du dich nach einem Framework zum Erstellen eines Frontends mit Python erkundigst. Leider finden sich in diesem Kontext keine Informationen ueber die Programmierung eines Frontends mit Python.  Ich entschuldige mich, da ich keine Antwort auf deine Frage habe. Wenn du Hilfe bei der Suche nach geeigneten Frameworks oder Tools benoetigst, stehe ich gerne zur Verfuegung!","['Kurs 01877  Einsendeaufgaben  zu Kurseinheit  3  - 5 -      Frage  7      https://www.freeformatter.com/xpath -tester.html'
 'Inhaltsverzeichnis 1. Einleitung 2. XSL-Transformationen 3. XQuery 4. Anhang 5. Literatur 6. Loesungen der Selbsttestaufgaben'
 'Inhaltsverzeichnis 1. Einleitung 2. Motivation und Einfuehrung 3. Einfuehrung zu Semantik und RDF 4. RDF Schemata 5. Erzeugung von Ontologien mittels OWL 6. Metadaten 7. Anhang 8. Literatur 9. Loesungen der Selbsttestaufgaben'
 'The seminar is structured as follows: In the first face -to-face session at the beginning of  the semester (TBD), you will be given an overview of various ethical issues in the field of  language problems, language technology and AI in general. In the following phase, you  will deal intensively with the current state of research on a specific problem. This  includes independent research for relevant, current publications (predominantly in  English) and a written paper. At the attendance date towards the end of the semester  (date TBD), you will present your results to the other participants in a presentation and  give each other feedback. Fuer die Teilnahme an einem Seminar ist ein gesondertes Anmeldeverfahren im'
 'font-size: small;   font-weight: bold;   text-align: right;   margin-top: 0pt;   margin-bottom: 0pt;   }    .Briefkopf {   margin-bottom: 2em;   }    img {  width: 100%;   }    p {  margin-top: 0pt;   margin-bottom: 0pt;   }    a:link {   color: red;   text-decoration: none;   }    a:active {   color: yellow;   text-decoration: none;   }    a:visited {   color: green;   text-decoration: none;   }']","Lieber Benutzer, leider gibt es in diesem Kontext keine Informationen zur Programmierung eines Frontends mit Python.",0.0,0.16666666666666666,1.0,0.0,0.4833743286180952
Wie viele Menschen weltweit nutzten das Internet im Jahr 1990?,"Leider habe ich keine Informationen, die auf eine Antwort auf Ihre Frage hindeuten. Der Kontext enthaelt keine relevanten Angaben ueber die Anzahl der Menschen, die das Internet im Jahr 1990 nutzten. Ich entschuldige mich, da ich keine Antwort auf diese Frage haben kann.","['(1989). Publisher: Wiley Online Library, pp. 54–66.   [MRS08]  Christopher D. Manning, Prabhakar Raghavan, and Hinrich Schuetze. Introduction to  information retrieval. New York: Cambridge University Press, 2008. ISBN: 978- 0-521- 86571 -5.  [Naw21 ] Christian Nawroth, Supporting Information Retrieval of Emerging Knowledge and  Argumentation, Dissertation, FernUniversitaet in Hagen, eingereicht zur Begutachtung  und Veroeffentlichung, 2021   [BOB82 ] BELKIN, N.J., ODDY, R.N. and BROOKS, H.M. (1982), ""ASK FOR INFORMATION RET- RIEVAL: PART I. BACKGROUND AND THEORY"", Journal of Documentation, Vol. 38  No. 2, pp. 61- 71. https://doi.org/10.1108/eb026722'
 ""6. Index Aggregation Boole'schen Retrieval  Dateneinheit  Datenintegration  Datentypkonflikt  Deep Web Deskribierung  different value ranges Disambiguierung  Domaenenkonflikte  Entity-Relationship-Modell Funktionsintegration  Hypernym  Hyponym  Information Retrieval  information sharing Integritaetskonflikt latent semantic analysis Mediatoren  Meronym  missing values  multilateral attribute correspondences  multilateral entity correspondances  Namenskonflikte  overlap  Relevance Feedback""
 '[WD00]  K. Whistler and M. Davis. Character encoding model. Unicode Tech nical Report 17- 3.1, Unicode, Inc., August 2000.   [P01]  Peter Constable. Character set encoding basics. NRSI: Computer & Writing Sys- tems,2001.   [Kuh89]    Rainer Kuhlen. Pragmatischer Mehrwert von Information. Sprachspiele   mit informationswissenschaftlichen  Grundbegriffen. Universitaet Konstanz / Informati- onswissenschaft: Bericht;89,1. Konstanz: Universitaet Konstanz, 1989. URL: http://nbn-resolving.de/urn:nbn:de:bsz:352- 247844.   [Wil95]  Patrick Wilson. “Unused relevant information in research and development”. In: Jour-nal of the American society for Information Science 46.1 (1995), pp. 45– 51. ISSN:  0002- 8231   [NT95]  I. Nonaka and H. Takeuchi, The Knowledge- Creating Company: How Japanese C om-'
 'Kurs 01877  Einsendeaufgaben  zu Kurseinheit  3  - 5 -      Frage  7      https://www.freeformatter.com/xpath -tester.html'
 '<title>Advanced  Programming  in the Unix environment</title>   </book>   </bib>     Waehlen  Sie eine Antwort:   <bib>   <book year=""1994"">   <title>TCP/IP  Illustrated</title>   <author><last>Stevens</last><first> W.</first></author>   <publisher>Addison -Wesley</publisher>   <price>65.95</price>   </book>   <book year=""1992"">   <title>Advanced  Programming  in the Unix environment</title>   <author><last>Stevens</last><first>W.</first></author>   <publisher>Addison -Wesley</publisher>   <price>65.95</price>   </book>   <book  year=""2000"">   <title>Data  on the Web</title>   <author><last>Abiteboul</last><first>Serge</first></author>   <author><last>Buneman</l ast><first>Peter</first></author>   <author><last>Suciu</last><first>Dan</first></author>']","Lieber Benutzer, leider gibt es in diesem Kontext keine Informationen ueber die Verwendung des Internets im Jahr 1990.",0.0,1.0,1.0,0.0,0.2235773277402291
"Welche Machine Learning Methoden kann man einsetzen, um Kunden eines Online-Shops zu klassifizieren?","Hallo! Als HagenCopilot bin ich hier, um dir bei deinem Masterseminar in Natural Computing zu helfen.   Die Frage, wie man Kunden eines Online-Shops zu klassifizieren kann, ist ein interessantes Thema im Bereich Machine Learning.   Eine moegliche Loesung besteht darin, die Kunden anhand von Merkmalen wie Alter, Geschlecht, Kaufverhalten, Interessen usw. zu klassifizieren. Hierbei koenntest du verschiedene Machine Learning Methoden einsetzen, wie zum Beispiel:  * Clustering-Verfahren (z.B. k-Means), um Kunden in Gruppen mit aehnlichen Eigenschaften zusammenzufassen * Decision Trees oder Random Forests, um die Klassen von Kunden auf Basis von Merkmalen zu bestimmen * Neuronale Netze, wie z.B. Convolutional Neural Networks (CNN) oder Recurrent Neural Networks (RNN), um die Klassen von Kunden anhand von Zeitreihen-Daten oder anderen komplexen Strukturen zu bestimmen * Bayes-Netze, um die Wahrscheinlichkeit fuer eine bestimmte Klasse von Kunden abzuschaetzen  Es gibt viele weitere Moeglichkeiten, je nach den spezifischen Anforderungen deines Online-Shops und der Qualitaet der verfuegbaren Daten. Es ist wichtig zu beachten, dass die Wahl der geeignetsten Machine Learning-Methode anhand von Testdaten und Evaluierung der Modelle bestimmt werden sollte.  Ich hoffe, diese Antwort hilft dir bei deinem Masterseminar in Natural Computing!","['Masterseminar Natural Computing 112 Masterseminar Kuenstliche Intelligenz 113 Masterseminar Data Science 114 Abschlussmodul 115 Modulhandbuch M.Sc. Data Science'
 'Inhaltsverzeichnis 1. Einleitung 2. XSL-Transformationen 3. XQuery 4. Anhang 5. Literatur 6. Loesungen der Selbsttestaufgaben'
 'Kurs 01877  Einsendeaufgaben  zu Kurseinheit  3  - 5 -      Frage  7      https://www.freeformatter.com/xpath -tester.html'
 'Inhaltsverzeichnis 1. Einleitung 2. Motivation und Einfuehrung 3. Einfuehrung zu Semantik und RDF 4. RDF Schemata 5. Erzeugung von Ontologien mittels OWL 6. Metadaten 7. Anhang 8. Literatur 9. Loesungen der Selbsttestaufgaben'
 'Wahlpflichtmodule: Mastermodule Modulhandbuch M.Sc. Data Science']","Lieber Benutzer, leider gibt es in diesem Kontext keine Informationen zum Thema Machine Learning Methoden, um Kunden eines Online-Shops zu klassifizieren.",0.8688438746047589,0.0,0.0,0.0,0.9729985499992164
Was sind Cookies?,"Hallo! Als HagenCopilot bin ich hier, um dir bei deinem Fernstudium zu helfen. Leider findest du in diesem Kontext keine Informationen ueber Cookies. Dieser Begriff ist auch nicht im Zusammenhang mit XSL-Transformationen oder XQuery, die in deiner Kurseinheit 3 behandelt werden.  Ich entschuldige mich, da ich keine Antwort auf deine Frage habe. Wenn du weitere Fragen zum Thema XQuery oder XSL-Transformation hast, stehe ich gerne zur Verfuegung!","['Inhaltsverzeichnis 1. Einleitung 2. XSL-Transformationen 3. XQuery 4. Anhang 5. Literatur 6. Loesungen der Selbsttestaufgaben'
 'Kurs 01877  Einsendeaufgaben  zu Kurseinheit  3  - 5 -      Frage  7      https://www.freeformatter.com/xpath -tester.html'
 ""6. Index Aggregation Boole'schen Retrieval  Dateneinheit  Datenintegration  Datentypkonflikt  Deep Web Deskribierung  different value ranges Disambiguierung  Domaenenkonflikte  Entity-Relationship-Modell Funktionsintegration  Hypernym  Hyponym  Information Retrieval  information sharing Integritaetskonflikt latent semantic analysis Mediatoren  Meronym  missing values  multilateral attribute correspondences  multilateral entity correspondances  Namenskonflikte  overlap  Relevance Feedback""
 'font-size: small;   font-weight: bold;   text-align: right;   margin-top: 0pt;   margin-bottom: 0pt;   }    .Briefkopf {   margin-bottom: 2em;   }    img {  width: 100%;   }    p {  margin-top: 0pt;   margin-bottom: 0pt;   }    a:link {   color: red;   text-decoration: none;   }    a:active {   color: yellow;   text-decoration: none;   }    a:visited {   color: green;   text-decoration: none;   }'
 'XML-Dokument. </Kapitel> </Inhalt> </buch>']","Lieber Benutzer, leider gibt es in diesem Kontext keine Informationen zum Thema Cookies.",0.0,0.5,1.0,0.0,0.4679523094555895
Was ist das One-Time-Pad Verfahren?,"Liebe(r) Benutzer,  Ich entschuldige mich, da der Kontext keine Informationen ueber das One-Time-Pad-Verfahren enthaelt. Wir sind uns in dem Text ueber XSL-Transformationen und Kurseinheit 3 begeben, aber das One-Time-Pad-Verfahren wird nicht erwaehnt.  Ich habe leider keine Antwort auf Ihre Frage, da dies ein externer Kontext ist, der nichts mit dem Thema des Fernstudiums oder dem Kurs 01877 zu tun hat. Sollten Sie weitere Fragen zu Inhalten Ihres Kurses haben, stehe ich Ihnen gerne zur Verfuegung.","['Kurs 01877  Einsendeaufgaben  zu Kurseinheit  3  - 5 -      Frage  7      https://www.freeformatter.com/xpath -tester.html'
 'Inhaltsverzeichnis 1. Einleitung 2. XSL-Transformationen 3. XQuery 4. Anhang 5. Literatur 6. Loesungen der Selbsttestaufgaben'
 '</p>    <p class=""P"">      Eine erste <a class=""A"">Ausschreibung</a>      des Programms ist bereits erfolgt. Interessierte          Kursleiterin nen und -leiter k&ouml;nnen ihr Kursangebot       bis zum 5.11.1999 abgeben.      Bitte benutzen Sie dazu unser      <a class=""A"">Formular</a>. Die ersten Kurse sollen noch      im November 1999 stattfinden. Bei Bedarf erfolgt eine       zweite Ausschreibung, zu der neue Kursangebote abgegeben      werden k&ouml;nnen, Anfang Dezember 1999.      Die Ausschreibung des Programms, die Gestaltung des      Kursangebots sowie die Ank&uuml;ndigung der Kurse erfolgt          durch das Frauenb&uuml;ro      in Zusammenarbeit mit den  Studierendenvertretungen,      den Studiendekanen und den Frauenbeauftragten.'
 ""}      /* Hier die spezifischen Styles: */   body {      font-family: 'Trebuchet MS', 'Lucida Grande', 'Lucida Sans  Unicode', 'Lucida Sans', Tahoma, sans -serif;      line-height: 1.6;       color: blue;       background -color: lightyellow;   }    .page-wrapper {       /*    Lesefluss opimieren durch Zeilenbreite begrenzen! */       max-width: 60em;       margin: 0 auto;       padding: 5% 10%;   }        h1,""
 'The seminar is structured as follows: In the first face -to-face session at the beginning of  the semester (TBD), you will be given an overview of various ethical issues in the field of  language problems, language technology and AI in general. In the following phase, you  will deal intensively with the current state of research on a specific problem. This  includes independent research for relevant, current publications (predominantly in  English) and a written paper. At the attendance date towards the end of the semester  (date TBD), you will present your results to the other participants in a presentation and  give each other feedback. Fuer die Teilnahme an einem Seminar ist ein gesondertes Anmeldeverfahren im']","Lieber Benutzer, leider gibt es in diesem Kontext keine Informationen zum Thema One-Time-Pad Verfahren.",0.0,0.3333333333333333,1.0,0.0,0.9786774569709442
Was ist ein VPN-Client?,"Ich entschuldige mich, da der Kontext keine Informationen ueber VPN-Client enthaelt. Ich habe leider keine Antwort auf Ihre Frage.","['Inhaltsverzeichnis 1. Einleitung 2. XSL-Transformationen 3. XQuery 4. Anhang 5. Literatur 6. Loesungen der Selbsttestaufgaben'
 'Kurs 01877  Einsendeaufgaben  zu Kurseinheit  3  - 5 -      Frage  7      https://www.freeformatter.com/xpath -tester.html'
 'Inhaltsverzeichnis 1. Einleitung 2. Motivation und Einfuehrung 3. Einfuehrung zu Semantik und RDF 4. RDF Schemata 5. Erzeugung von Ontologien mittels OWL 6. Metadaten 7. Anhang 8. Literatur 9. Loesungen der Selbsttestaufgaben'
 ""time, mark, audio, video {       margin: 0;       padding: 0;       border: 0;       font-size: 100%;       font: inherit;       vertical -align: baseline;   }    /* HTML5 display -role reset for older browsers (IE8 etc) */   article, aside, details, figcaption, figure, footer, header,  hgroup, menu, nav, section {       display: block;   }  table {      border-collapse: collapse;       border-spacing: 0;   }      /* Hier die spezifischen Styles: */   body {      font-family: 'Trebuchet MS', 'Lucida Grande', 'Lucida Sans  Unicode', 'Lucida Sans', Tahoma, sans -serif;      line-height: 1.6;       color: blue;       background -color: lightyellow;   }    .page-wrapper {       /*    Lesefluss opimieren durch Zeilenbreite begrenzen! */       max-width: 60em;       margin: 0 auto;""
 ""}      /* Hier die spezifischen Styles: */   body {      font-family: 'Trebuchet MS', 'Lucida Grande', 'Lucida Sans  Unicode', 'Lucida Sans', Tahoma, sans -serif;      line-height: 1.6;       color: blue;       background -color: lightyellow;   }    .page-wrapper {       /*    Lesefluss opimieren durch Zeilenbreite begrenzen! */       max-width: 60em;       margin: 0 auto;       padding: 5% 10%;   }        h1,""]","Lieber Benutzer, leider gibt es in diesem Kontext keine Informationen zum Thema VPN-Client.",0.0,0.0,1.0,0.0,0.5292462078284269
Wer ist Barack Obama?,"Entschuldigung, ich bin HagenCopilot, ein virtueller Assistent fuer das Fernstudium. Ich habe leider keine Informationen zum Thema Barack Obama in unserem Kurs ""Einsendeaufgaben"" zu Kurseinheit 3. Die Inhalte des Kurses befassen sich mit XSL-Transformationen, XQuery und RDF (Resource Description Framework). Es gibt auch keine Verbindung zwischen den Stilvorlagen und Barack Obama. Ich kann Ihnen also leider keine hilfreiche Antwort auf Ihre Frage geben.","['Inhaltsverzeichnis 1. Einleitung 2. XSL-Transformationen 3. XQuery 4. Anhang 5. Literatur 6. Loesungen der Selbsttestaufgaben'
 'Inhaltsverzeichnis 1. Einleitung 2. Motivation und Einfuehrung 3. Einfuehrung zu Semantik und RDF 4. RDF Schemata 5. Erzeugung von Ontologien mittels OWL 6. Metadaten 7. Anhang 8. Literatur 9. Loesungen der Selbsttestaufgaben'
 'Kurs 01877  Einsendeaufgaben  zu Kurseinheit  3  - 5 -      Frage  7      https://www.freeformatter.com/xpath -tester.html'
 'font-size: small;   font-weight: bold;   text-align: right;   margin-top: 0pt;   margin-bottom: 0pt;   }    .Briefkopf {   margin-bottom: 2em;   }    img {  width: 100%;   }    p {  margin-top: 0pt;   margin-bottom: 0pt;   }    a:link {   color: red;   text-decoration: none;   }    a:active {   color: yellow;   text-decoration: none;   }    a:visited {   color: green;   text-decoration: none;   }'
 ""}      /* Hier die spezifischen Styles: */   body {      font-family: 'Trebuchet MS', 'Lucida Grande', 'Lucida Sans  Unicode', 'Lucida Sans', Tahoma, sans -serif;      line-height: 1.6;       color: blue;       background -color: lightyellow;   }    .page-wrapper {       /*    Lesefluss opimieren durch Zeilenbreite begrenzen! */       max-width: 60em;       margin: 0 auto;       padding: 5% 10%;   }        h1,""]","Lieber Benutzer, leider gibt es in diesem Kontext keine Informationen zum Thema Barack Obama.",0.0,0.3,0.0,0.0,
In welchem Jahr begann der 1. Weltkrieg?,"Ich entschuldige mich, da im Kontext keine Informationen ueber den Ersten Weltkrieg gefunden werden konnten. Ich habe auch keinen Bezug zur Kurseinheit 3 und den Einsendeaufgaben. Da ich keine relevante Information zum Thema finden konnte, kann ich leider keine Antwort auf Ihre Frage geben.","['Kurs 01877  Einsendeaufgaben  zu Kurseinheit  3  - 5 -      Frage  7      https://www.freeformatter.com/xpath -tester.html'
 'The seminar is structured as follows: In the first face -to-face session at the beginning of  the semester (TBD), you will be given an overview of various ethical issues in the field of  language problems, language technology and AI in general. In the following phase, you  will deal intensively with the current state of research on a specific problem. This  includes independent research for relevant, current publications (predominantly in  English) and a written paper. At the attendance date towards the end of the semester  (date TBD), you will present your results to the other participants in a presentation and  give each other feedback. Fuer die Teilnahme an einem Seminar ist ein gesondertes Anmeldeverfahren im'
 ""6. Index Aggregation Boole'schen Retrieval  Dateneinheit  Datenintegration  Datentypkonflikt  Deep Web Deskribierung  different value ranges Disambiguierung  Domaenenkonflikte  Entity-Relationship-Modell Funktionsintegration  Hypernym  Hyponym  Information Retrieval  information sharing Integritaetskonflikt latent semantic analysis Mediatoren  Meronym  missing values  multilateral attribute correspondences  multilateral entity correspondances  Namenskonflikte  overlap  Relevance Feedback""
 '</p>    <p class=""P"">      Eine erste <a class=""A"">Ausschreibung</a>      des Programms ist bereits erfolgt. Interessierte          Kursleiterin nen und -leiter k&ouml;nnen ihr Kursangebot       bis zum 5.11.1999 abgeben.      Bitte benutzen Sie dazu unser      <a class=""A"">Formular</a>. Die ersten Kurse sollen noch      im November 1999 stattfinden. Bei Bedarf erfolgt eine       zweite Ausschreibung, zu der neue Kursangebote abgegeben      werden k&ouml;nnen, Anfang Dezember 1999.      Die Ausschreibung des Programms, die Gestaltung des      Kursangebots sowie die Ank&uuml;ndigung der Kurse erfolgt          durch das Frauenb&uuml;ro      in Zusammenarbeit mit den  Studierendenvertretungen,      den Studiendekanen und den Frauenbeauftragten.'
 'font-size: small;   font-weight: bold;   text-align: right;   margin-top: 0pt;   margin-bottom: 0pt;   }    .Briefkopf {   margin-bottom: 2em;   }    img {  width: 100%;   }    p {  margin-top: 0pt;   margin-bottom: 0pt;   }    a:link {   color: red;   text-decoration: none;   }    a:active {   color: yellow;   text-decoration: none;   }    a:visited {   color: green;   text-decoration: none;   }']","Lieber Benutzer, leider gibt es in diesem Kontext keine Informationen zum Thema 1. Weltkrieg.",0.0,0.0,0.0,0.0,0.5967745046229265
