question,answer,contexts,ground_truth,answer_relevancy,faithfulness,context_recall,context_precision,answer_correctness
Was ist Monitoring (nach Bates)?,"Laut Bates [Bat02, p. ...] und anderen Quellen ist Monitoring eine Form der Informationssuche, die den aktiven Aufbau von Hintergrundwissen zu Interessengebieten und moeglichen zukuenftigen Fragestellungen zum Ziel hat.","['antworten und das Informationsbeduerfnis zu befriedigen ,  • Monitoring als aktiver Aufbau von Hintergrundwissen zu Interessengebieten und moeglichen zukuenftigen moeglichen Fragestellungen,  • Browsing als das Gegenteil von Monitoring, um neues Wissen ohne konkre-tes Informationsbeduerfnis durch aktive Auseinandersetzung mit neuen Inhal-ten zu erwerben ,  • allgemeine Aufmerksamkeit (d) als ungerichtete und passive Form der Infor-mationsbeschaffung. Laut Bates „gives us 80 percent of all we know”.   Da Dokumente Information und somit auch Wissen beinhalten, wird an dieser  Stelle außerdem das sogenannt e SECI -Modell betrachtet.  Das SECI -Modell'
 'Literaturverzeichnis  59    [Bat02]  Marcia J. Bates. “Toward an in tegrated model of information seeking and searching”.  In: The New Review of Information Behaviour Research 3.1 (2002), pp. 1– 15.  [Bat10 ] Marcia J. Bates. “Information behavior”. In: Encyclopedia of library and information  sciences 3 (2010). Publisher: CRC  press New York, pp. 2381– 2391.   [Bat79 ] Marcia J. Bates. “Information search tactics”. In: Journal of the American Society for  information Science 30.4 (1979). Publisher: Wiley Online Library, pp. 205– 214.  [Bat89 ] Marcia J. Bates. “The design of browsing and berrypicking techniques for the online  search interface”. In: Online review 13.5 (1989), pp. 407–424.   [Mar89 ] Gary Marchionini. “Information- seeking strategies of novices using a full -text elec-'
 'Fertig formatiertes Dokument fuer ein Journal    11      Abbildung 4.1 Modi der Informationssuche  [Bat02]   Dabei wird zwischen aktiver und passiver, sowie gerichteter und ungerichteter Su- che unterschieden. Entlang dieser Dimensionen unterscheidet Bates:   • direkte Suche als aktive Versuche, Fragen zu einem speziellen Thema zu be- antworten und das Informationsbeduerfnis zu befriedigen ,  • Monitoring als aktiver Aufbau von Hintergrundwissen zu Interessengebieten und moeglichen zukuenftigen moeglichen Fragestellungen,  • Browsing als das Gegenteil von Monitoring, um neues Wissen ohne konkre-tes Informationsbeduerfnis durch aktive Auseinandersetzung mit neuen Inhal-ten zu erwerben ,'
 'tempt to communicate the information need”.   Das aus einem ASK resultierende Informationsbedue rfnis stellt somit eine wichtige  Anwendung der automatisierten Dokumentverarbeitung dar. Computersysteme, die  durch automatische Dokumentverarbeitung Informationsbeduerfnisse erfuellen koen- nen, indem sie  relevantes Wissen in den Dokumenten suchen, heißen Informations- systeme. Umgangssprachlich werden  sie oft als Suchmaschinen bezeichnet.   Diese  implizite  Beschreibung einer  Interaktion  eines  Nutzers  mit einer  Suchmaschine   waehrend  des Versuchs  das ASK zu formulieren , wird als „Informational  Behaviour“   bezeichnet.  Laut Bates  [Bat10,  p. 2078]  besteht  Informational  Behaviour aus der'
 'systeme. Umgangssprachlich werden  sie oft als Suchmaschinen bezeichnet.   Diese  implizite  Beschreibung einer  Interaktion  eines  Nutzers  mit einer  Suchmaschine   waehrend  des Versuchs  das ASK zu formulieren , wird als „Informational  Behaviour“   bezeichnet.  Laut Bates  [Bat10,  p. 2078]  besteht  Informational  Behaviour aus der  Interaktion von Nutzern mit Informationssystemen, der Frage, wie und wann sie Information suchen und was die  Nutzer daraus machen.   Weiterhin stellt sie fest, dass der Vorgang des Suchens a n sich ein interessantes For- schungsgebiet darstellt. In diesem  Forschungsgebiet wurden daher verschiedene  Suchstrategien („Information Seeking“, „Information Searching“)  beschrieben. Im']",Monitoring ist aktiver Aufbau von Hintergrundwissen zu Interessengebieten und moeglichen zukuenftigen Fragestellungen.,0.7764515301838033,1.0,,0.99999999998,0.7305580413651251
Wozu benoetigt man eine Zeichenkodierung?,"Eine Zeichenkodierung benoetigt man, um die Glatten Texte in Bits und Bytes umzusetzen. Das bedeutet, dass sie festlegt, wie die verschiedenen Zeichen, wie Buchstaben, Ziffern und Interpunktionszeichen, in ein Computerprogramm uebertragen werden sollen.","['[WD00]  K. Whistler and M. Davis. Character encoding model. Unicode Tech nical Report 17- 3.1, Unicode, Inc., August 2000.   [P01]  Peter Constable. Character set encoding basics. NRSI: Computer & Writing Sys- tems,2001.   [Kuh89]    Rainer Kuhlen. Pragmatischer Mehrwert von Information. Sprachspiele   mit informationswissenschaftlichen  Grundbegriffen. Universitaet Konstanz / Informati- onswissenschaft: Bericht;89,1. Konstanz: Universitaet Konstanz, 1989. URL: http://nbn-resolving.de/urn:nbn:de:bsz:352- 247844.   [Wil95]  Patrick Wilson. “Unused relevant information in research and development”. In: Jour-nal of the American society for Information Science 46.1 (1995), pp. 45– 51. ISSN:  0002- 8231   [NT95]  I. Nonaka and H. Takeuchi, The Knowledge- Creating Company: How Japanese C om-'
 'Unterwegs im Internet. Broschuere A/003/0811, Universitaetsrechenzentrum FernUni-versitaet Hagen, August 2011.   [FSS82]  R. Furuta, J. Scofield, and A. Shaw. Document formatting: Survey, concepts, and is-sues.  Computing Surveys, 14(3):417–172, September 1982   [MvD82]  N. Meyrowitz and A. van Dam. Interactive editing systems (Parts I and II). Computing Surveys, 14(3):321 –415, September 1982.   [WD00]  K. Whistler and M. Davis. Character encoding model. Unicode Tech nical Report 17- 3.1, Unicode, Inc., August 2000.   [P01]  Peter Constable. Character set encoding basics. NRSI: Computer & Writing Sys- tems,2001.   [Kuh89]    Rainer Kuhlen. Pragmatischer Mehrwert von Information. Sprachspiele   mit informationswissenschaftlichen  Grundbegriffen. Universitaet Konstanz / Informati-'
 'Grundlagen    64  Selbsttestaufgabe  1.6  Was versteht man unter dem Beg riff ""Glatter Text""? Wozu benoetigt man in diesem Zusammenhang  eine Zeichencodierung?   Sogenannt er „Glatter Text“ ist eine Folge von elementaren Texteinheiten wie Buchstaben, Ziffern,  Interpunktionszeichen und anderen Zeichen. Er enthaelt keinerlei Formatierungsangaben oder sonstige  spezielle Steuerzeichen der  Textcodierung oder Markierungen bezueglich der Strukturauszeichnung.   Eine Zeichen codierung  gibt die Vorschrift dazu an, wie diese  Zeichen  in Bits und Bytes  umgesetzt   werden.   Selbsttestaufgabe  1.7  Welches sind die Bestandteile des im Kurstext beschriebenen generischen Zeichensatzmodells ? Erlaeu- tern Sie diese kurz in eigenen Worten.   Die einzelnen  Bestandteile des Codierungsmodells  sind:'
 'Kurs 01877  Einsendeaufgaben  zu Kurseinheit  3  - 5 -      Frage  7      https://www.freeformatter.com/xpath -tester.html'
 'Inhaltsverzeichnis 1. Einleitung 2. XSL-Transformationen 3. XQuery 4. Anhang 5. Literatur 6. Loesungen der Selbsttestaufgaben']",Die Textzeichen muessen in Bits und Bytes kodiert werden. Eine ZeichenCodierung gibt dazu eine Vorschrift an.,0.8295327066030982,1.0,1.0,0.9999999999666667,0.7231444844112184
Welche Zeichenkodierung ist am bekanntesten?,"Liebe(r) Studienpartner(in),  Die Frage nach der bekanntesten Zeichenkodierung beantwortet sich leicht. Nach den vorliegenden Informationen ist die Unicode-Codierung die bekannteste und wichtigste fuer die Dokumentrepraesentation im Internet. Die Unicode-Technische Report 17-3.1 von Whistler und Davis (2000) behandelt das Charakter Encoding Model, das die Grundlage fuer die internationale Standardisierung der Textcodierung bildet.  Eine weitere wichtige Quelle ist das Werk von Constable (2001), das die Grundlagen von Character Set Encoding erklaert. Darin wird die Bedeutung von Unicode-Codierung fuer den grenzueberschreitenden Dokumentenaustausch im Internet hervorgehoben.  Ich hoffe, diese Antwort hilft dir bei deiner Studienarbeit!","['Unterwegs im Internet. Broschuere A/003/0811, Universitaetsrechenzentrum FernUni-versitaet Hagen, August 2011.   [FSS82]  R. Furuta, J. Scofield, and A. Shaw. Document formatting: Survey, concepts, and is-sues.  Computing Surveys, 14(3):417–172, September 1982   [MvD82]  N. Meyrowitz and A. van Dam. Interactive editing systems (Parts I and II). Computing Surveys, 14(3):321 –415, September 1982.   [WD00]  K. Whistler and M. Davis. Character encoding model. Unicode Tech nical Report 17- 3.1, Unicode, Inc., August 2000.   [P01]  Peter Constable. Character set encoding basics. NRSI: Computer & Writing Sys- tems,2001.   [Kuh89]    Rainer Kuhlen. Pragmatischer Mehrwert von Information. Sprachspiele   mit informationswissenschaftlichen  Grundbegriffen. Universitaet Konstanz / Informati-'
 '[WD00]  K. Whistler and M. Davis. Character encoding model. Unicode Tech nical Report 17- 3.1, Unicode, Inc., August 2000.   [P01]  Peter Constable. Character set encoding basics. NRSI: Computer & Writing Sys- tems,2001.   [Kuh89]    Rainer Kuhlen. Pragmatischer Mehrwert von Information. Sprachspiele   mit informationswissenschaftlichen  Grundbegriffen. Universitaet Konstanz / Informati- onswissenschaft: Bericht;89,1. Konstanz: Universitaet Konstanz, 1989. URL: http://nbn-resolving.de/urn:nbn:de:bsz:352- 247844.   [Wil95]  Patrick Wilson. “Unused relevant information in research and development”. In: Jour-nal of the American society for Information Science 46.1 (1995), pp. 45– 51. ISSN:  0002- 8231   [NT95]  I. Nonaka and H. Takeuchi, The Knowledge- Creating Company: How Japanese C om-'
 'Die beiden Faktoren sind das Modell der strukturierten Dokumente, dem solche digi-talen Dokumente entsprechen sol len, und die Standardisierung der Text codierung,  die Textinhalte austauschbar macht.   Beide Faktoren wurden in dieser Kurseinheit besprochen. Als dritter Faktor steht die  Standardisierung der Strukturinformation noch aus; damit werden die kommenden  Kurseinheiten im Zusammenhang mit XML und den verwandten Sprachfamilien zu tun haben.'
 'satzstandard seit Version 6.0 aufgenommen. In der kommenden Version 9.0 (neue Hauptversionen sollen regelmaeßig jedes Jahr im Juni veroeffentlicht werden) kommen viele weitere Emojis hinzu.   Die Codierung en ISO 8859 und Unicode sind von zentraler Bedeutung fuer die Do- kumentrepraesentation in den im Internet haeufig verwendeten Auszeichnungsspra- chen HTML und XML. Ohne internationale Standards fuer die Codierung universeller  Zeichensaetze waere der grenzueberschreitende Dokumentenaustausch im Internet u nd  im Web zum Scheitern  verurteilt.   Selbsttestaufgabe 1.6:'
 'Kurs 01877  Einsendeaufgaben  zu Kurseinheit  3  - 5 -      Frage  7      https://www.freeformatter.com/xpath -tester.html']",US-ASCII,0.8361706905446065,0.8,0.75,0.999999999975,0.6973563424394231
Was sind die Bestandteile des Codierungsmodells?,"Eine Frage, die direkt im Kontext beantwortet werden kann!  Die Bestandteile des Codierungsmodells sind:  • ein abstrakter Zeichensatz • eine Codetabelle • ein Codierungsformat • ein Codierungsschema • eine Uebertragungssyntax","['Kurs 01877  Einsendeaufgaben  zu Kurseinheit  1  - 4 -     Die einzelnen  Bestandteile  des Kodierungsmodells  sind:  • ein abstrakter  Zeichensatz,   • eine Codetabelle,   • ein Kodierungsformat,   • ein Kodierungsschema  und  • eine Uebertragungssyntax  Frage  8  Beschriften  Sie die fehlenden  Begriffe  im abgebilde ten „SECI“ -Modell:         Frage  9  Welches  sind die Bestandteile  des im Kurstext  beschriebenen  abstrakten  Kodierungsmodells?'
 'Eine Zeichen codierung  gibt die Vorschrift dazu an, wie diese  Zeichen  in Bits und Bytes  umgesetzt   werden.   Selbsttestaufgabe  1.7  Welches sind die Bestandteile des im Kurstext beschriebenen generischen Zeichensatzmodells ? Erlaeu- tern Sie diese kurz in eigenen Worten.   Die einzelnen  Bestandteile des Codierungsmodells  sind:  · ein abstrakter  Zeichensatz,   · eine Codetabelle,   · ein Codierungsformat,   · ein Codierungsschema  und  · eine Uebertragungssyntax   Die obere Ebene des Codierungsmodells ist der abstrakte Zeichensatz. Dieser besteht aus einer Menge  sogenannter  abstrakter Zeichen. Es handelt sich hierbei um Buchstaben, Ziffern, Interpunktionszei- chen, Akzente, grafische Symbole etc.'
 'Codierung von Zeichen in  Bitmuster strukturieren und so besser verstehen kann.  Die  einzelnen Bestandteile des Codierungsmodells sind:   • ein abstrakter Zeichensatz,   • eine Codetabelle,   • ein Codierung sformat,   • ein Codierungsschema  und  • eine Uebertragungssyntax,  die ueber sogenannt en „glatten  Text“ hinausgeht.   Die einzelnen Bestandteile des Codierungsmodells entsprechen zunehmend  konkreteren Repraesentationen von Zeichen,  von einem abstrakten Begriff hin  zu Bitmustern.  Zwischen  einer abstrakten Repraesentationsebene  und der  naechstliegenden konkreteren Repraesentationsebene  besteht eine Abbildungsvor- schrift im mathematischen  Sinne. Um ueber mehrere Ebenen hinweg von einer Zei- chenposition in einer Codetabelle direkt zu seiner Codierung in einem  Codierungs-'
 'Die beiden Faktoren sind das Modell der strukturierten Dokumente, dem solche digi-talen Dokumente entsprechen sol len, und die Standardisierung der Text codierung,  die Textinhalte austauschbar macht.   Beide Faktoren wurden in dieser Kurseinheit besprochen. Als dritter Faktor steht die  Standardisierung der Strukturinformation noch aus; damit werden die kommenden  Kurseinheiten im Zusammenhang mit XML und den verwandten Sprachfamilien zu tun haben.'
 '· ein abstrakter  Zeichensatz,   · eine Codetabelle,   · ein Codierungsformat,   · ein Codierungsschema  und  · eine Uebertragungssyntax   Die obere Ebene des Codierungsmodells ist der abstrakte Zeichensatz. Dieser besteht aus einer Menge  sogenannter  abstrakter Zeichen. Es handelt sich hierbei um Buchstaben, Ziffern, Interpunktionszei- chen, Akzente, grafische Symbole etc.  An naechster Stelle des C odierungsmodells steht die Codetabelle, die den abstrakten Zeichen im Zei- chensatz eine Codeposition zuweist. Eine Codeposition ist immer eine natuerliche Zahl, also groeßer  oder gleich 0. Der Code -Raum kann jedoch auch Zahlen enthalten, die keine zulaessigen Codepositio- nen sind. Codepositionen werden ueblicherweise in Hexadezimalnotation angegeben.']","Ein abstrakter Zeichensatz, eine Codetabelle, ein Codierungsformat, ein Codierungsschema und eine Uebertragungssyntax, die ueber sogenannten „glatten Text“ hinausgeht.",0.8985925374744083,0.8571428571428571,,0.99999999998,0.5581889271122673
Wann wurde SGML offiziell registriert?,"Ich bin HagenCopilot, Ihr virtueller Assistent fuer das Fernstudium!  Ich habe Ihre Fragen gelesen und bin bereit, Ihnen zu helfen.  **Frage 1** Welche der folgenden Aussagen bezueglich SGML und HTML ist zutreffend?  Antwort: • SGML wurde 1986 unter ISO 8879 offiziell registriert • SGML ist – wie auch HTML – ein ISO-Standard und kann als Grundlage aller Beschreibungssprachen betrachtet werden  **Frage 2** Schreiben Sie das hier dem Kurstext zufolge fehlende Wort auf:  SGML ist die standardisierte und generalisierte   *****    .  Antwort: Auszeichnungssprache / Beschreibungssprache  **Frage 3** Welche der folgenden Aussagen treffen auf HTML zu?  Antwort: • Der entscheidende Aspekt an HTML ist die Moeglichkeit, Texte nicht nur zu formatieren, sondern Inhalte miteinander zu verknuepfen.  **Hilfreiche Antwort: Wann wurde SGML offiziell registriert?** SGML wurde 1986 unter ISO 8879 offiziell registriert.  Ich hoffe, diese Antworten helfen Ihnen weiter!","['Kurs 01877 Einsendeaufgaben zu Kurseinheit 2     - 1 -   Kurs 0187 7 Informationsvisualisierung im Internet E insendeaufgaben zu Kurseinheit 2    Frage 1   Welche der folgenden Aussagen bezueglich SGML und HTML ist zutreffend?   Waehlen Sie eine oder mehrere Antworten:     • SGML ist – wie auch HTML – ISO-zertifiziert und kann als Grundlage aller  Beschreibungssprachen betrachtet werden.   • HTML ist – wie auch SGML – ISO-zertifiziert und kann als Grundlage aller  Beschreibungssprachen betrachtet werden   • SGML wurde 1990 unter ISO 8879 offiziell registriert   • SGM L wurde 1986 unter ISO 8879 offiziell registriert         Frage 2   Schreiben Sie das hier dem Kurstext zufolge fehlende Wort auf:     SGML ist die standardisierte und generalisierte   *****    .'
 '• HTML ist – wie auch SGML – ISO-zertifiziert und kann als Grundlage aller  Beschreibungssprachen betrachtet werden   • SGML wurde 1990 unter ISO 8879 offiziell registriert   • SGM L wurde 1986 unter ISO 8879 offiziell registriert         Frage 2   Schreiben Sie das hier dem Kurstext zufolge fehlende Wort auf:     SGML ist die standardisierte und generalisierte   *****    .   Antwort: Beschreibungssprache / Auszeichnungssprache         Frage 3  Welche der folgenden Aussagen treffen auf HTML zu?   Waehlen Sie eine oder mehrere Antworten:     • HTML bedeutet Hypertext Media Language   • Der entscheidende Aspekt an HTML ist die Moeglichkeit, Texte nicht nur zu formatieren,  sondern  Inhalte miteinander zu verknuepfen.'
 'zeichnungssprache (e ngl. standard generalized markup language , SGML ) und war  lediglich eine Teilmenge aus SGML. Diese Teilmengenbeziehung ist in Abbildung 2.1  grafisch dargestellt. SGML ist – wie auch HTML – ein ISO -Standard und kann als  Grundlage aller Beschreibungssprachen betrachtet werden. SGML wurde 1986 als  Standard unter ISO 8879 offiziell registriert.     Abbildung 2.1 SGML als Basis   HTML 4 und CSS 2 waren sehr lang die normativen Referenzen fuer Qualitaet im  Webdesign. Im Jahr 2004 jedoch gruendeten die Entwickler von Opera, Apple und  Mozilla die WHATWG (Web Hypertext Application Technology  Working Group) um  den Funktionsumfang von HTML zu erweitern und unter dem Namen HTML5 – jetzt  Living Standard – zusammenzufassen. Das W3C entschied sich, die Arbeit der'
 'Selbsttestaufgabe 3.1 Erlaeutern Sie den Unterschied zwischen einem wohlgeformten und einem gueltigen XML-Dokument'
 'Inhaltsverzeichnis 1. Einleitung 2. XSL-Transformationen 3. XQuery 4. Anhang 5. Literatur 6. Loesungen der Selbsttestaufgaben']",SGML wurde 1986 unter ISO 8879 offiziell registriert,0.7958135129708105,0.75,1.0,0.999999999975,0.43719459563647867
"Welche Programmiersprache wird standardmaeßig verwendet, um interaktive Elemente fuer Webseiten zu erstellen?","Liebe(r) Benutzer(in),  Ich habe in dem gegebenen Kontext keine explizite Aussage gefunden, die auf eine bestimmte Programmiersprache hinweist, die standardmaeßig verwendet wird, um interaktive Elemente fuer Webseiten zu erstellen.  Allerdings ist in der Lektion ueber das semantische Content-Modell und den Verwendung von HTML erwaehnt worden. Es gibt auch einige Empfehlungen zur Verwendung von HTML, ohne dass eine bestimmte Programmiersprache genannt wird.  Es scheint jedoch plausibel, dass JavaScript als standardmaeßige Wahl fuer die Erstellung interaktiver Elemente fuer Webseiten verwendet wird, insbesondere wenn man den Abschnitt ueber die Beispiele von JavaScript, TypeScript und anderen Sprachen liest. Jedoch fehlt in dem gegebenen Kontext eine explizite Aussage, die diese Annahme bestaetigt.  Ich entschuldige mich daher, da ich keine direkte Antwort auf Ihre Frage habe.  Bitte beachten Sie, dass ich nur auf den im Kontext bereitgestellten Informationen basiere. Sollten Sie weitere Fragen haben, stehe ich Ihnen gerne zur Verfuegung.","['Kurs 01877  Einsendeaufgaben  zu Kurseinheit  3  - 5 -      Frage  7      https://www.freeformatter.com/xpath -tester.html'
 'Unterwegs im Internet. Broschuere A/003/0811, Universitaetsrechenzentrum FernUni-versitaet Hagen, August 2011.   [FSS82]  R. Furuta, J. Scofield, and A. Shaw. Document formatting: Survey, concepts, and is-sues.  Computing Surveys, 14(3):417–172, September 1982   [MvD82]  N. Meyrowitz and A. van Dam. Interactive editing systems (Parts I and II). Computing Surveys, 14(3):321 –415, September 1982.   [WD00]  K. Whistler and M. Davis. Character encoding model. Unicode Tech nical Report 17- 3.1, Unicode, Inc., August 2000.   [P01]  Peter Constable. Character set encoding basics. NRSI: Computer & Writing Sys- tems,2001.   [Kuh89]    Rainer Kuhlen. Pragmatischer Mehrwert von Information. Sprachspiele   mit informationswissenschaftlichen  Grundbegriffen. Universitaet Konstanz / Informati-'
 'werden.   Elemente aus der Interactive -Content -Kategorie bieten dem Benutzer die Moeglich- keit zur Interaktion. Das sind beispielsweise button, details, input etc.   Die Elemente des Metadata -Content wurden bereits zu Ausfuehrungen bzgl. des  <head> -Tag im Kopf -Bereich eines Dokumentes erwaehnt. Solche Metadata - Elemente koennen aber auch zwischen <body>  und </body>  platziert werden,   haeufig findet man dort z.  B. das <script> -Element.   Empfehlungen zur Verwendung von HTML   Wie gerade erwaehnt, wurde das neue semantische Content -Modell einge- fuehrt, um HTML semantisch anzureichern. H ierzu soll es nun noch einige Emp- fehlungen geben.   Aber es soll auch Schluss sein mit dem ungehemmten Einsatz von div -Elementen'
 'Aspekte der Implementierung interaktiver Systeme beleuchtet. Die abschließende  Lektion befasst sich mit der Evaluation von Funktionalitaet und Bedienbarkeit von  Benutzungsschnittstellen mithilfe statistischer Methoden. -Mathematik -Kenntnisse, die durch die Erlangung der allgemeinen Hochschulreife  erworben wurdenin jedem Semester B.Sc. Informatik B.Sc. Mathematisch-technische Softwareentwicklung B.Sc. Wirtschaftsinformatik Modulhandbuch M.Sc. Data Science'
 'funktionalen Sprachen zugrundeliegenden Konzepte am Beispiel von JavaScript,  TypeScript, Smalltalk, Scala und F#. Nur im M. Sc. Informatik und M. Sc. Data Science verwendbar!Die Lehrveranstaltung richtet sich an Interessierte in fortgeschrittenen  Studienabschnitten. Es werden solide Kenntnisse in mindestens einer  imperativen/objektorientierten Programmiersprache sowie Grundkenntnisse in  theoretischer Informatik und Mathematik benoetigt.in jedem Sommersemester M.Sc. Data Science M.Sc. Informatik Modulhandbuch M.Sc. Data Science']",JavaScript.,0.0,0.8888888888888888,0.5,0.36666666664833336,0.7065465775472384
Wie viele verschiedene Arten von Knoten gibt es in XPath?,"Hallo! Als HagenCopilot, ich bin hier, um deine Fragen zum Fernstudium zu beantworten.  In dem gegebenen Kontext findest du Informationen ueber XQuery und XPath. Nachdem du nach der Anzahl der verschiedenen Arten von Knoten in XPath gefragt hast, kann ich dir antworten: Nach den Informationen im Kontext gibt es insgesamt sieben Arten von Knoten in XPath:  1. Dokumentknoten 2. Elementknoten 3. Attributeknoten 4. Textknoten 5. Kommentarknoten 6. Verarbeitungsknoten (Processing Instruction) 7. Namespaceknoten  Ich hoffe, diese Antwort hilft! Wenn du weitere Fragen hast, stehe ich gerne zur Verfuegung.","['Kurs 01877  Einsendeaufgaben  zu Kurseinheit  3  - 5 -      Frage  7      https://www.freeformatter.com/xpath -tester.html'
 'Inhaltsverzeichnis 1. Einleitung 2. XSL-Transformationen 3. XQuery 4. Anhang 5. Literatur 6. Loesungen der Selbsttestaufgaben'
 'Knoten                                                                                                   Knoten bilden einen Baum, der aus einem Wurzelknoten plus allen Knoten besteht, die direkt oder indirekt vom Wurzelknoten erreichbar sind. Jeder Knoten gehoert genau einem Baum, und jeder Baum hat genau einen Wurzelknoten. Bei XQuery sind die sieben Arten von Knoten von XPath uebernommen: Dokumentknoten: Ein Baum, dessen Wurzelknoten ein Dokumentknoten ist, kennzeichnet ein Dokument. Wenn der Wurzelknoten des Baumes kein DokumentknotenAuswertungsphase bei XQuery Abfragen?'
 'Dokumentes verwenden lassen. Die Empfehlung befindet sich unter http://www.w3.org /TR/xpath. XPath spielt vor allem in XSLT- oder XSL-Dokumenten eine wichtige Rolle, die ja wohlgeformte Dokumente sind. XPath ist eine Sprache zur Lokalisierung von Teilen eines XML-Dokuments und arbeitet auf einer Baumansicht eines XML-Dokuments, wobei verschiedene Knoten unterschieden werden:Welche Kanten kreiert das Element <Kanten xlink:type =""arc"" /> ?'
 'Kurs 01877  Einsendeaufgaben  zu Kurseinheit  4  - 2 -    statische Analysephase  dynamische  Auswertungsphase    Frage  5    Welches  Wort  muss  in die Luecke?     Ein Pfadausdruck  dient  dazu,  Knoten  in Baeumen  zu lokalisieren.  Diese  Ausdruecke  wurden  von der XPath 1.0 Spezifikation in XQuery uebernommen.       Frage  6    Welche  Aussagen  der folgenden  Liste  treffen  auf Sequenzausdruecke  zu?    • Query  unterstuetzt  Operatoren,  um Sequenzen  von Items  zu entwerfen, zu  kuerzen  und zu  erweitern.   • Sequenzen  sind nie verschachtelt.   • Query  unterstuetzt  Operatoren,  um Sequenzen  von Items  zu konstruieren,  zu filtern  und  zu kombinieren.   • Wenn  die Werte  1, (2, 3) und () zu einer  Sequenz  zusammengefuegt  werden,  entsteht die   Sequenz (1, 2, 3).']",Sieben.,0.8619541767509414,0.5,0.8,0.47777777776185176,
Was ist ein XSLT-Prozessor?,"Ein XSLT-Prozessor ist eine Anwendung, die ein XML-Dokument nach Maßgabe eines XSLT-Stylesheets transformiert. Er sucht im XML-Dokument nach Vorkommen der Muster (Templates) und gibt den Inhalt des Templates aus, wenn er ein passendes Template-Muster findet.","['Inhaltsverzeichnis 1. Einleitung 2. XSL-Transformationen 3. XQuery 4. Anhang 5. Literatur 6. Loesungen der Selbsttestaufgaben'
 'Kurs 01877  Einsendeaufgaben  zu Kurseinheit  3  - 5 -      Frage  7      https://www.freeformatter.com/xpath -tester.html'
 'XSLT-Template XMLAbbildung 4.1: XSLT'
 'anderes XML-Dokument transformiert werden. Es kann aber auch nur darum gehen, bestimmte Quelldaten neu zu ordnen, zu erweitern oder zu filtern. Ein XSLT-Dokument wird u. a. auch Stylesheet  genannt. Ein Stylesheet enthaelt Vorlagen oder Muster (engl. Templates ), die jeweils aus einem Muster und einem Inhalt bestehen.Stylesheet Ein XSLT-Prozessor, d. h. eine Anwendung, die ein XML-Dokument nach Maßgabe eines XSLT-Stylesheets transformiert, sucht im XML-Dokument nach Vorkommen der Muster dieser Templates. Findet er ein passendes Template-Muster, gibt er den Inhalt des Templates aus. Das Stylesheet kann auch nur einen Teil des Inhalts aus dem Quelldokument beachten und das Ergebnisdokument um Informationen erweitern, welche im Quelltext gar nicht vorhanden sind.'
 'einen Sprache in die andere zu entwickeln. Es gibt einige frei verfuegbare XSLT-Prozessoren wie xalan-java . Dieser ist in Java geschrieben und damit plattformunabhaengig. Entwicklungsumgebungen wie z. B. XML-Spy von Altova arbeiten mit eigenen integrierten XSLT-Prozessoren.XSLT-Prozessoren Seit Windows 7 ist der Microsoft Core XML Services MSXML bereits integriert und muss nicht separat installiert werden. Der Aufruf in einem Shell-Script sieht aus wie folgt, wobei eventuell noch die Pfade zu den jar-Dateien ergaenzt werden muessen: java -cp xalan.jar:xml-apis.jar:xercesImpl.jar org.apache.xalan.xslt.Process -IN $1 -XSL $2 -OUT $3  Hierbei stehen $1, $2 und $3 fuer die Dateinamen des zu transformierenden XML- Dokuments, des XSLT-Stylesheets und des Ausgabedokuments. Die drei Dateinamen']","Ein XSLT-Prozessor ist eine Anwendung, die ein XML-Dokument nach Maßgabe eines XSLT-Stylesheets transformiert.",0.8892045233358162,1.0,0.6666666666666666,0.8041666666465626,0.746525083463897
Welche Aufgabe haben Konstruktoren in XQuery?,"Eine einfache Frage!  Laut dem Text zur Kurseinheit 3 in deinem Fernstudium ist zu erfahren, dass XQuery Operatoren unterstuetzt, um Sequenzen von Items zu konstruieren, zu filtern und zu kombinieren. Eine Moeglichkeit, eine Sequenz zu konstruieren, ist der Kommaoperator, der alle seine Operanden auswertet und die resultierenden Sequenzen zu einer Ergebnissequenz verkettet.  Die Aufgabe von Konstruktoren in XQuery besteht also darin, Sequenzen von Items zu erstellen, indem sie verschiedene Operatoren verwenden.","['Inhaltsverzeichnis 1. Einleitung 2. XSL-Transformationen 3. XQuery 4. Anhang 5. Literatur 6. Loesungen der Selbsttestaufgaben'
 'Primaerausdruck combining node sequencesSequenzausdruecke XQuery unterstuetzt Operatoren, um Sequenzen von Items zu konstruieren, zu filtern und zu kombinieren. Sequenzen sind nie verschachtelt. Wenn zum Beispiel die Werte 1, (2, 3) und () zu einer Sequenz zusammengefuegt werden, entsteht die Sequenz (1, 2, 3). Konstruieren von Sequenzen Eine Moeglichkeit eine Sequenz zu konstruieren ist der Kommaoperator, der alle seine Operanden auswertet und die resultierenden Sequenzen zu einer Ergebnissequenz verkettet. Leere Klammern bezeichnen eine leere Sequenz. Eine Sequenz kann Duplikate von atomaren Werten oder Knoten enthalten, aber eine Sequenz ist nie in einer anderen Sequenz enthalten. Wenn eine neue Sequenz erzeugt wird, indem zwei oder'
 'Kurs 01877  Einsendeaufgaben  zu Kurseinheit  3  - 5 -      Frage  7      https://www.freeformatter.com/xpath -tester.html'
 '• Query  unterstuetzt  Operatoren,  um Sequenzen  von Items  zu entwerfen, zu  kuerzen  und zu  erweitern.   • Sequenzen  sind nie verschachtelt.   • Query  unterstuetzt  Operatoren,  um Sequenzen  von Items  zu konstruieren,  zu filtern  und  zu kombinieren.   • Wenn  die Werte  1, (2, 3) und () zu einer  Sequenz  zusammengefuegt  werden,  entsteht die   Sequenz (1, 2, 3).   • Sequenzen  koennen  auch  verschachtelt  sein.   • Wenn  die Werte  1, (2, 3) und () zu einer  Sequenz  zusammengefuegt  werden,  entsteht die  Sequenz [(1), ((2), (3))].       Frage  7    XQuery  definiert  zwei Phasen  der Verarbeitung:     Waehrend  dieser  Phase  wird die Abfrage  in eine interne  Darstellung,  den sogenannten  Operationsbaum ueberfuehrt:'
 'Kurs 01877  Einsendeaufgaben  zu Kurseinheit  4  - 2 -    statische Analysephase  dynamische  Auswertungsphase    Frage  5    Welches  Wort  muss  in die Luecke?     Ein Pfadausdruck  dient  dazu,  Knoten  in Baeumen  zu lokalisieren.  Diese  Ausdruecke  wurden  von der XPath 1.0 Spezifikation in XQuery uebernommen.       Frage  6    Welche  Aussagen  der folgenden  Liste  treffen  auf Sequenzausdruecke  zu?    • Query  unterstuetzt  Operatoren,  um Sequenzen  von Items  zu entwerfen, zu  kuerzen  und zu  erweitern.   • Sequenzen  sind nie verschachtelt.   • Query  unterstuetzt  Operatoren,  um Sequenzen  von Items  zu konstruieren,  zu filtern  und  zu kombinieren.   • Wenn  die Werte  1, (2, 3) und () zu einer  Sequenz  zusammengefuegt  werden,  entsteht die   Sequenz (1, 2, 3).']","Konstruktoren dienen dazu, neue Knoten zu erzeugen.",0.8524021967834808,1.0,0.0,0.5333333333155555,0.543880148291126
Was passiert waehrend der dynamischen Auswertungsphase einer Xquery-Abfrage?,"Die dynamische Auswertungsphase einer XQuery-Abfrage beginnt nach Vollendung der statischen Analysephase und kann nur starten, wenn keine Fehler waehrend der statischen Analysephase ermittelt wurden. Waehrend dieser Phase wird der Ausdruck ausgefuehrt, die Daten werden verarbeitet und der dynamische Kontext wird erweitert, indem Werte an Variablen gebunden oder neue Datenmodellwerte erzeugt werden koennen.","['Untermengen eines Dokumentes. Selbsttestaufgabe 4.7: Worin unterscheiden sich die statische Analysephase und die dynamische Auswertungsphase bei XQuery Abfragen?  XQuery definiert zwei Phasen der Verarbeitung: ·        statische Analysephase: Waehrend dieser Phase wird die Abfrage in eine interne Darstellung, den sogenannten Operationsbaum ueberfuehrt. ·        dynamische Auswertungsphase:'
 'Selbsttestaufgabe 4.6: Ergaenzen Sie die fehlenden Begriffe im Text: XQuery ist eine Abfragesprache fuer XML-Dokumente, die aehnlich wie SQL fuer relationale Datenbanken funktioniert und als Ergebnisse Datensaetze zurueckliefert. Fuer XQuery gibt es eine non-XML-Syntax  und eine XML-Syntax. Fuer XQuery und XPath gilt, dass sie selbst keine XML- Anwendungen sind, sondern eine eigene Syntax zur Bildung von Zeichenketten enthalten, vor allem zu Adressierung von Untermengen eines Dokumentes. Selbsttestaufgabe 4.7: Worin unterscheiden sich die statische Analysephase und die dynamische Auswertungsphase bei XQuery Abfragen?  XQuery definiert zwei Phasen der Verarbeitung: ·        statische Analysephase: Waehrend dieser Phase wird die Abfrage in eine interne Darstellung, den sogenannten'
 'statische Analysephase dynamische Auswertungsphasedabei in einem ersten Schritt extern geparst und eventuell zusaetzlich validiert und dann vom Query-Prozessor in eine Instanz des XQuery/XPath-Datenmodells [W3C1] ueberfuehrt. Die lokal gueltigen Schemadefinitionen des statischen Kontextes koennen von den zugehoerigen XML-Schemata extrahiert oder durch irgendeinen anderen Mechanismus erzeugt werden, wobei in beiden Faellen die Konsistenzbedingungen erfuellt werden muessen. XQuery definiert zwei Phasen der Verarbeitung: statische Analysephase und dynamische Auswertungsphase. Dabei ist die statische Ueberpruefung bei der Implementierung optional, wenn Typfehler zur Laufzeit erkannt werden. Die statische Analysephase haengt vom Abfrageausdruck selbst'
 'Kurs 01877  Einsendeaufgaben  zu Kurseinheit  4  - 2 -    statische Analysephase  dynamische  Auswertungsphase    Frage  5    Welches  Wort  muss  in die Luecke?     Ein Pfadausdruck  dient  dazu,  Knoten  in Baeumen  zu lokalisieren.  Diese  Ausdruecke  wurden  von der XPath 1.0 Spezifikation in XQuery uebernommen.       Frage  6    Welche  Aussagen  der folgenden  Liste  treffen  auf Sequenzausdruecke  zu?    • Query  unterstuetzt  Operatoren,  um Sequenzen  von Items  zu entwerfen, zu  kuerzen  und zu  erweitern.   • Sequenzen  sind nie verschachtelt.   • Query  unterstuetzt  Operatoren,  um Sequenzen  von Items  zu konstruieren,  zu filtern  und  zu kombinieren.   • Wenn  die Werte  1, (2, 3) und () zu einer  Sequenz  zusammengefuegt  werden,  entsteht die   Sequenz (1, 2, 3).'
 'der der Wert eines Ausdruckes berechnet wird. Sie beginnt nach Vollendung der statischen Analysephase und kann nur starten, wenn keine Fehler waehrend der statischen Analysephase ermittelt wurden. Die dynamische Auswertungsphase ist abhaengig vom Operationsbaum, dem Ausdruck, der gerade ausgewertet wird, vom Dateninput und vom dynamischen Kontext, der der Reihe nach Informationen von der externen Umgebung und vom statischen Kontext bezieht. Die dynamische Auswertungsphase kann neue Datenmodellwerte erzeugen und sie kann den dynamischen Kontext erweitern, zum Beispiel indem sie Werte an Variablen bindet. Die Serialisierung ist der abschließende Prozess des Umwandelns einer XDM-Instanz in eine Sequenz von Achtbitzeichen z. B. ein XML-Dokument. Selbsttestaufgabe 4.7:']","Die dynamische Auswertungsphase ist die Phase, waehrend der der Wert eines Ausdruckes berechnet wird.",0.8524666923563342,1.0,,0.99999999998,0.524353371509788
Was sind die Bestandteile eines RDF-Tripels?,"Das ist eine einfache Frage!  Die Bestandteile eines RDF-Tripels sind:  * Ressource/Subjekt (Subject) * Praedikat (Predicate) * Objekt (Object)  Diese drei Teile bilden zusammen ein sogenanntes Triple, das in RDF (Resource Description Framework) eingesetzt wird.  Zwei moegliche Darstellungsformen fuer RDF-Triples sind:  * Als Graf: eine visuelle Darstellung der Tripel, die aus Knoten und Kanten besteht * Als XML-Notation: ein Textformat, das die Tripel in einer XML-Syntax repraesentiert  Ich hoffe, diese Antwort hilft!","['Benutzern helfen, die richtigen bzw. relevanten Informationen zu finden. 5.2: Welches sind die Bestandteile eines RDF-Tripels? Nennen Sie zwei moegliche Darstellungsformen Ressource/Subjekt, Praedikat, Objekt. Als Graf oder als XML-Notation 5.3: Erlaeutern Sie das Prinzip der Reifikation anhand des folgenden N-Triples: N-Triple: <sh:SherlockHolmes> <s:supposes> <s:StatementOfSherlock> . <s:StatementOfSherlock> <http://www.w3.org/1999/02/22-rdf-syntax-ns#a> <rdf:Statement> . <s:StatementOfSherlock> <http://www.w3.org/1999/02/22-rdf-syntaxns# subject> <s:Gardener> . <s:StatementOfSherlock> <http://www.w3.org/1999/02/22-rdf-syntaxns# predicate> <s:hasKilled> . <s:StatementOfSherlock> <http://www.w3.org/1999/02/22-rdf-syntaxns# object> <s:Butler> .'
 '<statement> <rdf:subject> <subject> . <statement> <rdf:predicate> <predicate> . <statement> <rdf:object> <object> . In der Form als RDF/XML sieht das gleiche Statement folgendermaßen aus: RDF/XML (requires URI identifier for resources): <?xml version=""1.0"" encoding=""utf-8"" ?> <rdf:RDF xmlns:rdf=""http://www.w3.org/1999/02/22-rdf-syntax-ns#""> <rdf:Statement rdf:nodeID=""statement""> <rdf:subject rdf:resource=""https://resource.identifier/subject""/> <rdf:predicate rdf:resource=""https://resource.identifier/predicate""/> <rdf:object rdf:resource=""https://resource.identifier/object""/> </rdf:Statement> </rdf:RDF> Repraesentation in grafischer Form: Das folgende Beispiel behandelt ebenfalls die Reifikation von Aussagen in RDF.a) Welches sind die Bestandteile eines RDF-Tripels?'
 '<rdf:subject rdf:resource=""https://resource.identifier/subject""/> <rdf:predicate rdf:resource=""https://resource.identifier/predicate""/> <rdf:object rdf:resource=""https://resource.identifier/object""/> </rdf:Statement> </rdf:RDF> Repraesentation in grafischer Form: Das folgende Beispiel behandelt ebenfalls die Reifikation von Aussagen in RDF.a) Welches sind die Bestandteile eines RDF-Tripels? b) Nennen Sie zwei moegliche Darstellungsformen Abbildung 5.6: Aussage ueber Aussage'
 'Inhaltsverzeichnis 1. Einleitung 2. Motivation und Einfuehrung 3. Einfuehrung zu Semantik und RDF 4. RDF Schemata 5. Erzeugung von Ontologien mittels OWL 6. Metadaten 7. Anhang 8. Literatur 9. Loesungen der Selbsttestaufgaben'
 '9. Loesungen der Selbsttestaufgaben 5.1: Was ist ein Semantisches Netz und wozu wird es verwendet? Ein Semantisches Netz (semantic web) hilft dabei, die im Web verfuegbaren Inhalte maschinell verarbeiten zu koennen. Dabei wird der semantische Hintergrund der dargestellten Informationen interpretiert und Beziehungen zwischen den interpretierten Informationen vom System erkannt und automatisch maschinell verarbeitet. Dies soll den Benutzern helfen, die richtigen bzw. relevanten Informationen zu finden. 5.2: Welches sind die Bestandteile eines RDF-Tripels? Nennen Sie zwei moegliche Darstellungsformen Ressource/Subjekt, Praedikat, Objekt. Als Graf oder als XML-Notation 5.3: Erlaeutern Sie das Prinzip der Reifikation anhand des folgenden N-Triples: N-Triple: <sh:SherlockHolmes> <s:supposes>']","Ein RDF-Tripel besteht aus einem Subjekt, einem Praedikat und einem Objekt.",0.8932872032798489,1.0,1.0,0.94999999997625,0.979798044360775
Was ist Reifikation?,"Sehr geehrter Benutzer, ich bin HagenCopilot, dein virtueller Assistent fuer das Fernstudium. Ich freue mich darauf, deine Fragen zu beantworten.  Die Frage lautet: Was ist Reifikation?  Die Reifikation beschreibt die Faehigkeit, eine Aussage als eigene Ressource zu modellieren, was es erlaubt, Aussagen in anderen Aussagen zu referenzieren. Dies ermoeglicht die Verkettung von Aussagen und das Treffen von Aussagen ueber Aussagen.  Ich hoffe, diese Antwort hilft dir weiterzukommen!","['Reifikation Reifikation beschreibt die Faehigkeit, eine Aussage als eigene Ressource zu modellieren, was es erlaubt, Aussagen in anderen Aussagen zu referenzieren. Dies ermoeglicht die Verkettung von Aussagen und das Treffen von Aussagen ueber Aussagen. Eine reifizierte Aussage stellt eine eigene Ressource dar, auf die in anderen Aussagen Bezug genommen werden kann. Jede Anweisung besteht aus einem Tripel Subjekt , Praedikat , Objekt und kann in ihrer reifizierten Form dargestellt werden. Danach kann sie als Referenz in anderen Anweisungen verwendet werden. Nimmt man also das folgende N-Triple als Beispiel einer Aussage: <rdf:subject> <rdf:predicate> <rdf:object> . so ist dies das N-Triple der Aussage in reifizierter Form: <statement> <rdf:type> <rdf:Statement> .'
 'Reifikationsstatement?       <?xml version=""1.0""  encoding=""utf -8"" ?>  <rdf:RDF  xmlns:rdf="" http://www.w3.org/1999/02/22 -rdf-syntax-ns#""  xmlns:ns0 =""sportler:"">   <rdf:Description  rdf:about=""sportler:FritzWalter"">   <ns0:spielte  rdf:resource=""sportart:Statement""/>   </rdf:Description>         <rdf:subject  rdf:resource=""  sportart:Fußball""/>   <rdf:predicate  rdf:resource=""sportart:istEine""/>   <rdf:object  rdf:resource=""sparte:Ballsportart""/>   </rdf:Statement>   </rdf:RDF>           5.4 Welche  Aussagen  zu Argumenten  im Sinne  der AIF sind korrekt?           5.5 : RDF -Schema bietet ein Vokabular, um zu spezifizieren, welche semantischen  Merkmale zu welchen Objekten gehoeren und welche semantischen Werte die'
 'in diesem Beispiel bereits zwei Aussagen miteinander verkettet sind: Aussage 1: Max studiert an der FernuniHagen Aussage 2: Die FernUni Hagen ist eine Hochschule    Eine solche Verkettung ist abzugrenzen von der sogenannten Reifikation von Aussagen, die im weiteren Verlauf des Kapitels noch ausfuehrlich behandelt wird und es ermoeglicht eine Aussage ueber eine Aussage zu treffen.Abbildung 5.4: RDF Annotation 2'
 'Benutzern helfen, die richtigen bzw. relevanten Informationen zu finden. 5.2: Welches sind die Bestandteile eines RDF-Tripels? Nennen Sie zwei moegliche Darstellungsformen Ressource/Subjekt, Praedikat, Objekt. Als Graf oder als XML-Notation 5.3: Erlaeutern Sie das Prinzip der Reifikation anhand des folgenden N-Triples: N-Triple: <sh:SherlockHolmes> <s:supposes> <s:StatementOfSherlock> . <s:StatementOfSherlock> <http://www.w3.org/1999/02/22-rdf-syntax-ns#a> <rdf:Statement> . <s:StatementOfSherlock> <http://www.w3.org/1999/02/22-rdf-syntaxns# subject> <s:Gardener> . <s:StatementOfSherlock> <http://www.w3.org/1999/02/22-rdf-syntaxns# predicate> <s:hasKilled> . <s:StatementOfSherlock> <http://www.w3.org/1999/02/22-rdf-syntaxns# object> <s:Butler> .'
 '8. Index description logics  17 Entitaeten  8 Entity-Relationship-Modelle  10 FOAF-Ontologie  11 Heterogenitaet  6 Homonyme und Synonyme  13 Hybridansatz  23 Information Retrieval  20 Interoperabilitaet  7 Klassenframes  16 Knowledge Interchange Format  17 kompetente Fragen  27 Konzepte  13 Konzeptualisierung  8 konzeptuelle Datenbankschemata  10 leichtgewichtige Ontologien  17 mehrfache-Ontologien  22 Ontologie  8 Ontologie-Aligning  26 Praedikatenlogik  17 Querymodell  23 RDF-Schema  14 RDFS-Triples  14 Reasoning  25 Regelsystem  16 schwergewichtige Ontologien  17']","Reifikation beschreibt die Faehigkeit, eine Aussage als eigene Ressource zu modellieren.",0.9422250881475449,0.42857142857142855,,0.8055555555287036,
Was ist die zentrale Idee des Dokumentenmodells?,"Lass mich nachdenken... In der Kurseinheit 1 des Moduls ""Dokumenten- und Wissensmanagement im Internet"" wird das Modell der strukturierten Dokumente vorgestellt. Die zentrale Idee dieses Modells ist die Unterteilung von Dokumenten in textuellen Inhalt, logische Struktur und grafisches Format. Durch diese Unterteilung koennen statisch-passive Dokumente in eine Quellrepraesentation umgewandelt werden, die auf den textuellen Inhalt und die logische Struktur basiert.","['geht: relevante Aspekte von Dokumenten sollen identifizierbar und das Zusammen- wirken  transparent gemacht we rden. Es werden im weiteren Verlauf des Kurses  auch Ueberlegungen dazu angestellt werden,  welche  abstrakten  Modelle  den sich im  Internet manifestierenden  Formaten  zugrunde  liegen.  Es steht  dabei  nicht  immer fuer  jede Ebene der Modellierung eine separate Begr ifflichkeit – etwa wie hier „Architek- tur“ – zur Verfuegung. Bei dem noch folgenden Modell fuer die ZeichenCodierung  wird jedoch sehr schnell klar, warum in diesem Kurs der Begriff Modell  eingefuehrt   wird und wir die Thematik  nicht  unter  dem Begriff Architektur der strukturierten   Dokumente  erlaeutern.   Umsetzungen  des Dokumentenmodells'
 'Das Modell unterstuetzt jedoch nicht nur Anwendungsfaelle des Dokumenten-managements im engeren Sinne, sondern traegt  auch Anwendungen im weite- ren Bereich des Informations - und Wissensmanag ements Rechnung. Das Modell der   strukturierten Dokumente dient somit als Werkzeug, um Texte zu gut zu verwalten-den Texten weiterzuentwickeln und die maschinelle Lesbarkeit und automatisierte  Verarbeitung zu ermoeglichen.  Dokumenten- management   Informations - und  Wissensmanagement'
 'Prof. Dr. -Ing.  Matthias L. Hemmje       01877   Dokumenten- und Wissensmanagement  im Internet   Kurseinheit 1:   Das Modell der strukturierten  Dokumente'
 '2. Der Dokumentenbegriff  Fuer statisch -passive Dokumente wurde bereits in den achtziger Jahren das Modell  der strukturierten Dokumente  entwickelt. Durch dieses Modell wird eine Untertei- lung in  textuellen Inhalt, logische Struktur und gra fisches Format moeglich. Die  Quellrepraesentation des Dokuments bezieht sich  auf den textuellen Inhalt und  logische Struktur. Gesteuert von unabhaengigen Formatvorgaben (engl. stylesheets )  laesst sich daraus das gra fische Format generieren.   Moderne Systeme zur Erstellung und Verwaltung von Dokumenten und großen Do- kumentenbestaenden profitieren vom  Modell der strukturierten Dokumente, da es  ein hohes Maß an Flexibilitaet bietet. Die logische Strukturierung unterstuetzt  Anwen-'
 '2. Der Dokumentenbegriff ................................................................................................... 4  3. Der Modellbegriff ............................................................................................................ 5  4. Realisierung des Dokumentenmodells  .............................................................................. 5  5. Zeichencodierungen  ...................................................................................................... 27  6. Zusammenfassung und Ausblick  .................................................................................... 44  7. Anhang: Formate a m Beispiel  ......................................................................................... 45']","Die zentrale Idee des Dokumentenmodells ist, die Kerndaten des Dokuments redundanzfrei in einer Art Reinform vorzuhalten, wie man es auch beim Design relationaler Faktendatenbanken mit Normalformen verfolgt.",0.8887464571798812,0.75,0.2,0.99999999998,0.5156618619347699
Wofuer wird ein Codierungsschema benutzt?,"Ein Codierungsschema wird nun dazu genutzt, um ein Codierungsformat festzulegen, wie die Codierungseinheiten in Bytefolgen zu serialisieren sind. Dazu gehoeren die Festlegung der Bitrepraesentationen fuer die Codeposition und die Abbildung von Code-Raum-Positionen in Sequenzen von Code-Einheiten und somit in Bitmuster.","['Ein Codierungsschema wird nun dazu genutzt zu einem C odierungsformat zusaetzlich festzulegen, wie  die Codierungseinheiten in Bytefolgen zu serialisieren sind.   Ist die C odierungseinheit eines C odierungsformats selbst acht Bits lang, so ist nichts mehr festzu legen  und das  Codierungs schema ist mit dem Codierung sformat identisch. So kann also UTF8 sowohl als  Codierungsformat als auch als  Codierung sschema bezeichnet werden.'
 '[WD00]  K. Whistler and M. Davis. Character encoding model. Unicode Tech nical Report 17- 3.1, Unicode, Inc., August 2000.   [P01]  Peter Constable. Character set encoding basics. NRSI: Computer & Writing Sys- tems,2001.   [Kuh89]    Rainer Kuhlen. Pragmatischer Mehrwert von Information. Sprachspiele   mit informationswissenschaftlichen  Grundbegriffen. Universitaet Konstanz / Informati- onswissenschaft: Bericht;89,1. Konstanz: Universitaet Konstanz, 1989. URL: http://nbn-resolving.de/urn:nbn:de:bsz:352- 247844.   [Wil95]  Patrick Wilson. “Unused relevant information in research and development”. In: Jour-nal of the American society for Information Science 46.1 (1995), pp. 45– 51. ISSN:  0002- 8231   [NT95]  I. Nonaka and H. Takeuchi, The Knowledge- Creating Company: How Japanese C om-'
 'Serialisierung genannt. Mithilfe eines C odierungsformats wird der Text als  Folge von C odierungseinheiten dargestellt. Ein Codierungsschema wird nun  dazu genutzt zu einem C odierungsformat  zusaetzlich festzulegen, wie die C odie- rungseinheiten in Bytefolgen zu serialisieren sind.   Ist die C odierungseinheit eines Codierungsformats selbst acht Bits lang, so ist nichts  mehr festzulegen und das  Codierungsschema ist mit dem Codierungsformat iden-Serialisierung von  Zeichencodierungen'
 'Bearbeitung zumindest konzeptionell in eine Folge von Unicode -Zeichen umgewan- delt. Das Codierung sschema kann bei der Uebertragung ueber HTTP in einem Header- feld der uebertragenen Nachricht od er in einem  Element  META  im Dokument  selbst   deklariert  werden.  Die Deklaration  in der HTTP -Nachricht  hat dabei  Prioritaet.   _________________________________________________   1 https://encoding.spec.whatwg.org/  Kommentare und  Referenzen'
 'Mithilfe des C odierungsformats fuer eine Codetabelle werden die Bitrepraesentationen fuer  die Codeposi- tion festgelegt. Dazu  gibt es eine Code -Einheit,  die in der Regel  aus acht oder sechzehn  Bits be- steht.  Durch  das Codierungsformat werden dann  die Positionen  eines  Code -Raums  in Sequenzen   von Code -Einheiten  und somit  in Bitmuster abgebildet.   Ein Codierungsschema wird nun dazu genutzt zu einem C odierungsformat zusaetzlich festzulegen, wie  die Codierungseinheiten in Bytefolgen zu serialisieren sind.   Ist die C odierungseinheit eines C odierungsformats selbst acht Bits lang, so ist nichts mehr festzu legen  und das  Codierungs schema ist mit dem Codierung sformat identisch. So kann also UTF8 sowohl als']","Ein Codierungsschema wird dazu genutzt, zu einem Codierungsformat zusaetzlich festzulegen, wie die Codierungseinheiten in Bytefolgen zu serialisieren sind.",0.862288241567748,1.0,1.0,0.99999999998,0.5378496695175468
Was sind Hypertextknoten?,"Die Hypertextknoten sind thematisch zusammengehoerige Texteinheiten, die in HTML codiert sind. Sie bilden die elementaren Informatio einheiten eines Dokuments, die Leserinnen und Leser auf einen Blick wahrnehmen koennen. Die Beziehungen zwischen den Knoten werden durch Hypertextlinks ausgedrueckt.","['Text ist somit die Gesamtheit von thematisch zusammengehoerigen Texteinheiten,  den sogenannt en Hypertextknoten. Die Beziehungen zwischen den Knoten werden  durch Hypertextlinks ausgedrueckt. Die Knoten eines HTML -Dokumentes bilden die  elementaren In formationseinheiten, die Leserinnen und Leser auf einen Blick wahr- nehmen koennen. Von diesen Knoten aus kann zu weiteren Informationseinheiten  navigiert werden, indem den Links zwischen den Dokumenten gefolgt wird. Die  Organisation eines Informationsbestand es in HTML -Hypertextknoten und HTML - Links als HTML -Hypertext eroeffnet damit einen interessengesteuerten Zugang zur Basis des WWW   Informationsressource'
 '• einfaches Protokoll zum Anfordern und Ausliefern von Ressourcen (HTTP),   • Hypertextparadigma zur Navigation zwischen den Ressourcen .  Der Begriff der Informationsressource ka nn dabei sehr weit ausgelegt werden.  Im Zusammenhang mit Dokumentbeschreibungssprachen ist eine Informati- onsressource wie das HTML -basierte fruehe Web im Kern als verteiltes Repositorium  von vernetzten Textressourcen, die in HTML codiert sind, zu verstehen.  Ein HTML - Text ist somit die Gesamtheit von thematisch zusammengehoerigen Texteinheiten,  den sogenannt en Hypertextknoten. Die Beziehungen zwischen den Knoten werden  durch Hypertextlinks ausgedrueckt. Die Knoten eines HTML -Dokumentes bilden die  elementaren In formationseinheiten, die Leserinnen und Leser auf einen Blick wahr-'
 'kann, die also auf den zu verwaltenden Datenbestand beschraenkt sind.   Durch die große Verbreitung von HTML -Dokumenten ist die Bedeutung des Doku- mentenbegriffes erweitert worden. Die Knoten eines HTML -Hypertextes liegen, im  Gegensatz etwa zu den Kapiteln eines Buches, nicht unbedingt in einer linearen  Ordnung vor. Es ist zudem auch moeglich, große Dokumente fuer die Onlinepraesenta- tion entlang der hierarchischen Struktur von Kapiteln und Abschnitten in Hypertext- knoten aufzubrechen und den linearen Zusammenhang des Ursprungsdokuments  durch Hypertextlinks zu repraesentieren. Beispielsweise konverti ert das Werkzeug  latex2html von Nikos Drakos ein LaTeX -Dokument in eine ueber HTML -Hypertextlinks  organisierte Sammlung von HTML - Dokumenten.'
 'bietet. Dazu muss der  Browser die in das aktuelle Dokument eingebetteten HTML - Linkanker kenntlich machen und eine Moeglichkeit zum  Auswaehlen und Aktivieren  eines HTML -Hypertextlinks anbieten. Es sind verschiedene HTML -Link-Semantiken  denkbar,  von denen die Webbrowser in der Regel jedoch nur zwei unterstuetzen: der  Zielknoten ersetzt de n aktuellen Knoten im  Browserfenster oder fuer den Zielknoten  wird ein neues Browserfenster geoeffnet. Webbrowser bieten seitdem bis heute  typi- scherweise die folgenden Navigationsunterstuetzungen an:   • Backtracking: Die Moeglichkeit, waehrend einer Browsersitzung  die bisher be- suchten Hypertextknoten in umgekehrter Reihenfolge wieder zurueckzuver- folgen.   • History: Die Moeglichkeit, auf die waehrend einer Browsersitzung bisher be-'
 ""6. Index Aggregation Boole'schen Retrieval  Dateneinheit  Datenintegration  Datentypkonflikt  Deep Web Deskribierung  different value ranges Disambiguierung  Domaenenkonflikte  Entity-Relationship-Modell Funktionsintegration  Hypernym  Hyponym  Information Retrieval  information sharing Integritaetskonflikt latent semantic analysis Mediatoren  Meronym  missing values  multilateral attribute correspondences  multilateral entity correspondances  Namenskonflikte  overlap  Relevance Feedback""]","Ein HTMLText ist somit die Gesamtheit von thematisch zusammengehoerigen Texteinheiten, den sogenannten Hypertextknoten.",0.8471356515050307,1.0,,0.999999999975,0.5663094351698628
Was ist ein Browser?,"Liebe/r Benutzer, ich bin HagenCopilot, Ihr virtueller Assistent fuer das Fernstudium.  Zur Beantwortung Ihrer Frage: Ein Browser (abgeleitet von ""browser"" = Auge) ist ein Computerprogramm, das Internetseiten und andere Netzwerinkeinhalte anzeigt. Der Browser uebersetzt die HTML- und CSS-Kodestruck in eine sichtbare Darstellung auf dem Bildschirm.  In Ihrem Kontext finden sich keine Informationen, die speziell fuer den Begriff ""Browser"" relevant waeren. Daher kann ich Ihnen leider keine ausfuehrlichere Antwort an die Hand geben.  Ich hoffe, diese kurze Auskunft hilft Ihnen weiter. Sollten Sie weitere Fragen haben oder Hilfe benoetigen, stehe ich Ihnen gerne zur Verfuegung.","['Inhaltsverzeichnis 1. Einleitung 2. XSL-Transformationen 3. XQuery 4. Anhang 5. Literatur 6. Loesungen der Selbsttestaufgaben'
 'Kurs 01877  Einsendeaufgaben  zu Kurseinheit  3  - 5 -      Frage  7      https://www.freeformatter.com/xpath -tester.html'
 'font-size: small;   font-weight: bold;   text-align: right;   margin-top: 0pt;   margin-bottom: 0pt;   }    .Briefkopf {   margin-bottom: 2em;   }    img {  width: 100%;   }    p {  margin-top: 0pt;   margin-bottom: 0pt;   }    a:link {   color: red;   text-decoration: none;   }    a:active {   color: yellow;   text-decoration: none;   }    a:visited {   color: green;   text-decoration: none;   }'
 'Grundlagen  58  8. Literaturverzeichnis   [AFQ89]  J. André, R. Furuta, and V. Quint. Structured Documents. The Cambridge Series on  Electronic Publishing. Cambridge University Press, Cambridge, 1989.   [DYIWFT02]  M. J. Duerst, F. Yergeau, R. Ishida, M. Wolf, A. Freytag, and T. Texin. Character model  for the World Wide Web 1.0. www.w3.org/TR/charmod, February 2002. W3C Work- ing Draft.   [E63]  D. Engelbart. A conceptual framework for the augmentation of man’s intellect. In P.  W. Howerton and D. C. Weeks, editors, Vistas in Information Handling, volume 1, pages 1 –29, Washington, DC, 1963. Spartan Books.   [FHVV11]  T. Feuerstack, A. Hartmann, B. Vo geler, and J. Vieler. Einmal um die Erde und zurueck:'
 ""time, mark, audio, video {       margin: 0;       padding: 0;       border: 0;       font-size: 100%;       font: inherit;       vertical -align: baseline;   }    /* HTML5 display -role reset for older browsers (IE8 etc) */   article, aside, details, figcaption, figure, footer, header,  hgroup, menu, nav, section {       display: block;   }  table {      border-collapse: collapse;       border-spacing: 0;   }      /* Hier die spezifischen Styles: */   body {      font-family: 'Trebuchet MS', 'Lucida Grande', 'Lucida Sans  Unicode', 'Lucida Sans', Tahoma, sans -serif;      line-height: 1.6;       color: blue;       background -color: lightyellow;   }    .page-wrapper {       /*    Lesefluss opimieren durch Zeilenbreite begrenzen! */       max-width: 60em;       margin: 0 auto;""]","Ein Web-Browser ist eine Softwarekomponente, die HTML-Dokumente aus dem Web laden und darstellen kann und welche die Moeglichkeit zur Navigation entlang der eingebetteten HTML-Links bietet",0.0,0.21428571428571427,0.0,0.0,0.3460172174614853
Was ist das HTML-DOM?,"Sehr gerne kann ich dir helfen!  Das HTML-DOM (Document Object Model) ist ein in-memory-Modell von einem Dokument, das es ermoeglicht, ein Dokument als eine Struktur von Knoten und Beziehungen darzustellen. Es ist ein standardisiertes Interface, das es ermoeglicht, auf das Inhalte eines HTML-Dokuments zuzugreifen und zu veraendern.  Im Gegensatz zum tatsaechlichen HTML-Code, der im Browser rendered wird, ist das HTML-DOM eine Kopie des Dokuments, die in der Erinnerung des Computers liegt. Das HTML-DOM kann von Skripten wie JavaScript genutzt werden, um Interaktion mit dem Dokument zu ermoeglichen, zum Beispiel zum Einfuegen neuer Inhalte oder zum Aendern von Stilen.  Ich hoffe, diese Antwort hilft dir!","['Inhaltsverzeichnis 1. Einleitung 2. XSL-Transformationen 3. XQuery 4. Anhang 5. Literatur 6. Loesungen der Selbsttestaufgaben'
 ""time, mark, audio, video {       margin: 0;       padding: 0;       border: 0;       font-size: 100%;       font: inherit;       vertical -align: baseline;   }    /* HTML5 display -role reset for older browsers (IE8 etc) */   article, aside, details, figcaption, figure, footer, header,  hgroup, menu, nav, section {       display: block;   }  table {      border-collapse: collapse;       border-spacing: 0;   }      /* Hier die spezifischen Styles: */   body {      font-family: 'Trebuchet MS', 'Lucida Grande', 'Lucida Sans  Unicode', 'Lucida Sans', Tahoma, sans -serif;      line-height: 1.6;       color: blue;       background -color: lightyellow;   }    .page-wrapper {       /*    Lesefluss opimieren durch Zeilenbreite begrenzen! */       max-width: 60em;       margin: 0 auto;""
 'XML-Dokument. </Kapitel> </Inhalt> </buch>'
 'Kurs 01877  Einsendeaufgaben  zu Kurseinheit  3  - 5 -      Frage  7      https://www.freeformatter.com/xpath -tester.html'
 'Unterwegs im Internet. Broschuere A/003/0811, Universitaetsrechenzentrum FernUni-versitaet Hagen, August 2011.   [FSS82]  R. Furuta, J. Scofield, and A. Shaw. Document formatting: Survey, concepts, and is-sues.  Computing Surveys, 14(3):417–172, September 1982   [MvD82]  N. Meyrowitz and A. van Dam. Interactive editing systems (Parts I and II). Computing Surveys, 14(3):321 –415, September 1982.   [WD00]  K. Whistler and M. Davis. Character encoding model. Unicode Tech nical Report 17- 3.1, Unicode, Inc., August 2000.   [P01]  Peter Constable. Character set encoding basics. NRSI: Computer & Writing Sys- tems,2001.   [Kuh89]    Rainer Kuhlen. Pragmatischer Mehrwert von Information. Sprachspiele   mit informationswissenschaftlichen  Grundbegriffen. Universitaet Konstanz / Informati-']",Das HTML-DOM ist das Objektmodell und die Schnittstelle fuer HTML,0.8631185757630755,0.16666666666666666,1.0,0.19999999998,0.560638498745079
Welche Content-Modelle gibt es in HTML5?,"Lass mich helfen!  Nach den Informationen im Kontext [W3Chtml5CM] und den Erlaeuterungen zum neuen Content-Modell fuer HTML5 in Abbildung 3.2, kann ich dir sagen, dass es in HTML5 sieben quasi semantische Content-Modelle gibt:  1. Flow-Content 2. Sectioning-Content 3. Heading-Content 4. Phrasing-Content 5. Embedded-Content 6. Interactive-Content 7. Metadata-Content  Ich hoffe, das hilft!","['[N99]  J. Niederst. Web Design in a Nutshell. O’Reilly, Sebastopol, California, 1999.   [LB97]  H. W. Lie and B. Bos. Cascading Style Sheets: Designing for the Web. Addison  Wesley Longman, Essex, England, 1997.   [W3Crdf14]  W3C Ressource Description Framework. URL: htt ps://www.w3.org/TR/rdf11 - primer/   Letzter Zugriff 26.10.2016   [W3Chtml5CM]  W3C  Working Draft HTML5 Content Models  https://www.w3.org/TR/2011/WD -html5 -20110525/content -models  Letzter  Zugriff 06.03.2023'
 'Abbildung 3.2 Das neue Content -Modell fuer HTML [W3Chtml5CM]  ................................ ....... 19  Abbildung 4.1 Das klassische Boxmodel l fuer CSS  ................................ ................................ .... 45  Abbildung 4.2 Das neue Boxmodell fuer CSS  ................................ ................................ ...........  46  Abbildung 4.3 Behandlung von Blockboxen in Inlineboxen in Browsern  ................................ .. 49'
 'Block - und Inline -Elemente haben koennen.  Block -Elemente  aehneln  einem  Absatz- format.  Inline -Elemente  sind reine  Auszeichnun gen innerhalb  des Textes. Die weni- gen Ausfuehrungen sollen zum alten Content -Modell genuegen.   In HTML5 existiert ein komplett anderes Content -Modell, weil bei der Struktu- rierung eines HTML -Dokumentes die semantische Bedeutung von HTML her- vorgehoben wird. Das ist gerade mit Blick auf  das Informations - und Wissensma- nagement im  Internet  ein entscheidender  Schritt  in diese  Richtung.   Es existieren sieben quasi semantische Content -Modelle: Flow -Content, Sectioning - Content, Heading -Content, Phrasin g-Content, Embedded -Content, Interactive - Content und Metadata -Content.'
 'vorgehoben wird. Das ist gerade mit Blick auf  das Informations - und Wissensma- nagement im  Internet  ein entscheidender  Schritt  in diese  Richtung.   Es existieren sieben quasi semantische Content -Modelle: Flow -Content, Sectioning - Content, Heading -Content, Phrasin g-Content, Embedded -Content, Interactive - Content und Metadata -Content.     Abbildung 3.2 Das neue Content -Modell fuer HTML  [W3Chtml5CM]   Die meisten body -Elemente gehoeren zum Flow -Content.   Mit dem Sectioning -Content lassen sich spezielle Sektionen im HTML -Dokument  festlegen, um die semantische Struktur  zu verbessern. Realisiert w erden kann das  mit den neuen Elementen article, aside, nav und section. Innerhalb von  Sectioning - Elementen wird eine eigene Ueberschriftenschriftenstruktur verwendet.'
 'Kurs 01877  Einsendeaufgaben  zu Kurseinheit  3  - 5 -      Frage  7      https://www.freeformatter.com/xpath -tester.html']","Es existieren sieben quasi semantische Content-Modelle: Flow-Content, Sectioning-Content, Heading-Content, Phrasing-Content, Embedded-Content, Interactive-Content und Metadata-Content",0.8873458030129564,1.0,1.0,0.999999999975,0.7375977249889158
Was ist eine relative URL?,"Eine relative URL besteht nur aus durch den Solidus `/` getrennten Pfadsegmenten. Sie wird durch Anhaengen an eine absolute Basis-URL zu einer absoluten URL kompletirt. Eine relative URL darf Pfadsegmente `"".""` und `""..""` enthalten; die beiden Segmente bezeichnen das aktuelle Verzeichnis und das uebergeordnete Verzeichnis eines hierarchischen Dateisystems.","['zur Kennung gehoerigen Hom e-Verzeichnis. Auf diese Weise koennen Webdokumen- te lokal in einem  eigenen Verzeichnis abgelegt werden.   Eine relative URL besteht nur aus durch den Solidus / getrennten Pfadsegmenten. Sie  wird durch Anhaengen an eine  absolute Basis -URL zu einer absoluten URL  komplet- tiert. Eine relative URL darf Pfadsegmente „.“ und „..“ enthalten; die  beiden Seg- mente bezeichnen das aktuelle Verzeichnis und das uebergeordnete Verzeichnis eines  hierarchischen Dateisystems. Relative URLs machen ganze Webbereiche portabel.   Sowohl einer absoluten als auch einer relativen URL kann ein sogenannt er Fragmen- tidentifikator in der Form   #«FragmentID»   angehaengt  sein. Mit diesem  Mechanismus  lassen  sich benannte  Teilbereiche  eines   Dokuments  ansprechen.'
 'tei index.html kann allerdings bei unterschiedlichen  Webservern abweichen und  individuell konfiguriert werden.   Beginnt im  zweiten Fall das erste Segment eines Pfades mit einer Tilde ˜, so wird der  Rest des Segments als Nutzerkennung interpretiert und der Pfad hat seinen Ur- sprung in einem konfigurierbaren Verzeichnis, typischerweise  HTML -Data, in dem  zur Kennung gehoerigen Hom e-Verzeichnis. Auf diese Weise koennen Webdokumen- te lokal in einem  eigenen Verzeichnis abgelegt werden.   Eine relative URL besteht nur aus durch den Solidus / getrennten Pfadsegmenten. Sie  wird durch Anhaengen an eine  absolute Basis -URL zu einer absoluten URL  komplet- tiert. Eine relative URL darf Pfadsegmente „.“ und „..“ enthalten; die  beiden Seg-'
 'Kurs 01877  Einsendeaufgaben  zu Kurseinheit  3  - 5 -      Frage  7      https://www.freeformatter.com/xpath -tester.html'
 ""6. Index Aggregation Boole'schen Retrieval  Dateneinheit  Datenintegration  Datentypkonflikt  Deep Web Deskribierung  different value ranges Disambiguierung  Domaenenkonflikte  Entity-Relationship-Modell Funktionsintegration  Hypernym  Hyponym  Information Retrieval  information sharing Integritaetskonflikt latent semantic analysis Mediatoren  Meronym  missing values  multilateral attribute correspondences  multilateral entity correspondances  Namenskonflikte  overlap  Relevance Feedback""
 'Inhaltsverzeichnis 1. Einleitung 2. XSL-Transformationen 3. XQuery 4. Anhang 5. Literatur 6. Loesungen der Selbsttestaufgaben']",Eine relative URL besteht nur aus durch den Solidus / getrennten Pfadsegmenten,0.904728284787986,1.0,1.0,0.99999999995,0.44775913053321004
Wann ist ein XML-Dokument wohlgeformt?,"Lass uns auf die Frage antworten!  Ein XML-Dokument wird als wohlgeformt bezeichnet, wenn es den Syntax-Regeln genuegt. Das bedeutet, dass das Dokument eine korrekte Struktur aufweist und alle Elemente und Attribute gemaeß den Regeln des XML-Langage gestaltet sind.  In anderen Worten: Ein XML-Dokument ist wohlgeformt, wenn es grammatikalisch korrekt ist.","['Selbsttestaufgabe 3.1 Erlaeutern Sie den Unterschied zwischen einem wohlgeformten und einem gueltigen XML-Dokument'
 'XML-Dokument. </Kapitel> </Inhalt> </buch>'
 'Kurs 01877  Einsendeaufgaben  zu Kurseinheit  3  - 5 -      Frage  7      https://www.freeformatter.com/xpath -tester.html'
 'prueft. XML-Dokumente, die der Grammatik genuegen, heißen wohlgeformt. XML- Dokumente, die der Grammatik nicht genuegen, koennen nicht verarbeitet werden. Ein wohlgeformtes XML-Dokument, das mit einem Dokumentenmodell verknuepft ist und dem Schema genuegt, heißt gueltig. Ansonsten heißt es ungueltig. Dabei ist entscheidend, dass die Wohlgeformtheit und Gueltigkeit maschinell geprueft werden koennen. Selbsttestaufgabe 3.2 Welche der folgenden Elemente genuegen nicht den Syntax- Regeln? Wuerde das folgende XML-Dokument nach Korrektur der fehlerhaften Elemente wohlgeformt sein? <br/> <buch> < titel>    Dies ist der Buchtitel </titel> <autor name = ′Nachname′ name = ""Vorname"" / > <Inhalt> <Kapitel Nummer = ′1′> <Unterkapitel Nummer = ""1.1"">    Der Name des Unterkapitels 1.1 </Unterkapitel>'
 'Inhaltsverzeichnis 1. Einleitung 2. XSL-Transformationen 3. XQuery 4. Anhang 5. Literatur 6. Loesungen der Selbsttestaufgaben']",Wenn es der XML-Grammatik genuegt,0.8873202562102395,0.6666666666666666,1.0,0.9166666666361111,0.5112489187284682
Was sind Namensraumknoten in XPath?,"Namensraumknoten (Namespace Nodes) in XPath stellen den im aktuellen Kontext gueltigen Namensraum dar. Dieser Namensraum wird verwendet, um die XML-Elemente und -Attribute zu qualifizieren, indem ein Praefix hinzugefuegt wird.","['Kurs 01877  Einsendeaufgaben  zu Kurseinheit  3  - 5 -      Frage  7      https://www.freeformatter.com/xpath -tester.html'
 'Inhaltsverzeichnis 1. Einleitung 2. XSL-Transformationen 3. XQuery 4. Anhang 5. Literatur 6. Loesungen der Selbsttestaufgaben'
 'Elemente immer bezueglich des sogenannten Kontextknotens an, der standardmaeßig die Wurzel des Dokuments ist. Die Notation ist deklarativ und bezieht sich auf den XML- Dokumentenbaum, der den Inhalt des Dokuments als eine Hierarchie von Knoten repraesentiert. Die Syntax orientiert sich dabei an sogenannten Uniform Resource Identifiers (URIs), die zur Navigation in Verzeichnissen dienen. XPath-Anfragen ermoeglichen es somit, die Suche nach einem bestimmten Muster auf einem ausge¬waehlten Kontextknoten auszufuehren, um dann relativ zu der Ergeb¬nis- Knotenmenge zusaetzliche Operationen anzuwenden. Diese Notation gibt XPath- Ausdruecken eine außergewoehnliche Flexibilitaet bei der Suche in einem Dokumentenbaum. Ein Pfadausdruck besteht aus einem sogenannten Lokationsschritt'
 'Attributknoten: entsprechen den Attributen von XML-Elementen Namensraumknoten: stehen fuer den im aktuellen Kontext gueltigen Namensraum Verarbeitungsanweisungs-Knoten: nehmen eine Verarbeitungsanweisung (Ziel und Inhalt) auf Kommentarknoten: Knoten haben einen textuellen und einen typisierten Wert Typsystem und Sprachkonzept XQuery  hat ein maechtiges und komplexes Typsystem. Die Typen werden von XML- Schema importiert. Jeder Ausdruck in XQuery hat einen statischen Typ und jede XDM- Instanz hat einen dynamischenTyp. Mithilfe des Typsystems ist es moeglich, statische Fehler in XQuery-Abfragen zu entdecken, den Ergebnistyp gueltiger Suchen festzulegen und statisch sicherzustellen, dass das Resultat eine Suche von einem erwarteten Typ ist'
 'schema mapping schema matching semantic web Semantischen Integration  semantischer Kontext  Subsumptio n surjective mappings Thesauri  Ueberlappung  Vektorraum-Modell  Wissensrepraesentation  Wrapper']",Namensraumknoten stehen fuer den im aktuellen Kontext gueltigen Namensraum,0.8631630238306501,0.0,1.0,0.4166666666458333,0.43623125988587086
Welche Aufgaben werden dem benutzenden vom Semantischen Web abgenommen?,"Nachdem ich den Kontext gelesen habe, kann ich Ihnen sagen, dass das Semantische Netz (Semantic Web) die folgenden Aufgaben dem Benutzer abnimmt:  * Die maschinelle Verarbeitung von Inhalten im Internet: Das Semantische Netz ermoeglicht es, dass Systeme die im Web verfuegbaren Inhalte interpretieren und automatisch maschinell verarbeiten koennen. * Die Beziehungen zwischen den interpretierten Informationen vom System erkennen und automatisch maschinell verarbeiten: Dadurch wird dem Benutzer geholfen, die richtigen oder relevanten Informationen zu finden.  Insgesamt ermoeglicht das Semantische Netz eine effiziente und genaue Suche nach Informationen im Internet, ohne dass der Benutzer sie selbst suchen und evaluieren muss.","['9. Loesungen der Selbsttestaufgaben 5.1: Was ist ein Semantisches Netz und wozu wird es verwendet? Ein Semantisches Netz (semantic web) hilft dabei, die im Web verfuegbaren Inhalte maschinell verarbeiten zu koennen. Dabei wird der semantische Hintergrund der dargestellten Informationen interpretiert und Beziehungen zwischen den interpretierten Informationen vom System erkannt und automatisch maschinell verarbeitet. Dies soll den Benutzern helfen, die richtigen bzw. relevanten Informationen zu finden. 5.2: Welches sind die Bestandteile eines RDF-Tripels? Nennen Sie zwei moegliche Darstellungsformen Ressource/Subjekt, Praedikat, Objekt. Als Graf oder als XML-Notation 5.3: Erlaeutern Sie das Prinzip der Reifikation anhand des folgenden N-Triples: N-Triple: <sh:SherlockHolmes> <s:supposes>'
 'schema mapping schema matching semantic web Semantischen Integration  semantischer Kontext  Subsumptio n surjective mappings Thesauri  Ueberlappung  Vektorraum-Modell  Wissensrepraesentation  Wrapper'
 'Semantic Web  12 semantisch abhaengige Konzepte  7 semantisch aequivalente Konzepte  6 semantischen Interoperabilitaet  15 semi-formale Sprache  15 Single-Ontologie  21 Taxonomie  9 Top-level-Ontologien  14 Uniform Resource Locator  13 Upper-Ontologie  15 Verifikation  24 Vokabularien  14 Webstandards  17'
 'Das Problem liegt demnach darin, dass die der Abstraktion zugrunde liegenden Werte- Systeme nicht dieselbe Anzahl an Werten besitzen. Loesung zu Selbsttestaufgabe 6.4 Mit Disambiguierung ist die Aufloesung sprachlicher Mehrdeutigkeit und die Ermittlung der beabsichtigten Bedeutung der Terme im jeweiligen Zusammenhang gemeint. Loesung zu Selbsttestaufgabe 6.5 Ontologien sind ein Mittel zur Konzeptionalisierung bzw. zur Beschreibung von komplexen Konzepten ueber das Wissen einer Domaene und sind eine wesentliche Methode fuer die interoperablen Repraesentation im Semantic Web.'
 'Maschinelle Verarbeitung Semantisches NetzDerzeit wird der groeßte Teil des Web-Inhalts im Hinblick auf menschliche Nutzung bereit- und dargestellt. Der Nutzer muss die vorgefundene Information sichten, bewerten und ggf. selbstaendig mit Informationen aus anderen Quellen verknuepfen. Die Aktivitaeten der Benutzer werden, abgesehen von verschiedenen Suchmaschinen, kaum von Programmen unterstuetzt. Die Benutzer stehen daher vor folgenden Problemen [2]: Es stellt sich das Problem einer großen Anzahl von Suchergebnissen (Treffer) bei geringer Praezision/Relevanz [3]. Im Gegensatz dazu kann es vorkommen, dass sich keine oder nur wenige Treffer ergeben. Die Suchergebnisse sind stark vom verwendeten Vokabular abhaengig. Wenn die Suchbegriffe nicht mit den Schluesselwoertern der relevanten Dokumente']","Informationssuche, Informationssammlung, Informationsklassifikation, Informationsfilterung, Informationsmanagement, Information-Mining, Informationsentdeckung, Informationsbewertung",0.8531869660696447,0.8,0.5555555555555556,0.99999999998,0.45364620367625097
Welche Bedeutung hat das Schluesselwort „rdfs: range“?,"Hallo! Als HagenCopilot bin ich hier, um deine Fragen zu beantworten. Im Kontext unseres RDF-Dokuments ist das Schluesselwort ""rdfs:range"" ein Property-Element, das die Menge von Werten angibt, die fuer eine bestimmte Eigenschaft (in diesem Fall eine Klasse oder ein Instrument) akzeptiert werden.  In anderen Worten, ""rdfs:range"" definiert den Bereich oder den Typ der Werte, die eine bestimmte Eigenschaft annehmen kann. Das ist insbesondere wichtig bei der Definition von Klassen und Subklassen in einer Taxonomie.","['resources, too)</rdfs:comment> <rdfs:isDefinedBy rdf:resource=""musik:instrumente""/> </rdf:Description> <rdf:Description rdf:about=""musik:instrumente:name""> <rdfs:type rdf:resource=""http://www.w3.org/2000/01/rdfschema# Property""/> <rdfs:domain rdf:resource=""musik:instrumente""/> <rdfs:range rdf:resource=""musik:instrumente""/> <rdfs:subPropertyOf rdf:resource=""musik:intrumente""/> </rdf:Description> <rdf:Description rdf:about=""musik:instrumente:holzblasinstrumente""> <rdfs:type rdf:resource=""http://www.w3.org/2000/01/rdf-schema#Class""/> <rdfs:isDefinedBy rdf:resource=""musik:instrumente:holzblasinstrumente""/> <rdfs:label>Holzblasinstrumente</rdfs:label> <rdfs:comment>Gattung Holzblasinstrumente</rdfs:comment> <rdfs:subClassOf rdf:resource=""musik:instrumente""/> </rdf:Description> <rdf:Description'
 'rdf: bag fuer Menge rdf: Seq fuer geordnete n-Tupel rdf: Alt fuer eine Menge von Alternativen jeweils mit der Superklasse rdfs: Container. Ressourcen koennen auf verschiedene Art und Weise an unterschiedlichen Stellen im Web definiert und beschrieben sein. Ein entsprechender Bezug kann mittels rdfs: seeAlso bzw. deren subproperty rdfs: isDefinedBy hergestellt werden. Benutzerfreundliche Kommentare oder Namen von Ressourcen koennen mithilfe der Properties rdfs: comment bzw. rdfs: label in ein RDF-S Dokument eingefuegt werden. Selbsttestaufgabe 5.5: Fassen Sie die Klassenhierarchie, die im XML-Dokument „Instrumente“  (auch im Anhang enthalten) repraesentiert ist, in Ihren eigenen Worten zusammen.'
 '<rdf:Description rdf:about=""TaxonomieDerLebewesen:cats""> <rdfs:subClassOf> <rdf:Description rdf:about=""TaxonomieDerLebewesen:predators""> <rdfs:subClassOf rdf:resource=""TaxonomieDerLebewesen:animals""/> </rdf:Description> </rdfs:subClassOf> </rdf:Description> <rdf:Description rdf:about=""TaxonomieDerLebewesen:lions""> <rdfs:subClassOf rdf:resource=""TaxonomieDerLebewesen:cats""/> </rdf:Description> <rdf:Description rdf:about=""TaxonomieDerLebewesen:houseMice"">'
 '<rdf:Description rdf:about=""TaxonomieDerLebewesen:cats""> <rdfs:subClassOf> <rdf:Description rdf:about=""TaxonomieDerLebewesen:predators""> <rdfs:subClassOf rdf:resource=""TaxonomieDerLebewesen:animals""/> </rdf:Description> </rdfs:subClassOf> </rdf:Description> <rdf:Description rdf:about=""TaxonomieDerLebewesen:lions""> <rdfs:subClassOf rdf:resource=""TaxonomieDerLebewesen:cats""/> </rdf:Description> <rdf:Description rdf:about=""TaxonomieDerLebewesen:houseMice"">'
 '</rdf:Description> <rdf:Description rdf:about=""Taxonomie-der-Lebewesen:animals""> <rdfs:subClassOf rdf:resource=""Taxonomie-der-Lebewesen:livingBeings""/> </rdf:Description> <rdf:Description rdf:about=""Taxonomie-der-Lebewesen:predators""> <rdfs:subClassOf rdf:resource=""Taxonomie-der-Lebewesen:animals""/> </rdf:Description> <rdf:Description rdf:about=""Taxonomie-der-Lebewesen:rodents""> <rdfs:subClassOf rdf:resource=""Taxonomie-der-Lebewesen:animals""/> </rdf:Description> </rdf:RDF>']","Dieses Schluesselwort spezifiziert die Klassen, deren Elemente Objekt einer bestimmten Eigenschaft sein koennen.",0.8714123618132555,0.5,1.0,0.94999999997625,0.5153721118472498
Welche Container-Klassen gibt es in RDF?,"Hallo!  In dem gegebenen Kontext findest du keine explizite Erwaehnung von Container-Klassen in RDF. Es werden jedoch RDF-Schemata und Ontologien vorgestellt, die sich mit den Verwendung von Klassen und Relationen in RDF befassen.  Ich kann also leider keine Antwort auf deine Frage geben, da der Kontext keine relevanten Informationen fuer diese Frage enthaelt.","['Inhaltsverzeichnis 1. Einleitung 2. Motivation und Einfuehrung 3. Einfuehrung zu Semantik und RDF 4. RDF Schemata 5. Erzeugung von Ontologien mittels OWL 6. Metadaten 7. Anhang 8. Literatur 9. Loesungen der Selbsttestaufgaben'
 '8. Index description logics  17 Entitaeten  8 Entity-Relationship-Modelle  10 FOAF-Ontologie  11 Heterogenitaet  6 Homonyme und Synonyme  13 Hybridansatz  23 Information Retrieval  20 Interoperabilitaet  7 Klassenframes  16 Knowledge Interchange Format  17 kompetente Fragen  27 Konzepte  13 Konzeptualisierung  8 konzeptuelle Datenbankschemata  10 leichtgewichtige Ontologien  17 mehrfache-Ontologien  22 Ontologie  8 Ontologie-Aligning  26 Praedikatenlogik  17 Querymodell  23 RDF-Schema  14 RDFS-Triples  14 Reasoning  25 Regelsystem  16 schwergewichtige Ontologien  17'
 '</rdf:Description> <rdf:Description rdf:about=""Taxonomie-der-Lebewesen:animals""> <rdfs:subClassOf rdf:resource=""Taxonomie-der-Lebewesen:livingBeings""/> </rdf:Description> <rdf:Description rdf:about=""Taxonomie-der-Lebewesen:predators""> <rdfs:subClassOf rdf:resource=""Taxonomie-der-Lebewesen:animals""/> </rdf:Description> <rdf:Description rdf:about=""Taxonomie-der-Lebewesen:rodents""> <rdfs:subClassOf rdf:resource=""Taxonomie-der-Lebewesen:animals""/> </rdf:Description> </rdf:RDF>'
 'Inhaltsverzeichnis 1. Einleitung 2. XSL-Transformationen 3. XQuery 4. Anhang 5. Literatur 6. Loesungen der Selbsttestaufgaben'
 '<rdf:Description rdf:about=""TaxonomieDerLebewesen:cats""> <rdfs:subClassOf> <rdf:Description rdf:about=""TaxonomieDerLebewesen:predators""> <rdfs:subClassOf rdf:resource=""TaxonomieDerLebewesen:animals""/> </rdf:Description> </rdfs:subClassOf> </rdf:Description> <rdf:Description rdf:about=""TaxonomieDerLebewesen:lions""> <rdfs:subClassOf rdf:resource=""TaxonomieDerLebewesen:cats""/> </rdf:Description> <rdf:Description rdf:about=""TaxonomieDerLebewesen:houseMice"">']","rdf: bag, rdf: Seq und rdf: Alt.",0.0,0.3333333333333333,1.0,0.0,0.7078920765901371
Wie wird in OWL die Aequivalenz von zwei Klassen definiert?,"In OWL, die Aequivalenz von zwei Klassen wird durch das Axiom ""EquivalentClasses"" definiert. Dieses Axiom hat die folgende Syntax:  axiom ::= 'EquivalentClasses(' classID classID { classID } ')'  Ein Beispiel dafuer ist:  EquivalentClasses(x:PKW x:Auto)  Hier wird definiert, dass man mit PKW und Auto die gleichen Mengen von Objekten bezeichnen moechte.","[""durch das Axiom beschrieben wird. Ein Beispiel hierfuer ist die Klasse Auto, fuer die nur festgelegt ist, dass sie vier Reifen hat und von einem Motor angetrieben wird. Nicht festgelegt sind hier u. a. die Anzahl der Tueren. Aequivalenz zwischen Klassen wird folgendermaßen definiert: axiom ::= 'EquivalentClasses(' classID classID { classID } ')' Ein Beispiel zur Verwendung sieht folgendermaßen aus: EquivalentClasses(x:PKW x:Auto) Hier wird definiert, dass man mit PKW und Auto die gleichen Mengen von Objekten bezeichnen moechte. Bei OWL DL sieht die Definition von Klassen folgendermaßen aus: axiom                   ::= 'Class(' classID  ['Deprecated']                              modality { annotation } { description } ')' modality ::= 'complete' | 'partial'""
 ""EquivalentClasses(x:PKW x:Auto) Hier wird definiert, dass man mit PKW und Auto die gleichen Mengen von Objekten bezeichnen moechte. Bei OWL DL sieht die Definition von Klassen folgendermaßen aus: axiom                   ::= 'Class(' classID  ['Deprecated']                              modality { annotation } { description } ')' modality ::= 'complete' | 'partial' In OWL DL werden Klassen durch so genannte descriptions spezifiziert. Decriptions koennen wie bei OWL Lite aus Klassen und Restriktionen bestehen. Darueber hinaus lassen sich Descriptions aus einer beliebig verschachtelbaren booleschen Kombination aus mehreren Descriptions gewinnen. Außerdem kann eine Description eine Auswahl von bestimmten Individuen beschreiben. description ::= classID                   | restriction""
 'intersectionOf(x:WeißeDinge x:Wein) Die Ergebnismenge enthaelt daher nur Weißweine und keine Rotweine. intersectionOf(complementOf(x:Maenner) x:Menschen) Um in diesem Beispiel die Menge aller Frauen zu definieren, wird die Menge aller Menschen mit dem Komplement der Menge aller Maenner geschnitten. Die Definition allein ueber das Komplement der Maenner koennte evtl. nicht ausreichen, da diese Menge alle Individuen enthalten wuerde, welche nicht der Klasse Maenner angehoeren, Maenner aber einer weiteren Oberklasse zuge¬hoerig sein koennten. Noch ein Beispiel zur Klassendeklaration in OWL DL: Class(x:Pegasus complete intersectionOf(x:Pferd x:Vogel)) Dies ist ein Beispiel fuer eine Klasse, die als complete definiert wird, d. h. dass die Klasse komplett und eindeutig spezifiziert ist.'
 'Inhaltsverzeichnis 1. Einleitung 2. Motivation und Einfuehrung 3. Einfuehrung zu Semantik und RDF 4. RDF Schemata 5. Erzeugung von Ontologien mittels OWL 6. Metadaten 7. Anhang 8. Literatur 9. Loesungen der Selbsttestaufgaben'
 ""alle Individuen enthalten wuerde, welche nicht der Klasse Maenner angehoeren, Maenner aber einer weiteren Oberklasse zuge¬hoerig sein koennten. Noch ein Beispiel zur Klassendeklaration in OWL DL: Class(x:Pegasus complete intersectionOf(x:Pferd x:Vogel)) Dies ist ein Beispiel fuer eine Klasse, die als complete definiert wird, d. h. dass die Klasse komplett und eindeutig spezifiziert ist. unionOf( x:Fahrrad x:Moped x:Motorrad ) Das Beispiel vereinigt Fortbewegungsmitte, also die Klassen der Fahrraeder, der Mopeds und der Motorraeder. In OWL DL ist es zudem moeglich, dass eine Klasse aus einer Menge von Individuen konstruiert wird. axiom ::= 'EnumeratedClass(' classID ['Deprecated'] { annotation } { individualID } ')'""]",axiom ::= 'EquivalentClasses(' classID classID { classID } ')',0.8873186801144298,0.6,0.42857142857142855,0.94999999997625,
Wie kann das Problem der semantischen Heterogenitaet reduziert werden?,"Liebe(r) Benutzer(in),  Das Problem der semantischen Heterogenitaet kann reduziert werden, indem Ontologien eingesetzt werden. Ontologien sind ein Mittel zur Konzeptionalisierung bzw. zur Beschreibung von komplexen Konzepten ueber das Wissen einer Domaene und sind eine wesentliche Methode fuer die interoperablen Repraesentation im Semantic Web.  Entspricht diese Antwort nicht den Erwartungen, bitten Sie mich bitte um weitere Erklaerung oder Ausfuehrlichkeit.  Ich hoffe, dass ich Ihnen geholfen habe!","['Die durch die semantische Heterogenitaet entstehenden Konflikte erschweren die Interoperabilitaet zwischen Softwareagenten oder Webservices, die Information nicht nur wiederverwenden sondern auch verarbeiten wollen. Missverstaendnisse, hervorgerufen durch Begriffe und ihre Attribute, kann man durch Vereinbarungen und Standardisierungen eliminieren. Ontologien reduzieren das Problem der Heterogenitaet und koennen daher fuer die gemeinsame Informationsnutzung eingesetzt werden [3].Interoperabilitaet Selbsttestaufgabe 7.1 Was wird unter der semantischen Heterogenitaet verstanden? Selbsttestaufgabe 7.2 Nennen und erklaeren Sie die drei Konzepte der semantischen Heterogenitaet.'
 'Inhaltsverzeichnis 1. Einleitung 2. Semantische Integration: Konflikte und Loesungsansaetze 2.1. Heterogenitaetskonflikte auf unterschiedlichen Ebenen 2.2. Heterogenitaetskonflikte zwischen Datenmodellen 2.3. Heterogenitaetskonflikte zwischen Datenschemata 2.4. Heterogenitaetskonflikte zwischen Daten-Instanzen 2.5. Loesungsansaetze fuer die Semantische Integration 2.6. Semantische Modelle darstellen und vergleichen 3. Zusammenfassung 4. Literaturverzeichnis 5. Loesungen der Selbsttestaufgaben 6. Index'
 'Semantische IntegrationProbleme bei der Etablierung eines Semantischen Netzes Als zentrale Probleme erweisen sich im Semantischen Netz die syntaktische, strukturelle und semantische Heterogenitaet der Informationsquellen. Um eine sinnvolle Nutzung derartiger heterogener Informationsquellen gewaehrleisten zu koennen, ist die automa- tische Zusammenfuehrung ihrer Inhalte unumgaenglich. Dies wird unter dem Begriff der Semantischen Integration ( semantic integration ) behandelt. Die technische Umsetzung wird in der Regel durch das Mediatorenmodell (vgl. 2.5.1) realisiert. Die eindeutige Darstellung der Semantik der Information in schwach strukturierter Umgebung ist dabei eine wesentliche Voraussetzung, um die mit der Heterogenitaet der Daten verbundenen Probleme zu loesen [4].'
 'Dies wird unter dem Begriff der Semantischen Integration ( semantic integration ) behandelt. Die technische Umsetzung wird in der Regel durch das Mediatorenmodell (vgl. 2.5.1) realisiert. Die eindeutige Darstellung der Semantik der Information in schwach strukturierter Umgebung ist dabei eine wesentliche Voraussetzung, um die mit der Heterogenitaet der Daten verbundenen Probleme zu loesen [4]. Die Probleme, die sich allgemein aus der Heterogenitaet der Daten ergeben, sind aus dem Bereich der verteilten Datenbanksysteme bereits gut bekannt. Es lassen sich dabei drei wesentliche Problemfelder benennen: ·        die Syntax – z. B. heterogene Datenformate ·        die Struktur – z. B. Homonyme, Synonyme oder unterschiedliche Attributnamen in Datenbanktabellen'
 'Das Problem liegt demnach darin, dass die der Abstraktion zugrunde liegenden Werte- Systeme nicht dieselbe Anzahl an Werten besitzen. Loesung zu Selbsttestaufgabe 6.4 Mit Disambiguierung ist die Aufloesung sprachlicher Mehrdeutigkeit und die Ermittlung der beabsichtigten Bedeutung der Terme im jeweiligen Zusammenhang gemeint. Loesung zu Selbsttestaufgabe 6.5 Ontologien sind ein Mittel zur Konzeptionalisierung bzw. zur Beschreibung von komplexen Konzepten ueber das Wissen einer Domaene und sind eine wesentliche Methode fuer die interoperablen Repraesentation im Semantic Web.']","Das Problem der semantischen Heterogenitaet kann reduziert werden, wenn alle Begriffe, die eine Ontologie beschreibt, moeglichst eindeutig und nicht-redundant definiert werden und weltweit gueltig sind.",0.0,0.8,,0.99999999998,0.4775235142463498
Was sind die minimalen Bestandteile einer Ontologie?,"Laut dem gegebenen Kontext sind die minimalen Bestandteile einer Ontologie:  * Konzepte (Klassen) * Instanzen (Begriffe) * Relationen  Diese Bestandteile werden genutzt, um Strukturen in einer Ontologie zu erstellen.","['Inhaltsverzeichnis 1. Einleitung 2. Motivation und Einfuehrung 3. Einfuehrung zu Semantik und RDF 4. RDF Schemata 5. Erzeugung von Ontologien mittels OWL 6. Metadaten 7. Anhang 8. Literatur 9. Loesungen der Selbsttestaufgaben'
 'Inhaltsverzeichnis 1. Einleitung 2. XSL-Transformationen 3. XQuery 4. Anhang 5. Literatur 6. Loesungen der Selbsttestaufgaben'
 '3. Ontologien weiter zu: Der Begriff Ontologie'
 'gestellt durch eine Liste von Begriffen, die von einer Registrierungsinstanz verwaltet wird. Woerterbuecher und Lexika beispielsweise beschreiben Begriffe informell eindeutig und werden allgemein fuer ein besseres Verstaendnis zwischen Menschen und Organisationen genutzt. Im grundsaetzlichen Aufbau besteht eine Ontologie aus mehreren Bestandteilen. Um Strukturen zu erstellen werden im Folgenden die minimalen Bestandteile einer Ontologie genannt: Konzepte  (Klassen): Konzepte fassen real existierende Instanzen mit gemeinsamen Eigenschaften zusammen. Instanzen  (Begriffe): Instanzen stellen die eigentlichen Objekte dar. Relationen : Relationen verbinden Konzepte und Instanzen miteinander. Einige Beispiele fuer Ontologien, basierend auf diesen Bestandteilen, werden im'
 'schema mapping schema matching semantic web Semantischen Integration  semantischer Kontext  Subsumptio n surjective mappings Thesauri  Ueberlappung  Vektorraum-Modell  Wissensrepraesentation  Wrapper']","Konzepte, Instanzen und Relationen.",0.9031770736620487,1.0,1.0,0.47777777776185176,0.814327960382663
Was ist ein Konzept?,"Das ist eine leicht zu beantwortende Frage!  Ein Konzept ist nach dem Kontext, den wir gegeben haben, eine gedankliche Vorstellung oder die subjektive Interpretation ueber ein reales Ding in der Welt. Es bildet mit den Symbolen eine Bruecke zwischen der impliziten gedanklichen Vorstellung eines Weltbildes und des physikalischen expliziten Modells der Welt.","['Konzepte [13, 14]. Ein Konzept ist eine gedankliche Vorstellung bzw. die subjektive Interpretation ueber ein reales Ding in der Welt. Die Gesamtheit aller Konzepte bildet mit den Symbolen eine Bruecke zwischen der impliziten gedanklichen Vorstellung eines Weltbildes und des physikalischen expliziten Modells der Welt.Konzepte Problematisch kann sich dabei die Zuordnung des Symbols auf den Gegenstand erweisen, wenn diese nicht mehr eindeutig ist. So kann das Symbol „Kaefer“ sowohl dem Konzept „Auto“ als auch dem Konzept „Tier“ zugeordnet werden [15]. Hier sei auf die Problematik der Homonyme und Synonyme hingewiesen.Homonyme und Synonyme Die Semantik ergibt sich aus der Verknuepfung eines Symbols mit einem Konzept, das'
 'genannt: Konzepte  (Klassen): Konzepte fassen real existierende Instanzen mit gemeinsamen Eigenschaften zusammen. Instanzen  (Begriffe): Instanzen stellen die eigentlichen Objekte dar. Relationen : Relationen verbinden Konzepte und Instanzen miteinander. Einige Beispiele fuer Ontologien, basierend auf diesen Bestandteilen, werden im Folgenden erlaeutert.Abbildung 7.1: Ontologien und ihre Verwandten'
 'auf ein und dasselbe Konzept beziehen. ·        Bei semantisch unabhaengigen Konzepten  kann es zu Verstaendnisproblemen kommen, wenn der gleiche Begriff fuer unterschiedliche Konzepte verwendet wird. ·        Bei semantisch abhaengigen Konzepten  wird die Heterogenitaet anhand von Generalisierung und Spezifizierung beschrieben. 7.3 Erklaeren Sie den Begriff der Taxonomie. Mit einer Taxonomie werden Mengen von Konzepten von kontrollierten Vokabularen eines Themengebietes definiert und in eine hierarchische Beziehung gesetzt, um eine moeglichst praezise Beschreibung und Repraesentation eines Themengebiets zu erhalten. Eine Taxonomie ist also ein Klassifikationsschema. 7.4 In welche vier Bereiche laesst sich die Formalitaet einer Sprache, die eine'
 '""http://www.w3.org/TR/REC -html40/strict.dtd"">   <!-- Alternativen zu ""Strict"" sind ""Transitional"" und ""Frameset"".  -->    <html>   <head><title>Konzept</title>    <LINK REL=""stylesheet"" TYPE=""text/css"" HREF=""style.c ss"">   </head>     <body class=""Konzept"">     <div class=""Briefkopf"">      <div class=""Institution"">       <center><img src=""fbLogo.gif""/></center>      </div>     <div class=""Autorinnen"">    <h4 class=""Autorin"">     Prof. Dr. Anne Br&uuml;ggemann -Klein<br />     Dr. Angeli ka Reiser<br />'
 '8. Index description logics  17 Entitaeten  8 Entity-Relationship-Modelle  10 FOAF-Ontologie  11 Heterogenitaet  6 Homonyme und Synonyme  13 Hybridansatz  23 Information Retrieval  20 Interoperabilitaet  7 Klassenframes  16 Knowledge Interchange Format  17 kompetente Fragen  27 Konzepte  13 Konzeptualisierung  8 konzeptuelle Datenbankschemata  10 leichtgewichtige Ontologien  17 mehrfache-Ontologien  22 Ontologie  8 Ontologie-Aligning  26 Praedikatenlogik  17 Querymodell  23 RDF-Schema  14 RDFS-Triples  14 Reasoning  25 Regelsystem  16 schwergewichtige Ontologien  17']",Ein Konzept ist eine gedankliche Vorstellung bzw. die subjektive Interpretation ueber ein reales Ding in der Welt.,0.8764121589949075,0.6666666666666666,1.0,0.99999999995,0.6088603274056253
Was ist ein Wissenskontext?,"Das ist eine gute Frage!  Ein Wissenskontext bezeichnet die spezifische Bedeutung und Verstaendigung, die fuer Entitaeten und ihre Beziehungen innerhalb einer bestimmten Domaene oder Ontologie besteht. In diesem Kontext (woertlich: semantischen Kontext) wird sichergestellt, dass verschiedene Informationssysteme miteinander interoperabel sind und Informationen austauschen koennen.  Das Konzept des Wissenskontexts ist also eng mit der Semantik und der Ontologie verbunden. Es ermoeglicht die Kommunikation zwischen verschiedenen Systemen und die automatische maschinelle Verarbeitung von Informationen, wie es in der Selbsttestaufgabe beschrieben wird.","['schema mapping schema matching semantic web Semantischen Integration  semantischer Kontext  Subsumptio n surjective mappings Thesauri  Ueberlappung  Vektorraum-Modell  Wissensrepraesentation  Wrapper'
 '3.4. Die Spezifikation eines Wissenskontexts Die Spezifikation eines Wissenskontexts bedeutet, dass man sich gegenseitig darauf verstaendigen und einigen muss, welche Bedeutung die Entitaeten haben, die den Inhalt einer Web-Informationsressource repraesentieren. Es haben sich in verschiedenen Gebieten verschiedene Ontologien entwickelt, die ueberlappende Informationen enthalten. Nach Jasper und Uschold [17] unterscheiden sich Ontologien nach dem Grad der Formalitaet und nach dem Maß der Definitionstiefe. Grad der Formalitaet Der Grad der Formalitaet bestimmt den Grad der semantischen Interoperabilitaet, der Faehigkeit zur Zusammenarbeit heterogener Informationssysteme nicht nur syntaktischer, sondern auch inhaltlicher Art. Die Formalitaet einer Sprache, die eine Ontologie'
 'Inhaltsverzeichnis 1. Einleitung 2. Motivation und Einfuehrung 3. Einfuehrung zu Semantik und RDF 4. RDF Schemata 5. Erzeugung von Ontologien mittels OWL 6. Metadaten 7. Anhang 8. Literatur 9. Loesungen der Selbsttestaufgaben'
 'Hintergrund der dargestellten Informationen interpretieren und automatisch maschinell weiterverarbeiten. Darueber hinaus sollen Beziehungen zwischen den interpretierten Informationen vom System erkannt werden. Methoden der Wissensrepraesentation und -verarbeitung sollen sowohl eine gemeinsame Nutzung als auch Zugriff auf verteilte Infor- mationsquellen ermoeglichen.'
 'Selbsttestaufgabe 6.2 Fassen Sie mit eigenen Worten zusammen was ein „Meta-Level Konflikt“ ist.']","Die Spezifikation eines Wissenskontexts bedeutet, dass man sich gegenseitig darauf verstaendigen und einigen muss, welche Bedeutung die Entitaeten haben, die den Inhalt einer Web-Informationsressource repraesentieren.",0.7819480482380626,0.375,0.5,0.4499999999775,0.47552434024724044
Was ist eine semi-formale Sprache?,"Eine semi-formale Sprache ist eine kuenstlich formal definierte Sprache, die die Beschreibung der Begriffe sowohl informell in einer natuerlichen Sprache als auch formal in einer fuer Computer interpretierbaren Wissensrepraesentationssprache unterstuetzt [18].","['·       Semi-formal Eine semi-formale Sprache ist eine kuenstlich formal definierte Sprache, die die Beschreibung der Begriffe sowohl informell in einer natuerlichen Sprache als auch formal in einer fuer Computer interpretierbaren Wissensrepraesentationssprache unterstuetzt [18]. ·       Rigoros formal Eine auf der Praedikatenlogik basierende formale Sprache treibt den Stan- dardisierungsprozess voran und ermoeglicht die Entwicklung von Schlussfolgerungskalkuelen, welche gueltige Eigenschaften von Mengen von Ausdruecken ableiten, sodass Fragen der Vollstaendigkeit und Korrektheit von formalen Spezifikationen ueberprueft werden koennen. 7.5 Nennen Sie zwei Anwendungsbeispiele fuer Ontologien. ·        Kommunikation: Ontologien reduzieren die semantischen und terminologischen'
 'Semantic Web  12 semantisch abhaengige Konzepte  7 semantisch aequivalente Konzepte  6 semantischen Interoperabilitaet  15 semi-formale Sprache  15 Single-Ontologie  21 Taxonomie  9 Top-level-Ontologien  14 Uniform Resource Locator  13 Upper-Ontologie  15 Verifikation  24 Vokabularien  14 Webstandards  17'
 'repraesentiert, laesst sich in vier Bereiche einteilen:Semantische Interoperabilitaet Total-informell Eine Ontologie wird einfach in natuerlicher Sprache beschrieben, viele Glossare passen in diese Kategorie. Semi-informell Die Ontologie wird in einer strukturierten Form mittels einer natuerlichen Sprache dargestellt, die Mehrdeutigkeiten reduziert. Dies kann z. B. eine Taxonomie, also ein Wortschatz sein, der in einer Generalisierungs-Spezialisierungs-Hierarchie strukturiert ist. Semi-formal Eine semi-formale Sprache ist eine kuenstlich formal definierte Sprache, die die Beschreibung der Begriffe sowohl informell in einer natuerlichen Sprache als auch formal in einer fuer Computer interpretierbaren Wissensrepraesentationssprache unterstuetzt [18].semi-formale Sprache'
 'The seminar is structured as follows: In the first face -to-face session at the beginning of  the semester (TBD), you will be given an overview of various ethical issues in the field of  language problems, language technology and AI in general. In the following phase, you  will deal intensively with the current state of research on a specific problem. This  includes independent research for relevant, current publications (predominantly in  English) and a written paper. At the attendance date towards the end of the semester  (date TBD), you will present your results to the other participants in a presentation and  give each other feedback. Fuer die Teilnahme an einem Seminar ist ein gesondertes Anmeldeverfahren im'
 'Kurs 01877  Einsendeaufgaben  zu Kurseinheit  3  - 5 -      Frage  7      https://www.freeformatter.com/xpath -tester.html']","Eine semi-formale Sprache ist eine kuenstlich formal definierte Sprache, die die Beschreibung der Begriffe sowohl informell in einer natuerlichen Sprache als auch formal in einer fuer Computer interpretierbaren Wissensrepraesentationssprache unterstuetzt.",0.9083141105784941,1.0,1.0,0.8333333332916666,0.8438455637960331
Was sind Beschreibungslogiken?,"Eine einfache Frage!  Die Beschreibungslogiken (description logics) sind eine Familie von Sprachen zur Wissensrepraesentation. Sie basieren auf der Praedikatenlogik erster Stufe und sind entscheidbar, was Schlussfolgerungen ermoeglicht, d.h. aus vorhandenem Wissen kann neues Wissen generiert werden. Beschreibungslogiken richten sich nach dem Open World Prinzip, das weder Ueber-einstimmungen ermitteln noch angenommen wird, dass mangelndes Wissen ueber einen Sachverhalt die Negation dieses Sachverhalts impliziert.","['Eine auf der Praedikatenlogik basierende formale Sprache treibt den Standardisierungsprozess voran und ermoeglicht die Entwicklung von Schlussfolgerungskalkuelen, welche gueltige Eigenschaften von Mengen von Ausdruecken ableiten, sodass Fragen der Vollstaendigkeit und Korrektheit von formalen Spezifikationen ueberprueft werden koennen. Beschreibungslogiken (description logics ) sind eine Familie von Sprachen zur Wissensrepraesentation. Die meisten Beschreibungslogiken sind eine Untermenge der Praedikatenlogik erster Stufe, im Gegensatz zu dieser aber entscheidbar. Dies ermoeglicht Schluss- folgerungen, d. h. aus vorhandenem Wissen kann neues Wissen generiert werden. Beschreibungslogiken  richten sich nach dem Open World Prinzip . Das Open World Prinzip verwendet weder'
 'Uebereinstimmungen ermitteln koennen. Im Fall der 1. Ordnung-Axiomsysteme (Praedikatenlogik 1. Ordnung) kann logisches Schließen genutzt werden, um festzustellen, ob eine Repraesentation eine andere impliziert oder ob zwei Repraesentationen aequivalent sind und daher dieselbe Bedeutung haben [4]. Da der Vergleich von Semantiken, die auf dem Prinzip allgemeiner Deduktion beruhen, sich oft als schwierig erweist, bietet die Beschreibungslogik spezialisierte Schließ- verfahren, um zu ermitteln, ob die Definition eines Konzepts ein Spezialfall  eines anderen ist (oder von diesem subsumiert wird). Diese Moeglichkeit macht Beschrei- bungslogiken zu einem maechtigen Werkzeug zum Beschreiben und Vergleichen von Semantiken und zum verbreitetsten Ansatz fuer die Darstellung von Ontologien [4, 20].'
 'bestimmten Konzepten, waehrend description logics  eine Untermenge der Praedikatenlogik darstellen. Sie bieten eine flexible logische Sprache zur Definition notwendiger und hinreichender Bedingungen an, die bestimmte Instanzen erfuellen muessen, um zu einem Konzept zu gehoeren [4, 18]. Alle erwaehnten Ansaetze zur Beschreibung von Semantiken, die auf charakteristischen Merkmalen von Instanzen beruhen, koennen benutzt werden, um die intendierte Bedeutung von Information zu vergleichen. Auf dem Gebiet des fallbasierten Schließens (reasoning ) sind Aehnlichkeitswerte definiert worden. Diese ermoeglichen den Vergleich von Konzepten, die als auf Attribut-Wert-Paaren basierende „Faelle“ repraesentiert werden. Fuer frame-basierte Sprachen sind Vergleichsalgorithmen vorgeschlagen worden, die'
 'Wissensrepraesentation. Die meisten Beschreibungslogiken sind eine Untermenge der Praedikatenlogik erster Stufe, im Gegensatz zu dieser aber entscheidbar. Dies ermoeglicht Schluss- folgerungen, d. h. aus vorhandenem Wissen kann neues Wissen generiert werden. Beschreibungslogiken  richten sich nach dem Open World Prinzip . Das Open World Prinzip verwendet weder eindeutige Bezeichner noch wird angenommen, dass mangelndes Wissen ueber einen Sachverhalt (etwa bei fehlenden Eintraegen in einer Datenbank) automatisch die Negation dieses Sachverhalts impliziert. Statt in einem solchen Fall also den Wert „falsch“ zurueckzugeben [1] , gibt das Open World Prinzip den Wert „weiss nicht“ zurueck. Das Open World Prinzip geht also grundsaetzlich davon aus, dass Informationen unvollstaendig'
 '8. Index description logics  17 Entitaeten  8 Entity-Relationship-Modelle  10 FOAF-Ontologie  11 Heterogenitaet  6 Homonyme und Synonyme  13 Hybridansatz  23 Information Retrieval  20 Interoperabilitaet  7 Klassenframes  16 Knowledge Interchange Format  17 kompetente Fragen  27 Konzepte  13 Konzeptualisierung  8 konzeptuelle Datenbankschemata  10 leichtgewichtige Ontologien  17 mehrfache-Ontologien  22 Ontologie  8 Ontologie-Aligning  26 Praedikatenlogik  17 Querymodell  23 RDF-Schema  14 RDFS-Triples  14 Reasoning  25 Regelsystem  16 schwergewichtige Ontologien  17']",Beschreibungslogiken(description logics) sind eine Familie von Sprachen zur Wissensrepraesentation.,0.8291261596101659,0.6,,0.99999999998,0.5717323273414014
Welcher Dialekt von OWL ermoeglicht die Verwendung von praedikatenlogischen Ausdruecken hoeheren Grades?,"Loesung:  OWL-FULL ermoeglicht die Verwendung von praedikatenlogischen Ausdruecken hoeheren Grades.  Grundlage: Im Kontext wird OWL-FULL als die ausdrucksmaechtigste logische Sprache beschrieben, die praedikatenlogische Ausdruecke hoeheren Grades ermoeglicht.","['maechtigkeit durch hinreichende und notwendige Bedingungen eingeschraenkt wird. o   OWL- FULL ist die ausdrucksmaechtigste logische Sprache, die praedikatenlogische Ausdruecke hoeheren Grades ermoeglicht. Sie erlaubt es einer Ontologie, die Bedeutung von vordefiniertem RDF- bzw. OWL-Vokabular zu erweitern, allerdings ohne eine Garantie der Verarbeitbarkeit. Mehr ueber die Ausdrucksmaechtigkeit von semantischen Markup-Sprachen erfaehrt man in den Beitraegen A Comparison of (Semantic) Markup Languages  [25] und A Roadmap to Ontology Specification Languages  [26]. Selbsttestaufgabe 7.4 In welche vier Bereiche laesst sich die Formalitaet einer Sprache, die eine Ontologie repraesentiert, einteilen? Benennen und erlaeutern Sie sie.'
 'o   OWL- Lite dient zum schnellen und einfachen Erstellen von Taxonomien und hat eine geringere formale Komplexitaet als OWL-DL. o   OWL- Description Logic (OWL-DL) entspricht OIL und unterstuetzt diejenigen Nutzer, die eine maximale Ausdrucksmaechtigkeit bei gleichzeitiger Erhaltung der Berechenbarkeit benoetigen. Alle Schlussfolgerungen sollen garantiert berechenbar und entscheidbar sein. OWL-DL entspricht der Beschreibungslogik, deren Inferenz- maechtigkeit durch hinreichende und notwendige Bedingungen eingeschraenkt wird. o   OWL- FULL ist die ausdrucksmaechtigste logische Sprache, die praedikatenlogische Ausdruecke hoeheren Grades ermoeglicht. Sie erlaubt es einer Ontologie, die Bedeutung von vordefiniertem RDF- bzw. OWL-Vokabular zu erweitern, allerdings ohne eine Garantie der Verarbeitbarkeit.'
 'Protein and Calculation of Bioavailable Vitamin D in Assessment of Vitamin D Status”. eng. In: Annals of Laboratory Medicine 37.1 (Jan. 2017), pp. 34–38. ISSN: 2234-3814. DOI: 10.3343/alm.2017.37.1.34. [Naw21] Nawroth, Christian: Supporting Information Retrieval of Emerging Knowledge and Argumentation. Hagen 2021. FernUniversitaet in Hagen. [MVH04] Deborah L. McGuinness and Frank Van Harmelen. “OWL web ontology language overview”. In: (2004). [NDH21] Christian Nawroth, Alexander Duttenhoefer, and Matthias Hemmje. “Argumentationsunterstuetzung durch emergentes Wissen in der Medizin”. In: Wilhelm Bauer, Joachim Warschat, Innovation durch Natural Language Processing - Mit Kuenstlicher Intelligenz die Wettbewerbsfaehigkeit verbessern. Carl Hanser Verlag GmbH, 2021. ISBN: 978-3446462625.'
 'Inhaltsverzeichnis 1. Einleitung 2. Motivation und Einfuehrung 3. Einfuehrung zu Semantik und RDF 4. RDF Schemata 5. Erzeugung von Ontologien mittels OWL 6. Metadaten 7. Anhang 8. Literatur 9. Loesungen der Selbsttestaufgaben'
 '•    OWL DL: beinhaltet OWL Lite und bietet eine erweiterte Ausdrucksstaerke. Es genuegt den Anforderungen der Decription Logics, welche die Logik behandelt, die die formelle Basis von OWL begruendet. Aktuelle Softwarewerkzeuge unterstuetzen OWL DL fast vollstaendig. Diese Auspraegung von OWL ist entscheidbar, sprich die Verarbeitung wird in endlicher Zeit ausgefuehrt. •    OWL Full: beinhaltet wiederum OWL DL. Es bedient sich der syntaktischen Freiheit von RDFS und hat volle Ausdrucksstaerke. OWL Full ist nicht entscheidbar und gibt somit']",OWL-FULL,0.807420583431626,1.0,,0.8666666666377778,0.9646903514003624
Ist HTML eine Auszeichnungssprache? Antworte mit Ja oder Nein.,"Ich bin HagenCopilot, dein virtueller Assistent fuer das Fernstudium!  Die Frage 3 lautet:  Welche der folgenden Aussagen treffen auf HTML zu?  Waehlen Sie eine oder mehrere Antworten:  • HTML bedeutet Hypertext Media Language • Der entscheidende Aspekt an HTML ist die Moeglichkeit, Texte nicht nur zu formatieren, sondern Inhalte miteinander zu verknuepfen. • Der Browser gibt bei HTML wegen fehlender Abschlusstags immer Fehlermeldungen aus. • HTML ist ohne WWW nicht moeglich. • Die nicht strenge Handhabung bei HTML – wie etwa die Zulaessigkeit fehlender Abschluss-Tags – wurden spaeter durch die Spezifizierung von XHTML beseitigt. • Durch HTML ist nicht nur die Verknuepfung verschiedener Texte einfach gemacht worden, sondern die Quellen der Texte koennen auch weltweit verteilt im WWW liegen.   Als Antwort auf diese Frage wuerde ich waehlen:  • Der entscheidende Aspekt an HTML ist die Moeglichkeit, Texte nicht nur zu formatieren, sondern Inhalte miteinander zu verknuepfen. • Durch HTML ist nicht nur die Verknuepfung verschiedener Texte einfach gemacht worden, sondern die Quellen der Texte koennen auch weltweit verteilt im WWW liegen.  Ist HTML eine Auszeichnungssprache?   Antwort: Ja","['Antwort: Beschreibungssprache / Auszeichnungssprache         Frage 3  Welche der folgenden Aussagen treffen auf HTML zu?   Waehlen Sie eine oder mehrere Antworten:     • HTML bedeutet Hypertext Media Language   • Der entscheidende Aspekt an HTML ist die Moeglichkeit, Texte nicht nur zu formatieren,  sondern  Inhalte miteinander zu verknuepfen.   • Der Browser gibt bei HTML wegen fehlender Abschlusstags immer Fehlermeldungen aus.   • HTML ist  ohne WWW nicht moeglich.   • Die nicht strenge Hand\xadhabung bei HTML – wie etwa die Zulaessigkeit fehlender Abschluss - Tags – wurden spaeter durch die Spezifizierung von XHTML beseitigt.   • Durch HTML ist nicht nur die Verknuepfung verschiedener Texte einfach gemacht worden,  sondern die Quellen der Texte koennen auch weltweit verteilt im WWW liegen.'
 'Kurs 01877  Einsendeaufgaben  zu Kurseinheit  3  - 5 -      Frage  7      https://www.freeformatter.com/xpath -tester.html'
 'strom mit eingebetteten Auszeichnungen (Markierungen, engl. markup ) darstellt  und HTML damit eine Auszeichnungssprache (engl. markup language ) ist. Eingebet- tetes Markup b eschreibt das Dokument als eine hierarchische Struktur von Elemen- ten und Text mit einem Wurzelelement; Elemente koennen weitere Elemente, Text  oder auch beides in gemischter Form enthalten.   Die Art und Weise, Formatierungsbe fehle fuer die Elemente eines Dokumentes  mit spitzen Klammern zu umgeben, koennte noch aus der ersten Kurseinheit  bekannt sein. Dort wurde auch der Begriff Markierung (engl. tag) fuer die Codierung   von Formatierungen mit hilfe von oeffnenden und schließenden Ta gs, welche den  Namen der Formatierungsfunktion in eckigen Klammern beinhalten, eingefuehrt.'
 'Auszeichnungssprachen definiert werden koennen   • Die Sprache  XML war die Ausgangsbasis  zur Entwicklung  von HTML  und SGML.   • XML beinhaltet  keine  weitere  Grammatik,  und wird so auch  nicht  durch  die Syntax  eines  XML-Dokumentes strikt definiert.   • Ein wohlgeformtes  XML-Dokument,  das mit einem  Dokumentenmodell  verknuepft  ist und  dem Schema genuegt, heißt gueltig.   • Ein XML-Dokument  muss  mit einer  XML-Deklaration  beginnen.  Diese  ist verpflichtend.   • XML bietet  die Moeglichkeit,  nahezu  beliebige  Datenkollektionen  strukturiert  und  anwendungsunabhaengig zu speichern.       Frage  2  Welche  der folgenden  Deklarationen  eines  Elementes  ist korrekt?     • <ELEMENT  titel (#!PCDATA!)>   • <!ELEMENT  titel (#PCDATA)>   • <ELEMENT>  titel (#PCDATA)></ELEMENT>'
 '• HTML ist – wie auch SGML – ISO-zertifiziert und kann als Grundlage aller  Beschreibungssprachen betrachtet werden   • SGML wurde 1990 unter ISO 8879 offiziell registriert   • SGM L wurde 1986 unter ISO 8879 offiziell registriert         Frage 2   Schreiben Sie das hier dem Kurstext zufolge fehlende Wort auf:     SGML ist die standardisierte und generalisierte   *****    .   Antwort: Beschreibungssprache / Auszeichnungssprache         Frage 3  Welche der folgenden Aussagen treffen auf HTML zu?   Waehlen Sie eine oder mehrere Antworten:     • HTML bedeutet Hypertext Media Language   • Der entscheidende Aspekt an HTML ist die Moeglichkeit, Texte nicht nur zu formatieren,  sondern  Inhalte miteinander zu verknuepfen.']",Ja.,0.8399848896895411,0.45454545454545453,0.2857142857142857,0.8041666666465626,0.40759822727382905
Ist JavaScript eine Auszeichnungssprache? Antworte mit Ja oder Nein.,"Eine Frage!  Zur Frage: Ist JavaScript eine Auszeichnungssprache?  Antwort: Nein.  Gruende: JavaScript ist eine Skriptsprache, die zum einen fuer den Einsatz auf Webseiten entwickelt wurde und zum anderen in vielen anderen Bereichen wie z.B. Mobilgeraeten, Spielkonsolen oder auch Desktop-Systemen eingesetzt wird. Auszeichnungssprachen wie HTML, XML etc. dienen jedoch vor allem der Darstellung von Inhalten, Datenmodellierung und -austausch, wohingegen JavaScript den Fokus auf die Interaktion zwischen Benutzer und Webseiten oder auf die Manipulation von Inhalten auf Webseiten legt.  Ich hoffe, diese Antwort hilft!","['Kurs 01877  Einsendeaufgaben  zu Kurseinheit  3  - 5 -      Frage  7      https://www.freeformatter.com/xpath -tester.html'
 'Antwort: Beschreibungssprache / Auszeichnungssprache         Frage 3  Welche der folgenden Aussagen treffen auf HTML zu?   Waehlen Sie eine oder mehrere Antworten:     • HTML bedeutet Hypertext Media Language   • Der entscheidende Aspekt an HTML ist die Moeglichkeit, Texte nicht nur zu formatieren,  sondern  Inhalte miteinander zu verknuepfen.   • Der Browser gibt bei HTML wegen fehlender Abschlusstags immer Fehlermeldungen aus.   • HTML ist  ohne WWW nicht moeglich.   • Die nicht strenge Hand\xadhabung bei HTML – wie etwa die Zulaessigkeit fehlender Abschluss - Tags – wurden spaeter durch die Spezifizierung von XHTML beseitigt.   • Durch HTML ist nicht nur die Verknuepfung verschiedener Texte einfach gemacht worden,  sondern die Quellen der Texte koennen auch weltweit verteilt im WWW liegen.'
 'Inhaltsverzeichnis 1. Einleitung 2. XSL-Transformationen 3. XQuery 4. Anhang 5. Literatur 6. Loesungen der Selbsttestaufgaben'
 'Auszeichnungssprachen definiert werden koennen   • Die Sprache  XML war die Ausgangsbasis  zur Entwicklung  von HTML  und SGML.   • XML beinhaltet  keine  weitere  Grammatik,  und wird so auch  nicht  durch  die Syntax  eines  XML-Dokumentes strikt definiert.   • Ein wohlgeformtes  XML-Dokument,  das mit einem  Dokumentenmodell  verknuepft  ist und  dem Schema genuegt, heißt gueltig.   • Ein XML-Dokument  muss  mit einer  XML-Deklaration  beginnen.  Diese  ist verpflichtend.   • XML bietet  die Moeglichkeit,  nahezu  beliebige  Datenkollektionen  strukturiert  und  anwendungsunabhaengig zu speichern.       Frage  2  Welche  der folgenden  Deklarationen  eines  Elementes  ist korrekt?     • <ELEMENT  titel (#!PCDATA!)>   • <!ELEMENT  titel (#PCDATA)>   • <ELEMENT>  titel (#PCDATA)></ELEMENT>'
 ""}      /* Hier die spezifischen Styles: */   body {      font-family: 'Trebuchet MS', 'Lucida Grande', 'Lucida Sans  Unicode', 'Lucida Sans', Tahoma, sans -serif;      line-height: 1.6;       color: blue;       background -color: lightyellow;   }    .page-wrapper {       /*    Lesefluss opimieren durch Zeilenbreite begrenzen! */       max-width: 60em;       margin: 0 auto;       padding: 5% 10%;   }        h1,""]",Nein.,0.8695421700600577,0.2,0.0,0.0,0.612706276492458
Gibt es bei CSS zweistellige Operatoren? Antworte mit Ja oder Nein.,"Ich kann Ihnen helfen!  Nach dem Kontext und den gegebenen Informationen kann ich sagen, dass es bei CSS keine zweistelligen Operatoren gibt. Der richtige Ausschluss ist also die Option ""Es gibt bei CSS auch zweistellige Operatorer"".  Antwort: Nein","['Frage 4  Welche der folgenden Punkte treffen auf CSS zu?   Waehlen Sie eine oder mehrere Antworten:     • In CSS gibt es Steuerdirektiven   • In CSS gibt es keine Charset Direktiven   • Kommentare in CSS folgen dem Muster: /*«Kommentartext»*/   • Kommentare in CSS koennen auch geschach telt werden.   • Es gibt bei CSS auch zweistellige Operatoren.   • Ein Selektor wird immer in Bezug auf ein HTML -Dokument ausgewertet, und zwar zu einer  Menge von Dokumentenknoten oder Vorkommen von Elemen\xadten im Dokument.   • Ein Ausdruck kann fuer jeden Parameter ver wendet werden, naemlich das Schluesselwort  inherit, das mit Anfuehrungszeichen einzugeben ist.'
 'Kurs 01877  Einsendeaufgaben  zu Kurseinheit  3  - 5 -      Frage  7      https://www.freeformatter.com/xpath -tester.html'
 'Inhaltsverzeichnis 1. Einleitung 2. XSL-Transformationen 3. XQuery 4. Anhang 5. Literatur 6. Loesungen der Selbsttestaufgaben'
 '• HTML ist  ohne WWW nicht moeglich.   • Die nicht strenge Hand\xadhabung bei HTML – wie etwa die Zulaessigkeit fehlender Abschluss - Tags – wurden spaeter durch die Spezifizierung von XHTML beseitigt.   • Durch HTML ist nicht nur die Verknuepfung verschiedener Texte einfach gemacht worden,  sondern die Quellen der Texte koennen auch weltweit verteilt im WWW liegen.         Frage 4  Welche der folgenden Punkte treffen auf CSS zu?   Waehlen Sie eine oder mehrere Antworten:     • In CSS gibt es Steuerdirektiven   • In CSS gibt es keine Charset Direktiven   • Kommentare in CSS folgen dem Muster: /*«Kommentartext»*/   • Kommentare in CSS koennen auch geschach telt werden.   • Es gibt bei CSS auch zweistellige Operatoren.'
 '[N99]  J. Niederst. Web Design in a Nutshell. O’Reilly, Sebastopol, California, 1999.   [LB97]  H. W. Lie and B. Bos. Cascading Style Sheets: Designing for the Web. Addison  Wesley Longman, Essex, England, 1997.   [W3Crdf14]  W3C Ressource Description Framework. URL: htt ps://www.w3.org/TR/rdf11 - primer/   Letzter Zugriff 26.10.2016   [W3Chtml5CM]  W3C  Working Draft HTML5 Content Models  https://www.w3.org/TR/2011/WD -html5 -20110525/content -models  Letzter  Zugriff 06.03.2023']",Ja.,0.850697655800774,0.6666666666666666,1.0,0.9999999999,0.4947018713012548
Folgen Entity References in HTML dem Muster -<<EntName>>? Antworte mit Ja oder Nein.,Ja.,"['hen werden kann, sollte man beachten, was fuer Kommentare man verfasst.   Die Bedeutung  von Zeichenentitaeten  in HTML  hat speziell  mit der Verwendung  von  UTF-8 erheblich  abgenommen,  aber es gibt immer noch Gruende fuer ihre Verwen- dung. Entity References folgen dem Muster &<<EntName>> ; und dienen in   HTML lediglich als mnemonische Alternative zu Zeichenreferenzen. HTML definiert  eine Reihe solcher mnemonischer  Namen, beispielsweise &Auml; fuer &#xC4;, um  das Zeichen „Ae“ zu referenzieren. Die Entity References &lt;,&gt;,  &amp;,&apos;  und &quot; fuer die Zeichen  ”<“,”>“,”&“,”’“ und””“ dienen als Escap e- Mechanismus, damit diese  Funktionszeichen im Inhalt oder in einem Attributwert  verwendet werden koennen. Das syntaktisch unzulaessige Tag <XXX YYY=’’’>'
 'Inhaltsverzeichnis 1. Einleitung 2. XSL-Transformationen 3. XQuery 4. Anhang 5. Literatur 6. Loesungen der Selbsttestaufgaben'
 'Kurs 01877  Einsendeaufgaben  zu Kurseinheit  3  - 5 -      Frage  7      https://www.freeformatter.com/xpath -tester.html'
 'ferenz referenziert ein Unicode -Zeichen ueber seine Code position. Ein HTML - Dokument darf beliebige Unicode -Zeichen aus dem Bereich von 0 bis FFFF referen- zieren.   Praxistipp:   Kommentare sind hilfreich und sinnvoll. Kommentare werden zwar nicht im  Webbrowser angezeigt, sind aber im Quelltext enthalten. Da der Quelltext eingese- hen werden kann, sollte man beachten, was fuer Kommentare man verfasst.   Die Bedeutung  von Zeichenentitaeten  in HTML  hat speziell  mit der Verwendung  von  UTF-8 erheblich  abgenommen,  aber es gibt immer noch Gruende fuer ihre Verwen- dung. Entity References folgen dem Muster &<<EntName>> ; und dienen in   HTML lediglich als mnemonische Alternative zu Zeichenreferenzen. HTML definiert'
 'eine Reihe solcher mnemonischer  Namen, beispielsweise &Auml; fuer &#xC4;, um  das Zeichen „Ae“ zu referenzieren. Die Entity References &lt;,&gt;,  &amp;,&apos;  und &quot; fuer die Zeichen  ”<“,”>“,”&“,”’“ und””“ dienen als Escap e- Mechanismus, damit diese  Funktionszeichen im Inhalt oder in einem Attributwert  verwendet werden koennen. Das syntaktisch unzulaessige Tag <XXX YYY=’’’>   muss also in der Form <XXX YYY=’&apos;’>  geschrieben werden.   Ein HTML -Dokument  besteht  aus einer  Folge  von Unicode -Zeichen  mit Code - Positionen  im Bereich  von hexadezimal 0000 bis FFFF. Nach den oben dargestellten  Syntaxregeln wird dieser Strom strukturiert in Markup und Inhaltstext. In bestimm- ten Kontexten  dienen  Referenzen  als Makros  oder Abkuerzungen  fuer Unicode -']",Nein.,0.8448207894687222,0.5,0.875,0.9999999999,0.5978198861190366
Duerfen Attributnamen in einem HTML-Dokument mehrmals vorkommen? Antworte mit Ja oder Nein.,Ja.,"['darf der Typ von Anfuehrungsze ichen (einfach oder doppelt), der den Attributwert  begrenzt, im Attributwert nicht im Klartext auftreten. Ein Attributname darf pro  Element nur einmal vorkommen; die Reihenfolge der  Attribute ist ohne Bedeutung.  Das Beispieldokument enthaelt z.  B. ein Eleme nt IMG mit Attribut SRC, dessen Wert  eine URL fuer die Bilddatei angibt:   IMG SRC=""fbLogo.gif""   ALT=""Das Logo der Frauenbeauftragten der TUM"">   Zusammenfassend  folgen  also oeffnende  und schließende  Tags in HTML  den Mustern   <<<EName>><<AName1>>=""<<AWert1>>""   ...  <<ANameN>>=""<<AWertN>>"">   </<<EName>>> ,   wobei die doppelten Anfuehrungszeichen paarweise durch einfache Anfuehrungszei- chen ersetzt werden duerfen. Zusaetzlich duerfen Attributspezifikationen verkuerzt wer-'
 'Inhaltsverzeichnis 1. Einleitung 2. XSL-Transformationen 3. XQuery 4. Anhang 5. Literatur 6. Loesungen der Selbsttestaufgaben'
 'haben immer einen Namen und koennen zusaetzlich  ueber Attribute  verfuegen.  Attribu- te haben  jeweils  einen  Namen  und einen  Wert.  Der Name  des HTML -Elements er- scheint in dem oeffnenden und in dem schließenden Tag fuer das Element. Eventuelle  Attribute erscheinen nur in dem oeffnenden Tag, und zwar nach dem Elementnamen  in der Form <<AName>>=""<<AWert>>""  bzw. <<AName>>=’<<AWert>>’ . Dabei  darf der Typ von Anfuehrungsze ichen (einfach oder doppelt), der den Attributwert  begrenzt, im Attributwert nicht im Klartext auftreten. Ein Attributname darf pro  Element nur einmal vorkommen; die Reihenfolge der  Attribute ist ohne Bedeutung.  Das Beispieldokument enthaelt z.  B. ein Eleme nt IMG mit Attribut SRC, dessen Wert  eine URL fuer die Bilddatei angibt:   IMG SRC=""fbLogo.gif""'
 'ALT=""Das Logo der Frauenbeauftragten der TUM"">   Zusammenfassend  folgen  also oeffnende  und schließende  Tags in HTML  den Mustern   <<<EName>><<AName1>>=""<<AWert1>>""   ...  <<ANameN>>=""<<AWertN>>"">   </<<EName>>> ,   wobei die doppelten Anfuehrungszeichen paarweise durch einfache Anfuehrungszei- chen ersetzt werden duerfen. Zusaetzlich duerfen Attributspezifikationen verkuerzt wer- den. Die Anfuehrungszeichen um die Attributwerte duerfen in Faellen, in denen die  Begrenzung des Wertes klar ist, ganz wegfallen. In bestimmten, in der Sprachdefini- tion von HTML genau angegebenen Faellen, duerfen zusaetzlich der Attributname und  das Gleichheitszeichen we gfallen, sodass der bloße Attributwert ohne Anfuehrungs- zeichen das Attribut repraesentiert. Beispiele fuer Verkuerzungen in diesem Sinne sind'
 '• Es duerfen  nicht  mehr  als drei Autoren  einem  Dokument  zugeordnet  werden.   • Das zweite  Element  <Autor>  schließt  nicht  mit /> sondern  mit >, als ob es ein  schließendes Tag gaebe.   • Beim  Element  <Kurseinheit  KE-Nummer=""1"">  ist der Wert  des Attributs  KE-Titel vorne   von einem doppelten Anfuehrungszeichen "", hinten fehlt es aber.   • Es duerfen  nur die doppelten  Anfuehrungszeichen  verwendet  werden.   • Beim  Element  <Kurseinheit  KE-Nummer=2>  ist der Wert  des Attributs  KE-Nummer  nicht   von Anfuehrungszeichen begrenzt. Diese muessen eingefuegt werden.   • Das Attribut  KE-Nummer  enthaelt  ein Minuszeichen.  Dies ist nicht  zulaessig.   • Das schließende Tag der zweiten Kurseinheit steht nach dem schließenden Tag des']",Nein.,0.8300898161439322,0.0,,0.9999999999,0.7228198861190366
Koennen CSS Stylesheets auch auf XML-Dokumente angewendet werden? Antworte mit Ja oder Nein.,Ja.,"['HTML -Dokumenten durch Regeln, die bestimmte Parametersetzungen fuer  bestimm- te HTML -Elemente festschreiben. Das Binden von Regeln an HTML -Elemente erfolgt  ueber den Namen, die  Attribute oder den strukturellen Ko ntext der HTML -Elemente.   Damit ist CSS im Prinzip anwendbar auf alle Dokumentensprachen, deren  Dokumente Hierarchien von Strukturelementen  und Text bilden und deren  Strukturelemente ueber einen Namen und optional ueber Attribute verfueg en. CSS - Stylesheets  lassen sich auch auf XML -Dokumente anwenden. CSS -Strukturvorgaben  koennen außerhalb von HTML -Dokumenten  gehalten werden. CSS -faehige Browser  praesentieren ein HTML -Dokument in dem durch das Stylesheet vorgegebenen  For- mat. Damit  wird durch  HTML  und CSS zusammen  das Modell  der strukturierten'
 'Anhang: Materialien zu HTML und CSS  74    f. Mit CSS -Stylesheet fo rmatiertes Dokument'
 'Strukturelemente ueber einen Namen und optional ueber Attribute verfueg en. CSS - Stylesheets  lassen sich auch auf XML -Dokumente anwenden. CSS -Strukturvorgaben  koennen außerhalb von HTML -Dokumenten  gehalten werden. CSS -faehige Browser  praesentieren ein HTML -Dokument in dem durch das Stylesheet vorgegebenen  For- mat. Damit  wird durch  HTML  und CSS zusammen  das Modell  der strukturierten   Dokumente  umgesetzt.   Es kann  vorkommen,  dass CSS-Parameter  fuer ein HTML -Element  im Dokument  un- terspezifiziert  oder ueberspezifiziert sind. Es koennen also auch gar keine Regeln und  explizite Werte fuer die Parameter gesetzt bzw. mehrere und widerspruechliche Wert- setzungen definiert sein. Beide Faelle wurden bei CSS vorgesehen. Im Fall der Unter-'
 '6. Loesungen der Selbsttestaufgaben Selbsttestaufgabe 4.1 Beschreiben Sie kurz, was XSLT-Stylesheets sind, und warum man sie nicht auf HTML-Dateien anwenden kann. Ein XSLT-Dokument beinhaltet Regeln, nach denen ein anderes XML-Dokument transformiert werden kann. So ist es zum Beispiel moeglich, ein XML-Dokument zu einem HTML-Dokument zu transformieren, welches das XML-Dokument in Browsern in bestimmter Weise darstellt. Ein XSLT-Dokument wird u. a. auch Stylesheet genannt. Ein Stylesheet enthaelt Vorlagen oder Muster (engl. Templates), die jeweils aus einem Muster und einem Inhalt bestehen. XSLT benutzt bei der Transformation nur das im XML-Dokument vorhandene Markup. Inhaltsmodelle wie DTDs oder XML-Schemata werden nicht einbezogen.'
 'Selbsttestaufgabe 3.1 Erlaeutern Sie den Unterschied zwischen einem wohlgeformten und einem gueltigen XML-Dokument']",Ja.,0.8112742316593939,1.0,0.3333333333333333,0.999999999975,1.0000000000000004
Ist die Entwicklung von XML abgeschlossen? Antworte mit Ja oder Nein.,"Hallo! Ich bin HagenCopilot, dein virtueller Assistent. Ich sehe, dass du nach einer Antwort auf die Frage suchst, ob die Entwicklung von XML abgeschlossen ist.  Lass mich dich beruhigen: Im Kontext des Kurses 01877 und den dazugehoerigen Inhaltsverzeichnissen finden wir keine Information, die direkt auf diese Frage Bezug nimmt. Wir sprechen hier von XSL-Transformationen, XQuery, XML-Dokumenten und weiteren Themen, aber nicht explizit ueber die Zukunft der Entwicklung von XML.  Meine Antwort lautet daher: Nein, die Entwicklung von XML ist nicht abgeschlossen. Laut dem W3C (World Wide Web Consortium), das die XML-Spezifikation entwickelt hat, wird die XML-Familie weiterhin erweitert und verbessert.  Ich hoffe, diese Antwort hilft dir weiter!","['Inhaltsverzeichnis 1. Einleitung 2. XSL-Transformationen 3. XQuery 4. Anhang 5. Literatur 6. Loesungen der Selbsttestaufgaben'
 'Selbsttestaufgabe 3.1 Erlaeutern Sie den Unterschied zwischen einem wohlgeformten und einem gueltigen XML-Dokument'
 'Inhaltsverzeichnis 1. Einleitung 2. Motivation und grundlegende Konzepte von XML 3. Die Struktur von XML-Dokumenten 4. DTD und XSD 5. Konfliktvermeidung bei XML 6. Verweise per XML 7. Anhang 8. Literatur 9. Loesung der Selbsttestaufgaben'
 'Kurs 01877  Einsendeaufgaben  zu Kurseinheit  3  - 5 -      Frage  7      https://www.freeformatter.com/xpath -tester.html'
 'XML-Dokument. </Kapitel> </Inhalt> </buch>']",Nein.,0.8900694913058897,0.3333333333333333,0.0,0.0,0.6872577311939592
Repraesentiert eine Glyphe immer genau ein Zeichen? Antworte mit Ja oder Nein.,Die Frage ist: Repraesentiert eine Glyphe immer genau ein Zeichen?  Antwort: Nein.,"['Kurs 01877  Einsendeaufgaben  zu Kurseinheit  3  - 5 -      Frage  7      https://www.freeformatter.com/xpath -tester.html'
 'phen genannt werden. Glyphen entsprechen auf der Praesentationsebene den Zei- chen auf der Codierung sebene. Die Abbildung 5.5 enthaelt grafische  Auspraegungen  der Glyphen fuer den Buchstaben A, sogenannt e Glyphenbilder . Nach Design und  anderen Charakteristika zusammengehoerige Glyphenbilder bilden einen Font.     Abbildung 5.5 Typogra fie und Auswirkungen   Die Beziehung zwischen abstrakten Zeichen und Glyphen ist komplex. In Tabelle 5.2  gibt es eine beispielhafte Gegenueberstellung. Im einfachsten Fall praesentiert sich ein  einzelnes Zeichen als genau eine Glyphe. Einzelne Gl yphen koennen jedoch auch  ganze Folgen von abstrakten Zeichen darstellen, wie etwa bei den Ligaturen fi , fl, ff  oder ffl. Ein einzelnes  abstraktes  Zeichen  mit Akzent,  wie das Zeichen  oe, kann  durch'
 'tierung den Kontext fuer die Wahl eine s bzw. mehrerer Glyphen.   In vielen Faellen sind die elementaren Texteinheiten, die als abstrakte Zeichen Ein- gang in einen Zeichensatz finden sollen,  nicht offensichtlich. Sowohl aus den  ver- schiedenen Sprachen, deren Texte kodierbar sein sollen, als auch aus den verschie- denen Verarbeitungsfunktionen, die auf die Texte Anwendung finden sollen,  koennen Anforderungen und somit Konflikte erwachsen.  A, A, A, A, A, A,A'
 'Kurs 01877  Einsendeaufgaben  zu Kurseinheit  1  - 1 -    Kurs  01877  Informationsvisualisierung  im Internet  Einsendeaufgaben zu  Kurseinheit  1    Frage  1  Markieren  Sie die korrekten  Aussagen  zum Dokumentenbegriff       Frage  2  Welche  der folgenden  Aussagen  treffen  auf Dokumente  neuerer  Art zu?'
 'darueber positionierte Glyphe fuer den Akzent. Im Tamilischen gibt es Buchstaben,  die  durch ein Paar von Glyphen repraesentiert werden. Dieses Glyphenpaar umrahmt  dann in der formatierten Sicht einen  weiteren Glyphen, der den Nachbarbuchstaben  im Text darstellt. Im Arabischen schließlich gibt es kontextuelle Formen : ein Zeichen  wird je nach dem Kontext seiner Nachbarzeichen durch Glyphen ganz verschiedener  grafischer Form dargestellt. Aehnliche Phaenomen e sind aus der mittelalterlichen Satz- technik bekannt.   Gutenberg verwendete bereits fuer ein - und denselben Buchstaben verschieden brei- te Glyphen. Er verfuegte auch bereits  ueber abkuerzende Symbole fuer Woerter oder Sil- ben, um einen gleichmaeßigen rechten Rand zu erzeugen. Hier gibt also die  Forma-']",Nein.,0.0,0.5,0.0,0.3333333333,0.5008454725327682
Ist META ein Kindelement von HEAD? Antworte mit Ja oder Nein.,Ja!,"['liebig haeufig auftreten. Die Kindelemente von HEAD duerfen in  beliebiger Reihenfol- ge auftreten.   Das Element META stellt zu einem HTML -Dokument Metainformation in Form von  Eigenschaften zur Verfuegung. Eine Eigenschaft hat einen Namen, gegeben durch  das META -Attribut NAME, und einen Wert, gegeben durch das META -Attribut  CONTENT. Die Namen und Wertebereiche der Eigenschaften sind frei. Wir  koennten  also die Versions - und Datumsinformation unseres Beispieldokuments mit META - Elementen folgendermaßen ausdruecken:   <META NAME=""Version"" CONTENT=""1.3"">   <META NAME=""Date"" CONTENT=""12.10.1999"">   In bestimmten Faellen sollte anstelle des Attributes NAME v on META das Attribut  HTTP -EQUIV eingesetzt werden, dann  naemlich, wenn ein Webserver die Information'
 'menten  definiert.  Mit Ausnahme  des Titel-Elements  TITLE  wird vom Webbrowser   kein Inhalt aus dem Kopfdatenbereich angezeigt. Das Titel -Element kann zwar weg- gelassen werden, aber dann handelt es sich um  kein valides HTML und außerdem  hat der Titel bei den Suchmaschinen eine hohe Bedeutung.   Die weiteren Kindelemente vo n HEAD sind META, BASE, STYLE, LINK, SCRIPT und  OBJECT. BASE darf hoechstens einmal vorkommen; die uebrigen Elemente duerfen be- liebig haeufig auftreten. Die Kindelemente von HEAD duerfen in  beliebiger Reihenfol- ge auftreten.   Das Element META stellt zu einem HTML -Dokument Metainformation in Form von  Eigenschaften zur Verfuegung. Eine Eigenschaft hat einen Namen, gegeben durch  das META -Attribut NAME, und einen Wert, gegeben durch das META -Attribut'
 'Selbsttestaufgabe 6.2 Fassen Sie mit eigenen Worten zusammen was ein „Meta-Level Konflikt“ ist.'
 '</head>  koennen verschiedene HTML -Elemente eingefuegt werden, mit denen  der Inhalt und die Darstellung einer Webseite beeinflusst werden koennen.  Das Ele- ment HEAD enthaelt z.  B. Verwaltungsinfor mation zum Dokument, etwa seinen Titel,  Schluesselwoerter fuer Suchmaschinen und andere Daten. Auch werden in diesem Be- reich die Beziehungen zwischen dem Webbrowser und  anderen  Seiten  oder Doku- menten  definiert.  Mit Ausnahme  des Titel-Elements  TITLE  wird vom Webbrowser   kein Inhalt aus dem Kopfdatenbereich angezeigt. Das Titel -Element kann zwar weg- gelassen werden, aber dann handelt es sich um  kein valides HTML und außerdem  hat der Titel bei den Suchmaschinen eine hohe Bedeutung.   Die weiteren Kindelemente vo n HEAD sind META, BASE, STYLE, LINK, SCRIPT und'
 'Inhaltsverzeichnis 1. Einleitung 2. Motivation und Einfuehrung 3. Einfuehrung zu Semantik und RDF 4. RDF Schemata 5. Erzeugung von Ontologien mittels OWL 6. Metadaten 7. Anhang 8. Literatur 9. Loesungen der Selbsttestaufgaben']",Ja.,0.7955349508479926,0.5,1.0,0.9166666666361111,0.7352035403259135
Gibt es bei RDF zweistellige Relationen? Antworte mit Ja oder Nein.,"Eine Frage!  Lass mich nachdenken... Im Kontext von RDF (Resource Description Framework) kommen wir vor allem auf dreistellige Relationen wie Subjekt-Praedikat-Objekt (Subject-Predicate-Object, SPO) oder Ressource-Praedikat-Objekt (Resource-Predicate-Object, RPO) zu sprechen. Diese Struktur ermoeglicht die Darstellung von Beziehungen zwischen Entitaeten.  Ich sehe keine Hinweise auf zweistellige Relationen in der RDF-Struktur. Daher kann ich nur antworten:  Nein.","['Inhaltsverzeichnis 1. Einleitung 2. Motivation und Einfuehrung 3. Einfuehrung zu Semantik und RDF 4. RDF Schemata 5. Erzeugung von Ontologien mittels OWL 6. Metadaten 7. Anhang 8. Literatur 9. Loesungen der Selbsttestaufgaben'
 'Inhaltsverzeichnis 1. Einleitung 2. XSL-Transformationen 3. XQuery 4. Anhang 5. Literatur 6. Loesungen der Selbsttestaufgaben'
 '8. Index description logics  17 Entitaeten  8 Entity-Relationship-Modelle  10 FOAF-Ontologie  11 Heterogenitaet  6 Homonyme und Synonyme  13 Hybridansatz  23 Information Retrieval  20 Interoperabilitaet  7 Klassenframes  16 Knowledge Interchange Format  17 kompetente Fragen  27 Konzepte  13 Konzeptualisierung  8 konzeptuelle Datenbankschemata  10 leichtgewichtige Ontologien  17 mehrfache-Ontologien  22 Ontologie  8 Ontologie-Aligning  26 Praedikatenlogik  17 Querymodell  23 RDF-Schema  14 RDFS-Triples  14 Reasoning  25 Regelsystem  16 schwergewichtige Ontologien  17'
 'Benutzern helfen, die richtigen bzw. relevanten Informationen zu finden. 5.2: Welches sind die Bestandteile eines RDF-Tripels? Nennen Sie zwei moegliche Darstellungsformen Ressource/Subjekt, Praedikat, Objekt. Als Graf oder als XML-Notation 5.3: Erlaeutern Sie das Prinzip der Reifikation anhand des folgenden N-Triples: N-Triple: <sh:SherlockHolmes> <s:supposes> <s:StatementOfSherlock> . <s:StatementOfSherlock> <http://www.w3.org/1999/02/22-rdf-syntax-ns#a> <rdf:Statement> . <s:StatementOfSherlock> <http://www.w3.org/1999/02/22-rdf-syntaxns# subject> <s:Gardener> . <s:StatementOfSherlock> <http://www.w3.org/1999/02/22-rdf-syntaxns# predicate> <s:hasKilled> . <s:StatementOfSherlock> <http://www.w3.org/1999/02/22-rdf-syntaxns# object> <s:Butler> .'
 'Einsendeaufgaben     5.1 : Nennen  Sie die  drei Problemfelder,  die sich im Semantic  Web  aus der  Heterogenitaet der Daten ergeben.         5.2 : Entwerfen  Sie zu den folgenden  Aussagen  einen  RDF-Graphen  (kann  als Anhang  eingereicht werden):     Die Restaurantkette Immerfrisch hat eine Partyservice -Filiale namens ""Snack -It"".  Diese nutzt zur Auslieferung einen Ford Transit mit dem Wert 22000€ und einen  Citroen Berlingo mit  dem Wert 11000€.  Hierfuer sind insgesamt drei Aushilfskraefte angestellt.']",Nein.,0.7929374546465141,0.6666666666666666,1.0,0.0,0.5698639130628056
Hat jede XML-Datei einen Wurzelknoten? Antworte mit Ja oder Nein.,Ja.,"['Inhaltsverzeichnis 1. Einleitung 2. XSL-Transformationen 3. XQuery 4. Anhang 5. Literatur 6. Loesungen der Selbsttestaufgaben'
 'Inhaltsverzeichnis 1. Einleitung 2. Motivation und grundlegende Konzepte von XML 3. Die Struktur von XML-Dokumenten 4. DTD und XSD 5. Konfliktvermeidung bei XML 6. Verweise per XML 7. Anhang 8. Literatur 9. Loesung der Selbsttestaufgaben'
 'Selbsttestaufgabe 3.1 Erlaeutern Sie den Unterschied zwischen einem wohlgeformten und einem gueltigen XML-Dokument'
 'Kurs 01877  Einsendeaufgaben  zu Kurseinheit  3  - 5 -      Frage  7      https://www.freeformatter.com/xpath -tester.html'
 'ausgegeben werden.       Frage  2    Fuellen  Sie die Luecke:  Eine XSL-Transformation  besteht  aus einer  Reihe  von einzelnen  Transformationsregeln, die Templates  genannt werden.       Frage  3    Wie heisst  das Wurzelelement  eines  Stylesheets?     • xml:stylesheet   • xsl:stylesheet   • xsl:transform   • xml: rootxsl   • xsl:transnorm     Frage  4    Bei XSLT werden verschiedene Arten von Knoten eines XM L-Dokuments unterschieden .  Nennen Sie diese :    • Wurzelknoten   • Elementknoten   • Attributknoten   • Textknoten   • Kommentarknoten   • Steuer anweisungsknoten   • Namensraumknote n']",Ja.,0.8153134292295435,0.5,1.0,0.4499999999775,1.0000000000000004
Ist ein XSLT-Dokument auch ein XML-Dokument? Antworte mit Ja oder Nein.,"Hallo!  Die Frage ist leicht zu beantworten: Nein, ein XSLT-Dokument ist kein XML-Dokument. Obwohl XSLT-Dateien aufgrund ihrer Syntax aehnlich wie XML-Dokumente aussehen, sind sie nicht die gleichen.  XSLT (Extensible Stylesheet Language) ist eine Markup-Sprache zum Transformieren von XML-Dokumenten und andere Datenquellen in verschiedene Formate. Ein XSLT-Dokument ist also ein Skript, das verwendet wird, um XML-Daten zu transformieren oder zu verarbeiten.  Vergleiche dies mit einem Cookbook-Rezept: Ein Rezept ist keine Speise, obwohl es eine Anleitung zum Zubereiten von Lebensmitteln ist. Aehnlich ist ein XSLT-Dokument kein XML-Dokument, obwohl es ein Skript fuer die Verarbeitung von XML-Daten ist.  Ich hoffe, diese Erklaerung hilft!","['Inhaltsverzeichnis 1. Einleitung 2. XSL-Transformationen 3. XQuery 4. Anhang 5. Literatur 6. Loesungen der Selbsttestaufgaben'
 'XML-Dokument. </Kapitel> </Inhalt> </buch>'
 'Inhaltsverzeichnis 1. Einleitung 2. Motivation und grundlegende Konzepte von XML 3. Die Struktur von XML-Dokumenten 4. DTD und XSD 5. Konfliktvermeidung bei XML 6. Verweise per XML 7. Anhang 8. Literatur 9. Loesung der Selbsttestaufgaben'
 'Selbsttestaufgabe 3.1 Erlaeutern Sie den Unterschied zwischen einem wohlgeformten und einem gueltigen XML-Dokument'
 'Kurs 01877  Einsendeaufgaben  zu Kurseinheit  3  - 5 -      Frage  7      https://www.freeformatter.com/xpath -tester.html']",Ja.,0.8101705055653273,0.16666666666666666,1.0,0.6388888888675925,0.45777454934574435
Koennen XSLT-Stylesheets im allgemeinen auf HTML-Dokumente angewendet werden? Antworte mit Ja oder Nein.,Nein.,"['6. Loesungen der Selbsttestaufgaben Selbsttestaufgabe 4.1 Beschreiben Sie kurz, was XSLT-Stylesheets sind, und warum man sie nicht auf HTML-Dateien anwenden kann. Ein XSLT-Dokument beinhaltet Regeln, nach denen ein anderes XML-Dokument transformiert werden kann. So ist es zum Beispiel moeglich, ein XML-Dokument zu einem HTML-Dokument zu transformieren, welches das XML-Dokument in Browsern in bestimmter Weise darstellt. Ein XSLT-Dokument wird u. a. auch Stylesheet genannt. Ein Stylesheet enthaelt Vorlagen oder Muster (engl. Templates), die jeweils aus einem Muster und einem Inhalt bestehen. XSLT benutzt bei der Transformation nur das im XML-Dokument vorhandene Markup. Inhaltsmodelle wie DTDs oder XML-Schemata werden nicht einbezogen.'
 'Kurs 01877  Einsendeaufgaben  zu Kurseinheit  4  - 1 -    Daten -, Dokumenten -, Informations - und  Wissensmanagement  im Internet:  Einsendeaufgaben zu Kurseinheit 4   Frage  1    Welche  der folgenden  Aussagen  ueber XSLT  ist zutreffend?     • Ein XSLT -Dokument  beinhaltet  Regeln,  nach  denen  beliebige  Datenformate  in XML-  Dokumente transformiert werden koennen.   • Es ist moeglich,  ein XML-Dokument  zu einem  HTML -Dokument  zu transformieren,   welches das XML -Dokument in Browsern in bestimmter Weise darstellt.   • XSLT  benutzt  bei der Transformation  nur das im XML-Dokument  vorhandene  Markup.   • Inhaltsmodelle  wie DTDs  oder XML-Schemata  nur bei zweimaligem  Parsen  einbezogen.   • Ein XSLT -Dokument  wird u. a. auch  Stylesheet  genannt.'
 ""Ein XSLT-Dokument wird u. a. auch Stylesheet genannt. Ein Stylesheet enthaelt Vorlagen oder Muster (engl. Templates), die jeweils aus einem Muster und einem Inhalt bestehen. XSLT benutzt bei der Transformation nur das im XML-Dokument vorhandene Markup. Inhaltsmodelle wie DTDs oder XML-Schemata werden nicht einbezogen. Genau aus diesem Grund koennen XSLT-Stylesheets auch nicht auf HTML-Dateien angewendet werden. Selbsttestaufgabe 4.2 Wie muss der Pfadausdruck aussehen zur Ausgabe aller Knoten (die nach Filmen benannt wurden), in denen ein actor mit der ID Batman vorkommt? Verwenden sie auch den xpath Tester auf der Seite https://www.freeformatter.com/xpath- tester.html Loesung: //actor[@id='Batman']/parent::*/parent::* Ausgabe: Element='<Batman>          <actors>""
 'Inhaltsverzeichnis 1. Einleitung 2. XSL-Transformationen 3. XQuery 4. Anhang 5. Literatur 6. Loesungen der Selbsttestaufgaben'
 'XSLT-Stylesheets sind selbst wohlgeformte XML-Dokumente. XSLT benutzt bei der Transformation nur das im XML-Dokument vorhandene Markup. Inhaltsmodelle wie DTDs oder XML-Schemata werden nicht einbezogen. Es erfolgt somit keine Pruefung auf Gueltigkeit, aber das Quelldokument muss wohlgeformt sein. Genau aus diesem Grund koennen XSLT-Stylesheets auch nicht auf HTML-Dateien angewendet werden, sehr wohl aber auf XHTML-Dokumente, weil diese ja die XML-Syntax beruecksichtigen muessen. XLST ist somit eine Programmiersprache und wird benutzt, um Inhalte eines XML- Dokumentes in ein Ergebnisdokument zu transformieren und fuer die Ausgabe in einem bestimmten Medium zu formatieren. Eine reine Transformation ist von Formatierungsaspekten voellig unabhaengig. Die Transformation eines XML-Dokumentes']",Nein.,0.818172693310666,0.5,0.8571428571428571,0.7555555555303703,1.0000000000000002
